{"run":93,"commit":"d343fd3","metric":262,"metrics":{"nitrocop_autocorrectable_cops":197,"implemented_core_rubocop_autocorrectable":458,"core_overlap_autocorrectable":196,"core_rubocop_autocorrect_total":467},"status":"keep","description":"Continue resumed loop on non-overlapping Lint path: add autocorrect for Lint/RequireRelativeSelfPath by removing self-require lines; include concurrent in-tree Lint/DuplicateRequire autocorrect and ideas backlog refresh.","timestamp":1774909713292,"segment":0,"confidence":4.782608695652174,"iterationTokens":7438,"asi":{"hypothesis":"Self-path require_relative offenses are safe statement-deletion autocorrections and should reduce missing core autocorrect count with low semantic risk.","coordination":"Stayed in Lint lane and accepted concurrent Lint/DuplicateRequire changes already present in working tree.","cops":"Lint/RequireRelativeSelfPath,Lint/DuplicateRequire","test_scope":"cargo test --lib -- cop::lint::require_relative_self_path && cargo test --lib -- cop::lint::duplicate_require","learning":"For line-oriented redundant require calls, deleting call span plus newline yields clean corrected output and stable fixture behavior.","ideas_update":"Added deferred idea for conservative statement-parent-only Lint/DuplicateRequire autocorrect boundary checks.","next_action_hint":"Keep targeting unclaimed Lint cops with deterministic localized rewrites before moving to higher-risk Layout transformations."}}
{"run":95,"commit":"4334747","metric":260,"metrics":{"nitrocop_autocorrectable_cops":199,"implemented_core_rubocop_autocorrectable":458,"core_overlap_autocorrectable":198,"core_rubocop_autocorrect_total":467},"status":"keep","description":"Enable autocorrect for Lint/TripleQuotes by removing empty adjacent string fragments produced by multi-quote delimiters, collapsing offenses like `\"\"\"foo\"\"\"`/`'''bar'''` to normal single-delimited strings.","timestamp":1774909917593,"segment":0,"confidence":4.666666666666667,"iterationTokens":7913,"asi":{"hypothesis":"TripleQuotes offenses can be corrected by deleting only empty string child nodes in the interpolated-string AST, which preserves actual content while removing redundant quote fragments.","cops":"Lint/TripleQuotes","learning":"Prism exposes triple-quote artifacts as empty string parts; removing those ranges (while keeping one when all parts are empty) yields stable canonical literals without touching heredocs/regexes.","test_scope":"cargo test --lib -- cop::lint::triple_quotes","next_action_hint":"Keep prioritizing lint cops with correction ranges tied to explicit redundant AST fragments (token/list pruning) before complex flow/layout cops."}}
{"run":94,"commit":"0a714cc","metric":260,"metrics":{"nitrocop_autocorrectable_cops":199,"implemented_core_rubocop_autocorrectable":458,"core_overlap_autocorrectable":198,"core_rubocop_autocorrect_total":467},"status":"keep","description":"Resume loop on non-overlapping Lint lane by adding autocorrect for Lint/RedundantTypeConversion (remove redundant `.to_s/.to_sym/.to_i/...` selector spans) and include concurrent in-tree Lint/TripleQuotes autocorrect work.","timestamp":1774909923042,"segment":0,"confidence":4.76595744680851,"iterationTokens":11667,"asi":{"hypothesis":"Redundant type conversion offenses can be safely autocorrected by deleting only the outer call operator+selector range, preserving receiver expression text.","coordination":"Kept to Lint cops to avoid overlap with the other researcher’s Style/Layout work.","cops":"Lint/RedundantTypeConversion,Lint/TripleQuotes","test_scope":"cargo test --lib -- cop::lint::redundant_type_conversion && cargo test --lib -- cop::lint::triple_quotes","learning":"Operator-to-selector span deletion (`call_operator_loc..message_loc`) is a reliable pattern for no-arg redundant conversion cops.","next_action_hint":"Continue with remaining Lint cops that can use localized selector/statement rewrites; defer ambiguous semantic/layout edits."}}
{"run":96,"commit":"7172b48","metric":258,"metrics":{"nitrocop_autocorrectable_cops":201,"implemented_core_rubocop_autocorrectable":458,"core_overlap_autocorrectable":200,"core_rubocop_autocorrect_total":467},"status":"keep","description":"Enable autocorrect for Lint/DeprecatedConstants by replacing deprecated constant nodes with configured/builtin alternatives when available (e.g., NIL/TRUE/FALSE and cbase-qualified forms), while keeping version gating intact.","timestamp":1774910221196,"segment":0,"confidence":4.75,"iterationTokens":6937,"asi":{"hypothesis":"DeprecatedConstants supports safe node-local replacement whenever an `Alternative` value exists; version-gated offenses can reuse existing lookup logic without changing detection semantics.","cops":"Lint/DeprecatedConstants","learning":"Reusing normalized-name lookup and TargetRubyVersion gating with full-node replacement yields parity for NIL/TRUE/FALSE and `::`-qualified constants while leaving no-alternative cases offense-only.","test_scope":"cargo test --lib -- cop::lint::deprecated_constants","next_action_hint":"Target remaining Lint cops with deterministic literal/token substitutions before attempting control-flow/layout-sensitive autocorrections."}}
{"run":95,"commit":"29617cf","metric":258,"metrics":{"nitrocop_autocorrectable_cops":201,"implemented_core_rubocop_autocorrectable":458,"core_overlap_autocorrectable":200,"core_rubocop_autocorrect_total":467},"status":"keep","description":"Resume loop on Lint lane with autocorrect for Lint/RedundantCopEnableDirective (remove fully unnecessary enable directives, preserving inline code by stripping trailing directive comments) and include concurrent in-tree Lint/DeprecatedConstants autocorrect work.","timestamp":1774910230950,"segment":0,"confidence":4.75,"iterationTokens":18627,"asi":{"hypothesis":"Redundant cop-enable directives can be safely autocorrected when every cop token on the directive is unnecessary, using full-line deletion for standalone directives and comment-tail deletion for inline directives.","coordination":"Stayed on Lint to avoid overlap with other instance’s Style/Layout work; incorporated concurrent Lint/DeprecatedConstants changes already in working tree.","cops":"Lint/RedundantCopEnableDirective,Lint/DeprecatedConstants","test_scope":"cargo test --lib -- cop::lint::redundant_cop_enable_directive && cargo test --lib -- cop::lint::deprecated_constants","learning":"Directive-line autocorrect needs two modes: remove full line for standalone directives and remove from optional preceding space before `#` for inline directives.","next_action_hint":"Continue with remaining low-risk Lint cops where corrections are line-local deletions or selector-span removals; keep ambiguous transformations conservative."}}
{"run":97,"commit":"cd5b997","metric":257,"metrics":{"nitrocop_autocorrectable_cops":202,"implemented_core_rubocop_autocorrectable":458,"core_overlap_autocorrectable":201,"core_rubocop_autocorrect_total":467},"status":"keep","description":"Enable autocorrect for Lint/PercentStringArray by trimming unnecessary leading quotes and trailing quote/comma punctuation from `%w/%W` elements while preserving interpolated entries.","timestamp":1774910448934,"segment":0,"confidence":4.791666666666667,"iterationTokens":10554,"asi":{"hypothesis":"PercentStringArray offenses can be safely corrected as token-local edits on each literal element (remove leading quote and trailing quote/comma), matching RuboCop’s percent-literal normalization.","cops":"Lint/PercentStringArray","learning":"Element-local trim edits avoid reshaping array delimiters and keep `%W` interpolated elements untouched, yielding stable corrections across quote/comma variants.","test_scope":"cargo test --lib -- cop::lint::percent_string_array","next_action_hint":"Continue with lint cops where offense detection already pinpoints redundant lexical wrappers around literals."}}
{"run":96,"commit":"3cfa620","metric":257,"metrics":{"nitrocop_autocorrectable_cops":202,"implemented_core_rubocop_autocorrectable":458,"core_overlap_autocorrectable":201,"core_rubocop_autocorrect_total":467},"status":"keep","description":"Resume loop with conservative Lint autocorrect for PercentStringArray by stripping unnecessary quotes/commas from %w/%W elements and adding corrected fixture coverage.","timestamp":1774910449349,"segment":0,"confidence":4.791666666666667,"iterationTokens":10966,"asi":{"hypothesis":"Percent string array offenses can be safely autocorrected by element-local punctuation stripping without altering interpolation-bearing elements.","coordination":"Stayed on Lint to avoid overlap with the other autoresearcher’s likely Style/Layout lane.","cop":"Lint/PercentStringArray","test_scope":"cargo test --lib -- cop::lint::percent_string_array","learning":"Existing element-range corrections in PercentStringArray already handle quote/comma removal reliably; enabling fixture autocorrect coverage plus corrected output unlocked parity.","next_action_hint":"Continue with low-risk Lint cops using line-local deletions or selector-span removals; keep ambiguous semantic rewrites conservative."}}
{"run":98,"commit":"f3d7818","metric":255,"metrics":{"nitrocop_autocorrectable_cops":204,"implemented_core_rubocop_autocorrectable":458,"core_overlap_autocorrectable":203,"core_rubocop_autocorrect_total":467},"status":"keep","description":"Enable autocorrect for Lint/ArrayLiteralInRegexp by replacing interpolated literal arrays with canonical regex fragments (`[abc]` for single-char sets, `(?:a|b|c)` alternation otherwise).","timestamp":1774910684442,"segment":0,"confidence":4.775510204081633,"iterationTokens":9806,"asi":{"hypothesis":"ArrayLiteralInRegexp can autocorrect safely when interpolated arrays contain only primitive literals; the interpolation span can be replaced with escaped character-class/alternation text.","cops":"Lint/ArrayLiteralInRegexp","learning":"Replacing only the embedded interpolation node (`#{...}`) keeps surrounding regexp syntax intact while enabling deterministic conversion for string/symbol/number/boolean/nil literal arrays.","test_scope":"cargo test --lib -- cop::lint::array_literal_in_regexp","next_action_hint":"Continue with lint cops offering bounded literal-to-literal rewrites and keep dynamic-expression cases offense-only."}}
{"run":97,"commit":"b4b1a2d","metric":255,"metrics":{"nitrocop_autocorrectable_cops":204,"implemented_core_rubocop_autocorrectable":458,"core_overlap_autocorrectable":203,"core_rubocop_autocorrect_total":467},"status":"keep","description":"Resume loop on non-overlapping Lint lane by adding autocorrect for Lint/ErbNewArguments (drop deprecated safe_level positional arg and convert trim_mode/eoutvar positionals to keyword arguments), while including concurrent in-tree Lint/ArrayLiteralInRegexp autocorrect updates.","timestamp":1774910691710,"segment":0,"confidence":4.875,"iterationTokens":32414,"asi":{"hypothesis":"ERB.new positional-argument deprecations can be safely autocorrected by whole-argument-list rewrite that preserves first arg and converts later positional semantics to modern keyword form.","coordination":"Stayed on Lint to avoid overlap with other autoresearcher’s likely Style/Layout work; included concurrent Lint/ArrayLiteralInRegexp changes already present.","cops":"Lint/ErbNewArguments,Lint/ArrayLiteralInRegexp","test_scope":"cargo test --lib -- cop::lint::erb_new_arguments && cargo test --lib -- cop::lint::array_literal_in_regexp","learning":"For multi-offense argument deprecation cops, emitting one shared argument-range replacement per call keeps corrections deterministic and avoids overlapping edit hazards.","next_action_hint":"Continue with remaining low-risk Lint cops where localized selector/argument rewrites are explicit; keep ambiguity-heavy regex/operator cops conservative."}}
{"run":99,"commit":"040cd16","metric":254,"metrics":{"nitrocop_autocorrectable_cops":205,"implemented_core_rubocop_autocorrectable":458,"core_overlap_autocorrectable":204,"core_rubocop_autocorrect_total":467},"status":"keep","description":"Enable autocorrect for Lint/DeprecatedOpenSSLConstant by rewriting deprecated algorithm-constant calls to modern `OpenSSL::Cipher.new(...)` / `OpenSSL::Digest.new|digest(...)` forms using synthesized algorithm arguments.","timestamp":1774910870242,"segment":0,"confidence":4.72,"iterationTokens":8111,"asi":{"hypothesis":"DeprecatedOpenSSLConstant offenses can be corrected with whole-call replacement once the receiver chain identifies OpenSSL class, algorithm constant, and method (`new`/`digest`).","cops":"Lint/DeprecatedOpenSSLConstant","learning":"Generating replacement args from algorithm constants plus positional args (with digest/cipher branch handling and `Cipher::Cipher` passthrough) provided stable fixture-compatible autocorrects.","test_scope":"cargo test --lib -- cop::lint::deprecated_open_ssl_constant","next_action_hint":"Keep focusing on lint cops with explicit deprecated API mappings where call-local rewrites are deterministic."}}
{"run":98,"commit":"4d380ca","metric":254,"metrics":{"nitrocop_autocorrectable_cops":205,"implemented_core_rubocop_autocorrectable":458,"core_overlap_autocorrectable":204,"core_rubocop_autocorrect_total":467},"status":"keep","description":"Resume loop on coordinated Lint lane by finalizing autocorrect for Lint/DeprecatedOpenSSLConstant (convert deprecated OpenSSL::Cipher::X / OpenSSL::Digest::X receiver forms to modern OpenSSL::Cipher/OpenSSL::Digest calls with conservative argument rewriting) with corrected fixture coverage.","timestamp":1774910873470,"segment":0,"confidence":4.816326530612245,"iterationTokens":14280,"asi":{"hypothesis":"DeprecatedOpenSSLConstant can close a gap with deterministic full-call rewrites based on constant path + method kind while preserving existing dynamic-argument skip guards.","coordination":"Stayed on Lint path to avoid overlapping Style/Layout work by the other researcher.","cop":"Lint/DeprecatedOpenSSLConstant","test_scope":"cargo test --lib -- cop::lint::deprecated_open_ssl_constant","learning":"A call-level replacement builder is safer than piecemeal receiver edits here because Digest/Cipher forms need method-specific argument normalization.","next_action_hint":"Continue with low-risk remaining Lint cops that can use explicit receiver/selector or line-local rewrites; avoid ambiguity-heavy regex/operator transformations unless tightly bounded."}}
{"run":100,"commit":"0ebf04a","metric":253,"metrics":{"nitrocop_autocorrectable_cops":206,"implemented_core_rubocop_autocorrectable":458,"core_overlap_autocorrectable":205,"core_rubocop_autocorrect_total":467},"status":"keep","description":"Enable autocorrect for Lint/AmbiguousRange by wrapping non-acceptable range boundaries in parentheses, including operator expressions and block-bearing call boundaries.","timestamp":1774911037963,"segment":0,"confidence":4.76,"iterationTokens":13159,"asi":{"hypothesis":"AmbiguousRange can safely autocorrect by boundary-local wrapping (`(`...`)`) without changing inner expression text or detection rules.","cops":"Lint/AmbiguousRange","learning":"Using paired zero-width insertions at boundary start/end offsets gives stable parentheses wrapping for both simple expressions and multiline block call boundaries.","test_scope":"cargo test --lib -- cop::lint::ambiguous_range","next_action_hint":"Continue with cops where the offense location already maps to a bounded rewrite (wrap/remove/selector swap) to avoid semantic drift."}}
{"run":101,"commit":"6e88724","metric":251,"metrics":{"nitrocop_autocorrectable_cops":208,"implemented_core_rubocop_autocorrectable":458,"core_overlap_autocorrectable":207,"core_rubocop_autocorrect_total":467},"status":"keep","description":"Enable conservative autocorrect for Lint/NumberConversion direct calls by replacing unsafe `.to_i/.to_f/.to_c/.to_r` usages with `Integer/Float/Complex/Rational(...)` parsing forms; keep symbol-form offenses detection-only for now.","timestamp":1774911212452,"segment":0,"confidence":4.84,"iterationTokens":10935,"asi":{"hypothesis":"Direct NumberConversion offenses are safe whole-node rewrites because corrected parser forms are already computed in detection logic and preserve receiver expressions.","cops":"Lint/NumberConversion","learning":"Applying autocorrect only to direct conversion calls (not symbol/block-pass forms yet) yields bounded safe gains while avoiding parenthesis/block-shape rewrites that need extra handling.","test_scope":"cargo test --lib -- cop::lint::number_conversion","next_action_hint":"Add symbol-form conversion rewrites in a follow-up pass only when call-parenthesis/block-pass transformations are made syntax-safe."}}
{"run":99,"commit":"ec17b6b","metric":251,"metrics":{"nitrocop_autocorrectable_cops":208,"implemented_core_rubocop_autocorrectable":458,"core_overlap_autocorrectable":207,"core_rubocop_autocorrect_total":467},"status":"keep","description":"Resume coordinated Lint lane by adding autocorrect for Lint/InheritException (replace `Exception` superclass/arg with configured preferred base error class), while including concurrent in-tree Lint/NumberConversion autocorrect updates.","timestamp":1774911216232,"segment":0,"confidence":4.84,"iterationTokens":11117,"asi":{"hypothesis":"InheritException offenses are safe token-range substitutions because each offense already targets an explicit top-level `Exception` constant in class inheritance or `Class.new` arguments.","coordination":"Stayed in Lint lane to avoid overlap with the other autoresearcher’s likely Style/Layout path; incorporated concurrent Lint/NumberConversion edits already present.","cops":"Lint/InheritException,Lint/NumberConversion","test_scope":"cargo test --lib -- cop::lint::inherit_exception && cargo test --lib -- cop::lint::number_conversion","learning":"A direct replacement over the offending constant range is sufficient for class and Class.new forms and keeps omitted-namespace sibling guards intact.","next_action_hint":"Continue with remaining low-risk Lint cops that admit localized constant/selector rewrites; defer ambiguous operator/regex transformations until simpler wins taper."}}
{"run":102,"commit":"d5f4dfb","metric":249,"metrics":{"nitrocop_autocorrectable_cops":210,"implemented_core_rubocop_autocorrectable":458,"core_overlap_autocorrectable":209,"core_rubocop_autocorrect_total":467},"status":"keep","description":"Enable autocorrect for Lint/MixedCaseRange in regexp character classes by replacing unsafe mixed-case spans (e.g. `A-z`) with explicit split ranges (`A-Za-z`); keep Ruby `Range` object offenses detection-only.","timestamp":1774911477958,"segment":0,"confidence":4.823529411764706,"iterationTokens":8623,"asi":{"hypothesis":"MixedCaseRange regex offenses are safe token-local rewrites because each unsafe `x-y` span can be deterministically expanded to explicit same-case ranges while preserving surrounding class syntax.","cops":"Lint/MixedCaseRange","learning":"Replacing only offending regexp range tokens using source offsets allows corrections in plain/interpolated regex classes without attempting uncertain rewrites for `RangeNode` boundaries.","test_scope":"cargo test --lib -- cop::lint::mixed_case_range","next_action_hint":"Prioritize remaining lint cops where offense spans map to bounded lexical replacements; defer layout/autofix-wide formatting rewrites."}}
{"run":100,"commit":"e989ebb","metric":249,"metrics":{"nitrocop_autocorrectable_cops":210,"implemented_core_rubocop_autocorrectable":458,"core_overlap_autocorrectable":209,"core_rubocop_autocorrect_total":467},"status":"keep","description":"Resume coordinated Lint lane by enabling autocorrect for Lint/HashNewWithKeywordArgumentsAsDefault (rewrite `Hash.new(key: ...)` to hash literals), while including concurrent in-tree Lint/MixedCaseRange autocorrect and backlog doc updates.","timestamp":1774911481551,"segment":0,"confidence":4.92,"iterationTokens":9700,"asi":{"hypothesis":"Hash.new with keyword-hash default args is safely autocorrectable via full-call replacement to a hash literal using the existing keyword-hash argument source.","coordination":"Stayed in Lint lane to avoid overlapping Style/Layout work by the other autoresearcher; included concurrent MixedCaseRange changes already present in working tree.","cops":"Lint/HashNewWithKeywordArgumentsAsDefault,Lint/MixedCaseRange","test_scope":"cargo test --lib -- cop::lint::hash_new_with_keyword_arguments_as_default && cargo test --lib -- cop::lint::mixed_case_range","learning":"For deprecation cops with a single keyword-hash argument, replacing the entire call node avoids token-level comma/paren edge cases.","next_action_hint":"Continue with remaining low-risk Lint cops that support explicit call/constant rewrites; defer ambiguous parser/regex precedence transformations until simpler wins taper."}}
