{"run":81,"commit":"43489f7","metric":278,"metrics":{"nitrocop_autocorrectable_cops":181,"implemented_core_rubocop_autocorrectable":458,"core_overlap_autocorrectable":180,"core_rubocop_autocorrect_total":467},"status":"keep","description":"Enable autocorrect for Style/RedundantFetchBlock by replacing redundant `fetch(key) { literal/default }` block forms (including scenario fixtures) with direct `fetch(key, default)` calls.","timestamp":1774906707293,"segment":0,"confidence":4.7,"iterationTokens":4705,"asi":{"hypothesis":"RedundantFetchBlock offenses already compute stable key/default expressions, so selector-to-block-end replacement can safely produce direct `fetch` default-argument calls.","cops":"Style/RedundantFetchBlock","learning":"Using custom scenario autocorrect fixtures confirmed stable rewrites for literal defaults, frozen-string guarded cases, and unary-minus literal spacing (`- 1`) without widening detection.","test_scope":"cargo test --lib -- cop::style::redundant_fetch_block","next_action_hint":"Continue with strict-subset Style/EachWithObject autocorrect if block-param swap + trailing accumulator removal can be bounded safely."}}
{"run":82,"commit":"246d7e6","metric":277,"metrics":{"nitrocop_autocorrectable_cops":182,"implemented_core_rubocop_autocorrectable":458,"core_overlap_autocorrectable":181,"core_rubocop_autocorrect_total":467},"status":"keep","description":"Enable conservative autocorrect for Style/EachWithObject by rewriting flagged `inject/reduce` selectors to `each_with_object`, swapping two required block params, and removing trailing accumulator return expressions.","timestamp":1774906897464,"segment":0,"confidence":4.634146341463414,"iterationTokens":6986,"asi":{"hypothesis":"For existing EachWithObject offenses, a bounded three-edit transform (selector swap, param swap, trailing accumulator removal) is sufficient to reach valid canonical form.","cops":"Style/EachWithObject","learning":"Restricting autocorrect to blocks with exactly two required parameters avoided unsafe rewrites while matching fixture behavior for brace and do/end blocks.","test_scope":"cargo test --lib -- cop::style::each_with_object","next_action_hint":"Look for next style cops with similarly explicit canonical replacements and low overlap risk before entering layout-heavy backlog."}}
{"run":83,"commit":"e91e4ac","metric":276,"metrics":{"nitrocop_autocorrectable_cops":183,"implemented_core_rubocop_autocorrectable":458,"core_overlap_autocorrectable":182,"core_rubocop_autocorrect_total":467},"status":"keep","description":"Enable autocorrect for Style/ZeroLengthPredicate by rewriting flagged `.length/.size` zero/nonzero checks (`zero?`, `== 0`, `< 1`, `!= 0`, `> 0`, and swapped forms) to `empty?`/`!empty?`.","timestamp":1774907184113,"segment":0,"confidence":4.571428571428571,"iterationTokens":12132,"asi":{"hypothesis":"ZeroLengthPredicate offenses can be safely converted to `empty?` predicates when existing guards already exclude safe-navigation and non-collection receivers.","cops":"Style/ZeroLengthPredicate","learning":"Centralizing replacement derivation from the underlying `.length/.size` receiver yielded deterministic full-expression rewrites across direct and swapped comparison forms.","test_scope":"cargo test --lib -- cop::style::zero_length_predicate","next_action_hint":"Continue with style cops that already compute a preferred predicate/expression and only need bounded correction emission."}}
{"run":84,"commit":"4f0c9a2","metric":275,"metrics":{"nitrocop_autocorrectable_cops":184,"implemented_core_rubocop_autocorrectable":458,"core_overlap_autocorrectable":183,"core_rubocop_autocorrect_total":467},"status":"keep","description":"Enable autocorrect for Style/ReverseFind (Ruby >= 4.0) by rewriting `reverse.find`/`reverse_each.find|detect` selector spans to `rfind`, with config-aware autocorrect fixture coverage.","timestamp":1774907431679,"segment":0,"confidence":4.619047619047619,"iterationTokens":14293,"asi":{"hypothesis":"ReverseFind offenses are safe selector-span rewrites because existing detection already constrains to no-arg reverse/reverse_each + find/detect with compatible block forms.","cops":"Style/ReverseFind","learning":"Replacing from inner receiver selector through outer method selector (`reverse...find` -> `rfind`) preserved multiline chains and block forms while respecting Ruby version gating.","test_scope":"cargo test --lib -- cop::style::reverse_find","next_action_hint":"Continue with style cops that expose deterministic selector/tail replacement ranges and explicit guard conditions."}}
{"run":85,"commit":"72be5bb","metric":274,"metrics":{"nitrocop_autocorrectable_cops":185,"implemented_core_rubocop_autocorrectable":458,"core_overlap_autocorrectable":184,"core_rubocop_autocorrect_total":467},"status":"keep","description":"Enable autocorrect for Style/RedundantFilterChain by rewriting `select/filter/find_all` selector to the target predicate (`any?`/`none?`/`one?`/`many?`) and removing trailing predicate-chain call.","timestamp":1774907641650,"segment":0,"confidence":4.666666666666667,"iterationTokens":7568,"asi":{"hypothesis":"RedundantFilterChain offenses can be corrected with two localized edits because existing matching already isolates filter-selector and trailing predicate positions.","cops":"Style/RedundantFilterChain","learning":"Pairing selector replacement on the filter call with removal of `.predicate` chain segment produced stable autocorrect output while preserving existing it/numblock and ActiveSupport guards.","test_scope":"cargo test --lib -- cop::style::redundant_filter_chain","next_action_hint":"Continue with similarly bounded style chain canonicalizations; keep ambiguity-sensitive lint and layout work staged."}}
{"run":86,"commit":"b0d123f","metric":273,"metrics":{"nitrocop_autocorrectable_cops":186,"implemented_core_rubocop_autocorrectable":458,"core_overlap_autocorrectable":185,"core_rubocop_autocorrect_total":467},"status":"keep","description":"Enable autocorrect for Style/ModuleFunction by rewriting `extend self` to `module_function` under module_function style while preserving existing private-directive and style guards.","timestamp":1774907904905,"segment":0,"confidence":4.604651162790698,"iterationTokens":20174,"asi":{"hypothesis":"ModuleFunction offenses are safe whole-call rewrites in module_function style because existing detection already identifies plain `extend self` directives in eligible module bodies.","cops":"Style/ModuleFunction","learning":"Adding correction emission at the directive call range (`extend self` -> `module_function`) produced stable fixture autocorrect output without changing existing style/private exclusion behavior.","test_scope":"cargo test --lib -- cop::style::module_function","next_action_hint":"Continue with style cops where detection already computes canonical replacement forms and edits can stay call-local."}}
{"run":87,"commit":"e6f1f1c","metric":272,"metrics":{"nitrocop_autocorrectable_cops":187,"implemented_core_rubocop_autocorrectable":458,"core_overlap_autocorrectable":186,"core_rubocop_autocorrect_total":467},"status":"keep","description":"Enable autocorrect for Style/ComparableClamp by rewriting matched `if/elsif/else` clamp patterns to `x.clamp(min, max)` full-expression replacements.","timestamp":1774908121899,"segment":0,"confidence":4.545454545454546,"iterationTokens":12271,"asi":{"hypothesis":"ComparableClamp offenses already encode enough branch-shape information to derive unambiguous `(x, min, max)` parts and replace the whole conditional safely.","cops":"Style/ComparableClamp","learning":"Extracting per-condition bound kind (min vs max) from comparator orientation/body alignment enabled robust clamp reconstruction across operand-order variants.","test_scope":"cargo test --lib -- cop::style::comparable_clamp","next_action_hint":"Continue with branch/selector-local style cops where canonical replacement text can be computed directly from matched AST parts."}}
{"run":88,"commit":"589108c","metric":271,"metrics":{"nitrocop_autocorrectable_cops":188,"implemented_core_rubocop_autocorrectable":458,"core_overlap_autocorrectable":187,"core_rubocop_autocorrect_total":467},"status":"keep","description":"Enable autocorrect for Style/ComparableBetween by rewriting matched logical bound comparisons (`x >= min && x <= max` variants) to `x.between?(min, max)` full-expression replacements.","timestamp":1774908304102,"segment":0,"confidence":4.590909090909091,"iterationTokens":5598,"asi":{"hypothesis":"ComparableBetween offenses can be safely corrected when comparison normalization identifies a shared value with distinct min/max bounds.","cops":"Style/ComparableBetween","learning":"Normalizing each comparison into small/big sides allowed deterministic extraction of `(value, min, max)` across operand-order variants for direct `between?` replacement.","test_scope":"cargo test --lib -- cop::style::comparable_between","next_action_hint":"Keep targeting arithmetic/comparison style cops with similarly explicit canonical replacements before moving into layout-heavy backlog."}}
{"run":89,"commit":"adf0618","metric":270,"metrics":{"nitrocop_autocorrectable_cops":189,"implemented_core_rubocop_autocorrectable":458,"core_overlap_autocorrectable":188,"core_rubocop_autocorrect_total":467},"status":"keep","description":"Enable autocorrect for Style/MapToHash by rewriting `map/collect ... .to_h` chains to `to_h` with block pass-through, including destructured block-arg normalization.","timestamp":1774908543884,"segment":0,"confidence":4.636363636363637,"iterationTokens":7762,"asi":{"hypothesis":"MapToHash offenses are safe chain-local rewrites because existing detection already constrains to `map/collect` feeding a no-arg `to_h` call with compatible block forms.","cops":"Style/MapToHash","learning":"Applying two span edits (inner selector `map/collect` -> `to_h`, remove trailing `.to_h`) plus optional `|(k,v)|` destructuring unwrapping produced stable autocorrect output for literal and symbol block-pass forms.","test_scope":"cargo test --lib -- cop::style::map_to_hash","next_action_hint":"Continue with style chain canonicalizations that have explicit selector/tail replacement boundaries and no additional semantic inference."}}
{"run":89,"commit":"5ac38f3","metric":268,"metrics":{"nitrocop_autocorrectable_cops":191,"implemented_core_rubocop_autocorrectable":458,"core_overlap_autocorrectable":190,"core_rubocop_autocorrect_total":467},"status":"keep","description":"Coordinate non-overlap by implementing autocorrect for Lint/RedundantDirGlobSort (remove `.sort` after Dir.glob/Dir[] on Ruby >=3.0) while including concurrent Style/NilLambda autocorrect work already present in tree; added corrected fixtures and fixture autocorrect tests.","timestamp":1774908773335,"segment":0,"confidence":4.7272727272727275,"iterationTokens":5598,"asi":{"hypothesis":"Taking an unclaimed low-risk Lint selector-span removal cop should reduce the core autocorrect gap without overlapping the other autoresearcher's active Style cop.","coordination":"Avoided touching Style/NilLambda and implemented Lint/RedundantDirGlobSort instead.","cops":"Lint/RedundantDirGlobSort,Style/NilLambda","test_scope":"cargo test --lib -- cop::lint::redundant_dir_glob_sort && cargo test --lib -- cop::style::nil_lambda","learning":"Removing from call operator through `sort` selector (`.sort`) is sufficient and deterministic for redundant sort offenses.","next_action_hint":"Continue claiming distinct cops from the remaining list (prefer Lint/Style token/selector rewrites not currently in-flight by the other instance)."}}
{"run":90,"commit":"b9df23e","metric":268,"metrics":{"nitrocop_autocorrectable_cops":191,"implemented_core_rubocop_autocorrectable":458,"core_overlap_autocorrectable":190,"core_rubocop_autocorrect_total":467},"status":"keep","description":"Add autocorrect support for Style/NilLambda (remove nil-only lambda/proc bodies) and include Lint/RedundantDirGlobSort selector-tail cleanup from current tree, reducing remaining core autocorrect gap.","timestamp":1774908799687,"segment":0,"confidence":4.622222222222222,"iterationTokens":6642,"asi":{"hypothesis":"Nil-return lambda/proc offenses can be corrected by deleting only the nil body span (with surrounding-space/line handling), while retaining original lambda/proc delimiters.","cops":"Style/NilLambda,Lint/RedundantDirGlobSort","learning":"Body-range deletion with single-line whitespace trimming and multi-line whole-line removal produced stable empty lambda/proc forms and closed an additional gap in current tree state.","test_scope":"cargo test --lib -- cop::style::nil_lambda","next_action_hint":"Prioritize remaining chain/selector cops where detection already identifies canonical replacement spans; avoid semantics-heavy layout rewrites for now."}}
{"run":91,"commit":"b0d03b3","metric":267,"metrics":{"nitrocop_autocorrectable_cops":192,"implemented_core_rubocop_autocorrectable":458,"core_overlap_autocorrectable":191,"core_rubocop_autocorrect_total":467},"status":"keep","description":"Enable autocorrect for Lint/DeprecatedClassMethods with targeted replacements (`exists?`→`exist?`, `ENV.clone/dup`→`to_h`, `ENV.freeze`→receiver, `iterator?`→`block_given?`, `attr ... true/false`→`attr_accessor/reader`), while leaving Socket variants offense-only.","timestamp":1774909005574,"segment":0,"confidence":4.565217391304348,"iterationTokens":16603,"asi":{"hypothesis":"DeprecatedClassMethods can safely autocorrect via selector/full-call rewrites for non-socket patterns because replacement text is fully determined by existing match groups.","cops":"Lint/DeprecatedClassMethods","learning":"Keeping Socket offenses non-corrected (RuboCop parity) while correcting the deterministic ENV/File/Dir/iterator?/attr cases improved overlap without broad semantic edits.","test_scope":"cargo test --lib -- cop::lint::deprecated_class_methods","next_action_hint":"Continue with cops where message-time preferred form is directly computable from matched node spans and avoid transformations requiring dataflow reasoning."}}
{"run":90,"commit":"410fd2c","metric":267,"metrics":{"nitrocop_autocorrectable_cops":192,"implemented_core_rubocop_autocorrectable":458,"core_overlap_autocorrectable":191,"core_rubocop_autocorrect_total":467},"status":"keep","description":"Stay on a separate Lint lane from the other researcher and add conservative autocorrect for Lint/DeprecatedClassMethods (`exists?`->`exist?`, `ENV.clone/dup`->`to_h`, `ENV.freeze`->`ENV`, `iterator?`->`block_given?`, `attr` boolean forms -> accessor/reader), leaving Socket rewrites offense-only.","timestamp":1774909007369,"segment":0,"confidence":4.666666666666667,"iterationTokens":15635,"asi":{"hypothesis":"A conservative subset autocorrect for DeprecatedClassMethods should yield a safe -1 without overlapping in-flight Style work.","coordination":"Deliberately targeted Lint while avoiding cops already being edited by the other instance.","cop":"Lint/DeprecatedClassMethods","test_scope":"cargo test --lib -- cop::lint::deprecated_class_methods","learning":"Message-loc selector rewrites and full-call replacement for `attr`/`ENV.freeze` cover most deprecated forms safely; socket deprecations are best left offense-only for now.","next_action_hint":"Continue with unclaimed Lint cops that allow selector or bounded-range rewrites (e.g., duplicate/redundant require-family with strict safety guards)."}}
{"run":91,"commit":"bafe6f6","metric":265,"metrics":{"nitrocop_autocorrectable_cops":194,"implemented_core_rubocop_autocorrectable":458,"core_overlap_autocorrectable":193,"core_rubocop_autocorrect_total":467},"status":"keep","description":"Resume loop with a separate Lint track: implement autocorrect for Lint/RedundantRequireStatement by removing redundant `require` statements (including trailing newline handling), while picking up concurrent in-tree Style/CommentAnnotation autocorrect work from the other instance.","timestamp":1774909230592,"segment":0,"confidence":4.6521739130434785,"iterationTokens":4201,"asi":{"hypothesis":"A bounded full-statement deletion autocorrect for RedundantRequireStatement should be safe and reduce missing core autocorrect cops without overfitting.","coordination":"Stayed on Lint to avoid overlap; concurrent Style/CommentAnnotation edits were already present in working tree.","cop":"Lint/RedundantRequireStatement","test_scope":"cargo test --lib -- cop::lint::redundant_require_statement","learning":"For statement-removal cops, deleting the call span plus a following newline avoids blank-line artifacts in corrected fixtures.","next_action_hint":"Continue claiming unowned Lint cops with deterministic selector/statement rewrites; keep ambiguous semantic transforms conservative."}}
{"run":92,"commit":"016572a","metric":265,"metrics":{"nitrocop_autocorrectable_cops":194,"implemented_core_rubocop_autocorrectable":458,"core_overlap_autocorrectable":193,"core_rubocop_autocorrect_total":467},"status":"keep","description":"Advance the lint/style autocorrect lane by adding conservative autocorrect for Lint/RedundantRequireStatement and Style/CommentAnnotation (normalize annotation prefix formatting only when a note exists).","timestamp":1774909272704,"segment":0,"confidence":4.6521739130434785,"iterationTokens":13559,"asi":{"hypothesis":"Both redundant require lines and malformed annotation prefixes have deterministic local replacements, allowing safe autocorrect without semantic rewrites.","cops":"Lint/RedundantRequireStatement,Style/CommentAnnotation","learning":"Keeping CommentAnnotation corrections limited to the annotation-prefix span (and skipping no-note cases) mirrors RuboCop behavior while avoiding broad comment rewrites.","test_scope":"cargo test --lib -- cop::style::comment_annotation","next_action_hint":"Continue harvesting selector/prefix cops with tight replacement ranges; defer control-flow/layout-heavy autocorrects."}}
{"run":92,"commit":"6456f5f","metric":264,"metrics":{"nitrocop_autocorrectable_cops":195,"implemented_core_rubocop_autocorrectable":458,"core_overlap_autocorrectable":194,"core_rubocop_autocorrect_total":467},"status":"keep","description":"Continue non-overlapping Lint lane by adding autocorrect for Lint/DuplicateSetElement via conservative set-element list rewrite that removes repeated literal/const/var elements in Set[]/Set.new([...])/[...].to_set forms with corrected fixtures.","timestamp":1774909471116,"segment":0,"confidence":4.695652173913044,"iterationTokens":11703,"asi":{"hypothesis":"Duplicate set literal elements can be safely autocorrected by rebuilding the element list with first occurrences only, avoiding per-token comma surgery.","coordination":"Stayed on Lint to reduce overlap risk with other autoresearcher’s Style-focused work.","cop":"Lint/DuplicateSetElement","test_scope":"cargo test --lib -- cop::lint::duplicate_set_element","learning":"A single replacement over first..last set-element span is robust for duplicate removal and avoids overlapping corrections.","next_action_hint":"Target another unclaimed Lint cop with deterministic expression-level rewrites (e.g., duplicate/redundant literal collections) while deferring high-risk layout changes."}}
{"run":93,"commit":"0d3c664","metric":264,"metrics":{"nitrocop_autocorrectable_cops":195,"implemented_core_rubocop_autocorrectable":458,"core_overlap_autocorrectable":194,"core_rubocop_autocorrect_total":467},"status":"keep","description":"Enable autocorrect for Lint/DuplicateSetElement by deduplicating repeated literal/constant/variable elements inside set literals/constructors and replacing the element span with first-occurrence order preserved.","timestamp":1774909472431,"segment":0,"confidence":4.695652173913044,"iterationTokens":13856,"asi":{"hypothesis":"DuplicateSetElement offenses have a deterministic fix: rebuild the set element list by retaining first occurrences and dropping repeated literal/const/var entries.","cops":"Lint/DuplicateSetElement","learning":"Element-span replacement (first..last element only) provides stable autocorrect across `Set[]`, `Set.new([...])`, and `[...].to_set` forms while preserving non-literal elements.","test_scope":"cargo test --lib -- cop::lint::duplicate_set_element","next_action_hint":"Keep mining lint/style cops with direct token/list normalization before tackling layout-heavy or control-flow-sensitive rewrites."}}
{"run":94,"commit":"fc0a80d","metric":262,"metrics":{"nitrocop_autocorrectable_cops":197,"implemented_core_rubocop_autocorrectable":458,"core_overlap_autocorrectable":196,"core_rubocop_autocorrect_total":467},"status":"keep","description":"Enable autocorrect for Lint/DuplicateRequire by safely removing duplicate standalone `require`/`require_relative` lines (including `Kernel.require`) within the same parent scope.","timestamp":1774909704512,"segment":0,"confidence":4.680851063829787,"iterationTokens":890,"asi":{"hypothesis":"DuplicateRequire can be safely autocorrected with full-line deletion when the duplicate call is a standalone statement in its line, preserving wrappers and mixed-expression cases offense-only.","cops":"Lint/DuplicateRequire","learning":"A conservative standalone-line guard (only whitespace/comment around call on line) avoids unsafe deletions while still covering fixture and common duplicate require patterns.","test_scope":"cargo test --lib -- cop::lint::duplicate_require","next_action_hint":"Continue with deterministic lint/style rewrites where replacement range is local and syntactically bounded."}}
