{"run":135,"commit":"3649273","metric":211,"metrics":{"nitrocop_autocorrectable_cops":248,"implemented_core_rubocop_autocorrectable":458,"core_overlap_autocorrectable":247,"core_rubocop_autocorrect_total":467},"status":"keep","description":"Enable conservative autocorrect for Lint/AmbiguousRegexpLiteral by parenthesizing offense-matched regexp literals at parser-warning locations; prune completed/stale idea entries.","timestamp":1774920541339,"segment":0,"confidence":4.351351351351352,"iterationTokens":7884,"asi":{"hypothesis":"Prism warning offsets can be mapped to regexp literal node ranges, allowing safe localized insertion of argument parentheses around ambiguous regexp literals.","cop":"Lint/AmbiguousRegexpLiteral","test_scope":"cargo test --lib -- cop::lint::ambiguous_regexp_literal","learning":"Collecting regexp node locations by start offset enables deterministic correction at warning sites without broad call-shape rewriting.","safety":"Autocorrect only inserts `(` and `)` around the regexp literal span tied to ambiguous-slash warnings; it does not rewrite operators or method names."}}
{"run":136,"commit":"b1ecb9d","metric":210,"metrics":{"nitrocop_autocorrectable_cops":249,"implemented_core_rubocop_autocorrectable":458,"core_overlap_autocorrectable":248,"core_rubocop_autocorrect_total":467},"status":"keep","description":"Enable autocorrect for Style/Alias by converting offense-matched `alias_method` calls to `alias` in lexical scope and converting offense-matched `alias` keywords to `alias_method` in dynamic scope.","timestamp":1774920823358,"segment":0,"confidence":4.378378378378378,"iterationTokens":11752,"asi":{"hypothesis":"Style/Alias offenses are syntax-local and can be safely corrected by whole-node rewrites using existing symbol-argument guards and scope checks.","cop":"Style/Alias","test_scope":"cargo test --lib -- cop::style::alias","learning":"Using symbol-node extraction from AliasMethodNode/CallNode allows deterministic rewrites both directions while preserving current dynamic/instance_eval/def-depth gating.","safety":"Autocorrect only applies on already-detected offenses where argument shape is constrained to symbol forms."}}
{"run":137,"commit":"037b7b2","metric":209,"metrics":{"nitrocop_autocorrectable_cops":250,"implemented_core_rubocop_autocorrectable":458,"core_overlap_autocorrectable":249,"core_rubocop_autocorrect_total":467},"status":"keep","description":"Enable autocorrect for Style/DisableCopsWithinSourceCodeDirective by removing disallowed RuboCop directive comments (or preserving only allowed cops when configured).","timestamp":1774921032596,"segment":0,"confidence":4.405405405405405,"iterationTokens":14175,"asi":{"hypothesis":"Directive-comment offenses can be corrected safely at comment-span level without touching executable Ruby code.","cop":"Style/DisableCopsWithinSourceCodeDirective","test_scope":"cargo test --lib -- cop::style::disable_cops_within_source_code_directive","learning":"Using parse-result comment locations enables precise replacements for inline and standalone directives; allowed-cop mode can retain permitted names while dropping disallowed ones.","safety":"Autocorrect edits only directive comment ranges matched by the cop regex and leaves non-directive comments/code untouched."}}
{"run":138,"commit":"7d0fc4e","metric":208,"metrics":{"nitrocop_autocorrectable_cops":251,"implemented_core_rubocop_autocorrectable":458,"core_overlap_autocorrectable":250,"core_rubocop_autocorrect_total":467},"status":"keep","description":"Enable autocorrect for Style/DateTime by rewriting offense-matched `DateTime`/`::DateTime` call receivers to `Time`, while leaving `#to_datetime` offenses diagnostic-only.","timestamp":1774921219123,"segment":0,"confidence":4.315789473684211,"iterationTokens":10454,"asi":{"hypothesis":"Style/DateTime class-form offenses can be corrected with a narrow receiver-token replacement (`DateTime` -> `Time`) without altering call arguments or method names.","cop":"Style/DateTime","test_scope":"cargo test --lib -- cop::style::date_time","learning":"Replacing receiver name location for constant-read/path nodes yields stable corrections across `DateTime.now`, `::DateTime.now`, and other class-call forms; historic-date and coercion guards remain intact.","safety":"Autocorrect only applies to DateTime class receiver offenses and skips `to_datetime` as in RuboCop unsafe-autocorrect behavior."}}
{"run":139,"commit":"c7335db","metric":207,"metrics":{"nitrocop_autocorrectable_cops":252,"implemented_core_rubocop_autocorrectable":458,"core_overlap_autocorrectable":251,"core_rubocop_autocorrect_total":467},"status":"keep","description":"Enable autocorrect for Style/CombinableDefined by collapsing offense-matched nested `defined?` `&&` chains to a single deepest `defined?(...)` expression.","timestamp":1774921388064,"segment":0,"confidence":4.342105263157895,"iterationTokens":8766,"asi":{"hypothesis":"CombinableDefined offenses can be safely corrected by replacing the whole boolean chain with the most specific `defined?` subject because all terms are `defined?` checks on nested receivers/namespaces.","cop":"Style/CombinableDefined","test_scope":"cargo test --lib -- cop::style::combinable_defined","learning":"A full-expression replacement avoids brittle operator-span deletions and remains stable across both `&&` and `and` parse forms.","safety":"Autocorrect is gated by existing all-terms-defined? logic and nested-parent matching; mixed expressions remain offense-free and unmodified."}}
{"run":140,"commit":"59acf7f","metric":206,"metrics":{"nitrocop_autocorrectable_cops":253,"implemented_core_rubocop_autocorrectable":458,"core_overlap_autocorrectable":252,"core_rubocop_autocorrect_total":467},"status":"keep","description":"Enable autocorrect for Style/For by rewriting offense-matched `for ... in ...` loops to equivalent `.each do |...| ... end` blocks, including range receiver parenthesization.","timestamp":1774921623783,"segment":0,"confidence":4.256410256410256,"iterationTokens":9473,"asi":{"hypothesis":"Style/For offenses can be corrected with a bounded whole-node rewrite using loop index, collection, and body source slices.","cop":"Style/For","test_scope":"cargo test --lib -- cop::style::for_cop","learning":"Simple full-expression replacement with body reindent and range wrapping (`(1..10).each`) matches fixture behavior while preserving loop body content.","safety":"Autocorrect applies only to detected `for` nodes under EnforcedStyle=each and does not alter inner statements beyond indentation preservation."}}
{"run":141,"commit":"750e5ba","metric":205,"metrics":{"nitrocop_autocorrectable_cops":254,"implemented_core_rubocop_autocorrectable":458,"core_overlap_autocorrectable":253,"core_rubocop_autocorrect_total":467},"status":"keep","description":"Enable conservative autocorrect for Style/CombinableLoops by combining isolated consecutive brace-block loops over the same receiver/method into one loop body; leave chain/mixed-form cases offense-only.","timestamp":1774921956565,"segment":0,"confidence":4.282051282051282,"iterationTokens":16669,"asi":{"hypothesis":"CombinableLoops can gain safe autocorrect parity with a narrow subset that avoids overlapping chain rewrites and only merges simple compatible brace-block pairs.","cop":"Style/CombinableLoops","test_scope":"cargo test --lib -- cop::style::combinable_loops","learning":"Isolated-pair gating (`prev_prev_same`/`next_same`) prevents correction conflicts in 3+ loop chains while still correcting common two-loop cases.","safety":"Autocorrect only runs for same-loop-signature call nodes with brace blocks, identical parameter text, and single-statement bodies; for-loops/mixed block forms remain unchanged."}}
{"run":142,"commit":"c842c3e","metric":204,"metrics":{"nitrocop_autocorrectable_cops":255,"implemented_core_rubocop_autocorrectable":458,"core_overlap_autocorrectable":254,"core_rubocop_autocorrect_total":467},"status":"keep","description":"Enable autocorrect for Style/ReturnNil by replacing offense-matched `return nil` with `return` (and inverse style path), preserving iterator/proc/lambda suppression behavior; prune stale non-metric ideas.","timestamp":1774922257390,"segment":0,"confidence":4.2,"iterationTokens":16669,"asi":{"hypothesis":"Style/ReturnNil can safely autocorrect with whole-return-node replacement while reusing existing RuboCop-parity suppression logic for iterator/proc contexts.","cop":"Style/ReturnNil","test_scope":"cargo test --lib -- cop::style::return_nil","learning":"Visitor-owned correction buffering avoids lifetime issues and allows corrected diagnostics only when autocorrect mode is active.","safety":"Autocorrect applies only to already-detected offenses (`return nil` or bare `return` per configured style) and does not modify surrounding control-flow conditions.","ideas_pruned":"Removed stale/non-primary backlog items (NumberConversion revisit, DigChain one-pass, ClassMethodsDefinitions mixed-body extension) and replaced with remaining metric-relevant candidates."}}
{"run":143,"commit":"98ce91a","metric":203,"metrics":{"nitrocop_autocorrectable_cops":256,"implemented_core_rubocop_autocorrectable":458,"core_overlap_autocorrectable":255,"core_rubocop_autocorrect_total":467},"status":"keep","description":"Enable autocorrect for Style/ReturnNilInPredicateMethodDefinition by rewriting offense-matched `return`/`return nil` in predicate methods to `return false`, preserving existing method/pattern allowlist checks.","timestamp":1774922391267,"segment":0,"confidence":4.225,"iterationTokens":5289,"asi":{"hypothesis":"A bounded replacement of flagged return nodes to `return false` should provide RuboCop-style autocorrect parity for predicate-return offenses without changing detection scope.","cop":"Style/ReturnNilInPredicateMethodDefinition","test_scope":"cargo test --lib -- cop::style::return_nil_in_predicate_method_definition","learning":"Existing return-location finder already captures exact replacement spans, enabling straightforward unsafe autocorrect parity with minimal implementation risk.","safety":"Autocorrect only applies to already-flagged return statements inside predicate defs; nested defs remain skipped and allowlist/pattern exclusions are unchanged."}}
{"run":144,"commit":"404c646","metric":202,"metrics":{"nitrocop_autocorrectable_cops":257,"implemented_core_rubocop_autocorrectable":458,"core_overlap_autocorrectable":256,"core_rubocop_autocorrect_total":467},"status":"keep","description":"Enable conservative autocorrect for Style/Semicolon by removing offense semicolons in unambiguous leading/trailing/brace-adjacent/interpolation-open cases; keep expression-separator rewrites offense-only. Prune completed ideas.","timestamp":1774922685353,"segment":0,"confidence":4.146341463414634,"iterationTokens":20605,"asi":{"hypothesis":"Style/Semicolon can become safely autocorrectable with local semicolon deletions while avoiding fragile multi-expression newline transformations.","cop":"Style/Semicolon","test_scope":"cargo test --lib -- cop::style::semicolon","learning":"Offset-local removal on phase-3 semicolon detections gives deterministic safe fixes for block/interpolation/trailing forms without touching structural semicolon separators.","safety":"Autocorrect only deletes the semicolon token for already-classified non-separator offenses; expression-separator semicolons remain diagnostics-only.","ideas_pruned":"Removed completed `Style/ReturnNilInPredicateMethodDefinition` and moved `Style/Semicolon` to a follow-up expansion note."}}
{"run":145,"commit":"86d89e7","metric":201,"metrics":{"nitrocop_autocorrectable_cops":258,"implemented_core_rubocop_autocorrectable":458,"core_overlap_autocorrectable":257,"core_rubocop_autocorrect_total":467},"status":"keep","description":"Enable autocorrect for Lint/RedundantRegexpQuantifiers by applying token-local quantifier merges (`(?:a+)+` class) and interval-reluctant simplifications (`{0,1}?`, `{1,}?`, `{0,}?`), plus add autocorrect fixtures.","timestamp":1774923070343,"segment":0,"confidence":4.170731707317073,"iterationTokens":29647,"asi":{"hypothesis":"RedundantRegexpQuantifiers can safely autocorrect via local quantifier token edits without changing regex delimiters or non-offense structures.","cop":"Lint/RedundantRegexpQuantifiers","test_scope":"cargo test --lib -- cop::lint::redundant_regexp_quantifiers","learning":"Using `content_loc` offsets enables precise inner/outer quantifier edits for both slash and `%r{}` literals while preserving surrounding regexp text.","safety":"Corrections are limited to already-flagged greedy redundant quantifier pairs and normalizable interval+reluctant combinations; interpolation remains skipped.","ideas_pruned":"Removed completed RedundantRegexpQuantifiers idea and promoted next candidate (Style/DoubleNegation) while keeping Layout staged."}}
{"run":146,"commit":"d3c0304","metric":200,"metrics":{"nitrocop_autocorrectable_cops":259,"implemented_core_rubocop_autocorrectable":458,"core_overlap_autocorrectable":258,"core_rubocop_autocorrect_total":467},"status":"keep","description":"Enable autocorrect for Style/DoubleNegation by mirroring RuboCop’s unsafe rewrite (`!!expr` -> `!expr.nil?`) on offense-matched nodes while preserving existing return-position allowances.","timestamp":1774923428243,"segment":0,"confidence":4.095238095238095,"iterationTokens":24159,"asi":{"hypothesis":"DoubleNegation can become autocorrectable without changing detection by applying RuboCop-equivalent selector removal + `.nil?` append on flagged `!!` send nodes.","cop":"Style/DoubleNegation","test_scope":"cargo test --lib -- cop::style::double_negation","learning":"Using two local edits per offense (remove outer `!`, append `.nil?` at node end) preserves precedence in calls, parens, hash values, and multiline expressions covered by existing fixtures.","safety":"Autocorrect only applies to already-flagged double-negation offenses; `allowed_in_returns` suppression and all detection heuristics remain unchanged.","ideas_pruned":"Removed completed DoubleNegation idea; added next non-layout candidate (`Style/RescueModifier`) and kept Semicolon expansion as optional follow-up."}}
{"run":147,"commit":"4ae2ac0","metric":199,"metrics":{"nitrocop_autocorrectable_cops":260,"implemented_core_rubocop_autocorrectable":458,"core_overlap_autocorrectable":259,"core_rubocop_autocorrect_total":467},"status":"keep","description":"Enable autocorrect for Style/RescueModifier by rewriting offense-matched modifier rescues (`expr rescue fallback`) into bounded `begin ... rescue ... end` blocks; add corrected fixture coverage.","timestamp":1774923626226,"segment":0,"confidence":4.119047619047619,"iterationTokens":9276,"asi":{"hypothesis":"RescueModifier can gain safe parity with whole-node rewrites that preserve original expression/fallback source and indentation offset.","cop":"Style/RescueModifier","test_scope":"cargo test --lib -- cop::style::rescue_modifier","learning":"Using RescueModifierNode `expression()` and `rescue_expression()` slices allows deterministic conversion to multiline begin/rescue form without touching surrounding assignment/call context.","safety":"Autocorrect applies only on already-detected rescue modifier nodes and emits explicit `begin/rescue/end` blocks with preserved inner source.","ideas_pruned":"Removed completed RescueModifier idea and replaced it with RescueStandardError as the next bounded non-layout candidate."}}
{"run":148,"commit":"9f5d925","metric":198,"metrics":{"nitrocop_autocorrectable_cops":261,"implemented_core_rubocop_autocorrectable":458,"core_overlap_autocorrectable":260,"core_rubocop_autocorrect_total":467},"status":"keep","description":"Enable autocorrect for Style/RescueStandardError with bounded keyword-range edits: implicit style removes `StandardError` from `rescue StandardError`, explicit style inserts ` StandardError` for bare `rescue`; multi-exception clauses unchanged.","timestamp":1774923785312,"segment":0,"confidence":4.094117647058823,"iterationTokens":4570,"asi":{"hypothesis":"RescueStandardError parity can be achieved with small keyword/exception-range edits per resbody node without altering rescue chains or non-target clauses.","cop":"Style/RescueStandardError","test_scope":"cargo test --lib -- cop::style::rescue_standard_error","learning":"Using `keyword_loc` and first exception location allows precise implicit-style removal (`rescue StandardError` -> `rescue`) while preserving rescue variable bindings (`rescue => e`).","safety":"Autocorrect runs only for already-flagged style-specific offenses (single StandardError or bare rescue); mixed exception lists remain untouched.","ideas_pruned":"Removed completed RescueStandardError idea and promoted NonDeterministicRequireOrder as next non-layout candidate."}}
{"run":149,"commit":"de1f948","metric":197,"metrics":{"nitrocop_autocorrectable_cops":262,"implemented_core_rubocop_autocorrectable":458,"core_overlap_autocorrectable":261,"core_rubocop_autocorrect_total":467},"status":"keep","description":"Enable autocorrect for Style/Sample by replacing offense-matched `shuffle.first/last`, `shuffle[0/-1]`, `shuffle.at(0/-1)`, and `shuffle.slice(0/-1)` call tails with `sample` equivalents.","timestamp":1774923983570,"segment":0,"confidence":4.069767441860465,"iterationTokens":11825,"asi":{"hypothesis":"Style/Sample can use bounded tail-range replacement from `.shuffle...` to expression end, preserving receiver text while mapping to RuboCop-style `sample` forms.","cop":"Style/Sample","test_scope":"cargo test --lib -- cop::style::sample","learning":"Using `shuffle_call.message_loc()` as replacement start keeps receiver/source context intact and allows uniform autocorrect across selector/index/at/slice variants.","safety":"Autocorrect only applies on already-detected patterns with validated index arguments (0/-1 for []/at/slice) and leaves non-offense forms untouched."}}
{"run":150,"commit":"de1f948","metric":197,"metrics":{"nitrocop_autocorrectable_cops":262,"implemented_core_rubocop_autocorrectable":458,"core_overlap_autocorrectable":261,"core_rubocop_autocorrect_total":467},"status":"discard","description":"Attempted conservative autocorrect for Style/WordArray (%w conversion for simple quoted word arrays only), but primary metric did not improve.","timestamp":1774924214121,"segment":0,"confidence":3.977272727272727,"iterationTokens":13409,"asi":{"hypothesis":"Style/WordArray should become counted as autocorrectable by adding bounded bracket-array to %w rewrites for simple elements.","cop":"Style/WordArray","test_scope":"cargo test --lib -- cop::style::word_array","result":"No change in missing_core_autocorrect_cops; likely cop not in current RuboCop-core autocorrect overlap set used by benchmark mapping.","rollback_reason":"Primary metric unchanged (197), so experiment reverted per autoresearch policy.","next_action_hint":"Pivot to a cop still present in current missing list (e.g., Style/Semicolon expansion or a listed Lint/Style cop) before rerunning benchmark."}}
{"run":151,"commit":"21b9ba1","metric":196,"metrics":{"nitrocop_autocorrectable_cops":263,"implemented_core_rubocop_autocorrectable":458,"core_overlap_autocorrectable":262,"core_rubocop_autocorrect_total":467},"status":"keep","description":"Re-implement Lint/NonDeterministicRequireOrder from no-op to bounded Ruby<=2.7 parity: detect unsorted `Dir[]/Dir.glob(...).each` blocks that require iteration vars and autocorrect `.each` -> `.sort.each`; add fixture/autocorrect coverage.","timestamp":1774924496444,"segment":0,"confidence":4,"iterationTokens":16651,"asi":{"hypothesis":"A conservative subset of RuboCop’s NonDeterministicRequireOrder patterns (unsorted Dir list with requiring block var) is enough for real autocorrect parity gain without broad source rewrites.","cop":"Lint/NonDeterministicRequireOrder","test_scope":"cargo test --lib -- cop::lint::non_deterministic_require_order","learning":"Selector-local replacement (`each` -> `sort.each`) provides stable correction for the dominant contiguous Dir-loop require pattern; Ruby-version gating avoids false positives on Ruby 3+.","safety":"Cop now runs only for TargetRubyVersion <= 2.7 and only when block body requires the loop variable; already sorted and non-require loops remain untouched.","ideas_pruned":"Removed completed NonDeterministicRequireOrder idea and promoted ItBlockParameter as the next non-layout candidate."}}
{"run":152,"commit":"42e3af3","metric":195,"metrics":{"nitrocop_autocorrectable_cops":264,"implemented_core_rubocop_autocorrectable":458,"core_overlap_autocorrectable":263,"core_rubocop_autocorrect_total":467},"status":"keep","description":"Enable conservative autocorrect for Style/ItBlockParameter `_1` offenses (Ruby 3.4+): replace offense-matched `_1` reads with `it` in numbered-parameter blocks/lambdas while preserving existing style gating and non-`_1` behaviors.","timestamp":1774924784786,"segment":0,"confidence":3.933333333333333,"iterationTokens":7124,"asi":{"hypothesis":"ItBlockParameter can gain safe parity via token-local `_1`->`it` rewrites on already-detected numbered-parameter offenses, without touching multiline-it or named-param diagnostics.","cop":"Style/ItBlockParameter","test_scope":"cargo test --lib -- cop::style::it_block_parameter","learning":"Adding config-aware autocorrect assertion (`assert_cop_autocorrect_with_config` with Ruby 3.4) is required because default test config suppresses this cop.","safety":"Autocorrect is constrained to exact `_1` local-variable offense spans from NumberedParamFinder; existing detection logic, style checks, and Ruby version guard remain unchanged.","ideas_pruned":"Removed completed ItBlockParameter idea and promoted Style/Next as next non-layout candidate."}}
