{"run":153,"commit":"a15263c","metric":194,"metrics":{"nitrocop_autocorrectable_cops":265,"implemented_core_rubocop_autocorrectable":458,"core_overlap_autocorrectable":264,"core_rubocop_autocorrect_total":467},"status":"keep","description":"Enable conservative autocorrect for Style/Next by rewriting offense-matched iterator-ending `if/unless` wrappers to `next unless/if ...` plus unwrapped body statements; add corrected fixture coverage.","timestamp":1774925397702,"segment":0,"confidence":3.9555555555555557,"iterationTokens":26272,"asi":{"hypothesis":"Style/Next can gain parity with bounded whole-if-node rewrites when offenses are already constrained to no-else, min-body-length wrapper conditionals.","cop":"Style/Next","test_scope":"cargo test --lib -- cop::style::next","learning":"Using full if/unless node replacement avoids fragile token surgery; pairing a normalized body re-emission with `next` guard preserves fixture semantics for current offense shapes.","safety":"Autocorrect is limited to already-flagged wrapper `if/unless` offenses in iterator/for contexts; modifier-form and else-branch cases remain untouched.","ideas_pruned":"Removed completed Style/Next idea and promoted Style/YodaCondition as next non-layout candidate."}}
{"run":154,"commit":"4accf18","metric":193,"metrics":{"nitrocop_autocorrectable_cops":266,"implemented_core_rubocop_autocorrectable":458,"core_overlap_autocorrectable":265,"core_rubocop_autocorrect_total":467},"status":"keep","description":"Enable autocorrect for Style/YodaCondition by swapping offense-matched comparison operands and reversing directional operators (`<`/`>`/`<=`/`>=`) while preserving existing style gating and interpolation skips.","timestamp":1774925599609,"segment":0,"confidence":3.934065934065934,"iterationTokens":9857,"asi":{"hypothesis":"YodaCondition can gain parity via whole-expression replacement of already-flagged comparisons (`lhs op rhs` -> `rhs reverse(op) lhs`) without changing detection logic.","cop":"Style/YodaCondition","test_scope":"cargo test --lib -- cop::style::yoda_condition","learning":"Full-call replacement is simpler and more robust than token-level edits for mixed literal/constant forms (symbols, xstrings, regex, hash literals) and style modes.","safety":"Autocorrect only runs on current offenses after existing constant/interpolation/style checks; noncommutative/unsupported operator paths remain excluded.","ideas_pruned":"Removed completed YodaCondition idea and promoted SingleLineBlockParams as the next non-layout candidate."}}
{"run":155,"commit":"c3ddbce","metric":192,"metrics":{"nitrocop_autocorrectable_cops":267,"implemented_core_rubocop_autocorrectable":458,"core_overlap_autocorrectable":266,"core_rubocop_autocorrect_total":467},"status":"keep","description":"Enable conservative autocorrect for Style/SingleLineBlockParams by renaming offense-matched single-line block params to configured names (including local variable read replacements) while preserving existing eligibility checks.","timestamp":1774925783558,"segment":0,"confidence":3.9130434782608696,"iterationTokens":8571,"asi":{"hypothesis":"SingleLineBlockParams can gain parity through local block-param/header replacement plus scoped lvar read renames for already-flagged single-line blocks.","cop":"Style/SingleLineBlockParams","test_scope":"cargo test --lib -- cop::style::single_line_block_params","learning":"A small local-variable finder that skips nested blocks/lambdas provides safe same-scope renaming for autocorrect without broad AST rewrites.","safety":"Autocorrect applies only to current offenses (single-line, receiver-present, configured methods, arg_type-only params) and preserves underscore-prefix behavior.","ideas_pruned":"Removed completed SingleLineBlockParams idea and promoted SingleLineDoEndBlock as the next non-layout candidate."}}
{"run":156,"commit":"1b8f735","metric":190,"metrics":{"nitrocop_autocorrectable_cops":269,"implemented_core_rubocop_autocorrectable":458,"core_overlap_autocorrectable":268,"core_rubocop_autocorrect_total":467},"status":"keep","description":"Enable autocorrect for Style/SingleLineDoEndBlock (single-line `do...end` blocks) via newline insertions and for Lint/ConstantOverwrittenInRescue by rewriting `rescue => CONST` to `rescue CONST`; add corrected fixtures and autocorrect tests.","timestamp":1774926389972,"segment":0,"confidence":3.9565217391304346,"iterationTokens":37078,"asi":{"hypothesis":"Two bounded syntax-preserving edits (line-break insertion for single-line do/end blocks and assoc-token removal in rescue clauses) can safely add two missing core autocorrect cops.","cops":"Style/SingleLineDoEndBlock, Lint/ConstantOverwrittenInRescue","test_scope":"cargo test --lib -- cop::style::single_line_do_end_block && cargo test --lib -- cop::lint::constant_overwritten_in_rescue","learning":"For single-line do/end blocks, choosing newline insertion after explicit block params (only when `|...|` exists) avoids it-block placement regressions; rescue autocorrect is robust as keyword.end..assoc.end deletion.","safety":"Autocorrect only applies to offense-matched nodes; no detection broadening was introduced.","ideas_pruned":"Removed completed SingleLineDoEndBlock idea and promoted Lint/UselessAccessModifier as next low-risk non-layout candidate."}}
{"run":157,"commit":"1950394","metric":189,"metrics":{"nitrocop_autocorrectable_cops":270,"implemented_core_rubocop_autocorrectable":458,"core_overlap_autocorrectable":269,"core_rubocop_autocorrect_total":467},"status":"keep","description":"Enable conservative autocorrect for Lint/UselessAccessModifier by deleting offense-matched modifier whole lines (`public`/`private`/`protected`/`module_function` and bare `private_class_method`); add corrected fixture and autocorrect tests.","timestamp":1774926609929,"segment":0,"confidence":3.9782608695652173,"iterationTokens":15640,"asi":{"hypothesis":"Whole-line deletion for already-flagged useless access modifiers will safely match RuboCop autocorrect behavior without changing detection logic.","cop":"Lint/UselessAccessModifier","test_scope":"cargo test --lib -- cop::lint::useless_access_modifier","learning":"Post-processing this cop's own diagnostics into unique line-range deletions (with newline when present) yields deterministic corrections and avoids overlap conflicts.","safety":"Autocorrect is limited to offense lines produced by existing detection and does not alter modifier analysis/state propagation.","ideas_pruned":"Removed completed UselessAccessModifier idea and promoted RedundantSplatExpansion as next non-layout candidate."}}
{"run":158,"commit":"26ed8c9","metric":188,"metrics":{"nitrocop_autocorrectable_cops":271,"implemented_core_rubocop_autocorrectable":458,"core_overlap_autocorrectable":270,"core_rubocop_autocorrect_total":467},"status":"keep","description":"Enable conservative autocorrect for Lint/RedundantSplatExpansion for offense-matched literal splats: remove `*` by replacing with literal source, and flatten array literals in bracketed/array/when-rescue contexts; add corrected fixture + autocorrect tests.","timestamp":1774926893513,"segment":0,"confidence":3.956989247311828,"iterationTokens":13056,"asi":{"hypothesis":"RedundantSplatExpansion can gain parity with bounded literal-only rewrites while leaving complex `Array.new(...)` splat cases detection-only.","cop":"Lint/RedundantSplatExpansion","test_scope":"cargo test --lib -- cop::lint::redundant_splat_expansion","learning":"A RuboCop-like bracket-removal helper for array literals (%w/%W/%i/%I and standard arrays) is sufficient for conservative autocorrect in currently flagged literal contexts.","safety":"Autocorrect is restricted to existing offense-matched literal splats; `Array.new(...)` splat diagnostics remain uncorrected to avoid structural overreach.","ideas_pruned":"Removed completed RedundantSplatExpansion idea and promoted RedundantSafeNavigation as the next non-layout candidate."}}
{"run":159,"commit":"13c7505","metric":187,"metrics":{"nitrocop_autocorrectable_cops":272,"implemented_core_rubocop_autocorrectable":458,"core_overlap_autocorrectable":271,"core_rubocop_autocorrect_total":467},"status":"keep","description":"Enable conservative autocorrect for Lint/RedundantSafeNavigation: replace offense-matched `&.` with `.` and for conversion-with-default offenses (`foo&.to_h || {}` etc.) also remove the trailing default literal segment; add corrected fixture and autocorrect tests.","timestamp":1774927359077,"segment":0,"confidence":3.9361702127659575,"iterationTokens":33239,"asi":{"hypothesis":"RedundantSafeNavigation can gain core parity with bounded operator replacement (`&.` -> `.`) plus narrow `|| default` removal only for already-detected conversion-with-default offenses.","cop":"Lint/RedundantSafeNavigation","test_scope":"cargo test --lib -- cop::lint::redundant_safe_navigation","learning":"Post-processing check_source diagnostics into deduplicated `&.` byte-range replacements gives robust autocorrect coverage for AllowedMethods-in-condition cases without changing detection traversal.","safety":"Autocorrect is constrained to offense locations; complex non-offense safe-nav chains remain untouched and conversion-default trimming only runs on existing method/default matches.","ideas_pruned":"Removed completed RedundantSafeNavigation idea; promoted Semicolon expansion and TrailingCommaInArguments as next candidates."}}
{"run":176,"commit":"de144fb","metric":185,"metrics":{"nitrocop_autocorrectable_cops":274,"implemented_core_rubocop_autocorrectable":458,"core_overlap_autocorrectable":273,"core_rubocop_autocorrect_total":467},"status":"keep","description":"Enable conservative autocorrect for Style/WordArray by rewriting offense-matched simple bracket string arrays to `%w[...]` via whole-node replacement, while leaving whitespace/escape-heavy elements diagnostic-only; add corrected fixture and autocorrect tests.","timestamp":1774973856334,"segment":0,"confidence":4.348837209302325,"iterationTokens":33239,"asi":{"hypothesis":"Style/WordArray should be countable as autocorrectable with bounded whole-node `%w` rewrites for simple word arrays, reducing missing core autocorrect cops by 1.","cop":"Style/WordArray","test_scope":"cargo test --lib -- cop::style::word_array","learning":"Using unescaped element text and delimiter selection allows deterministic `%w` reconstruction; newline/tab-containing words are intentionally left uncorrected to avoid semantic drift.","safety":"Autocorrect only applies on already-flagged simple string-array offenses where every word is non-empty, non-whitespace, and delimiter-safe.","next_action_hint":"Continue with style cops that can use conservative whole-node replacements (e.g., Style/SymbolArray or Style/EmptyLiteral) before entering layout-heavy edits."}}
{"run":177,"commit":"3af834c","metric":184,"metrics":{"nitrocop_autocorrectable_cops":275,"implemented_core_rubocop_autocorrectable":458,"core_overlap_autocorrectable":274,"core_rubocop_autocorrect_total":467},"status":"keep","description":"Enable autocorrect for Style/SymbolArray with conservative whole-node `%i[...]` rewrites for offense-matched simple symbol arrays; add corrected fixture and autocorrect tests.","timestamp":1774974068626,"segment":0,"confidence":4.372093023255814,"iterationTokens":6915,"asi":{"hypothesis":"Style/SymbolArray should reduce missing core autocorrect cops by 1 via bounded whole-node conversion from bracket symbol arrays to `%i` literals.","cop":"Style/SymbolArray","test_scope":"cargo test --lib -- cop::style::symbol_array","learning":"Reusing existing ambiguity/comment/complex-content guards and emitting full-array `%i` replacements gives stable autocorrect parity without detection changes.","safety":"Autocorrect is limited to already-flagged simple symbol arrays and only applies when symbols are non-empty, non-whitespace, and delimiter-safe.","next_action_hint":"Continue with style whole-node replacement candidates in the missing set (e.g., Style/EmptyLiteral or Style/TrailingBodyOn* family)."}}
{"run":178,"commit":"015cf20","metric":183,"metrics":{"nitrocop_autocorrectable_cops":276,"implemented_core_rubocop_autocorrectable":458,"core_overlap_autocorrectable":275,"core_rubocop_autocorrect_total":467},"status":"keep","description":"Enable autocorrect for Style/EmptyLiteral using whole-node replacements (`Array.new`/`Array[]` -> `[]`, `Hash.new`/`Hash[]` -> `{}`, `String.new` -> `''`) on already-detected offenses; add corrected fixture and autocorrect tests.","timestamp":1774974303834,"segment":0,"confidence":4.344827586206897,"iterationTokens":7868,"asi":{"hypothesis":"Style/EmptyLiteral should yield a direct -1 on missing core autocorrect cops because offenses map to deterministic empty-literal replacements.","cop":"Style/EmptyLiteral","test_scope":"cargo test --lib -- cop::style::empty_literal","learning":"The cop’s existing guardrails (nested-constructor exceptions, String.new frozen_string_literal checks) can be kept intact while adding simple full-node replacement corrections.","safety":"Autocorrect only applies to the same offense-gated zero-arg constructor call nodes; block/argument and mutable-string gating behavior remains unchanged.","next_action_hint":"Continue targeting style cops with deterministic full-node templates (e.g., TrailingBodyOnClass/Module/MethodDefinition or simple constructor/literal canonicalizations)."}}
{"run":1,"commit":"ca6b109","metric":182,"metrics":{"nitrocop_autocorrectable_cops":277,"implemented_core_rubocop_autocorrectable":458,"core_overlap_autocorrectable":276,"core_rubocop_autocorrect_total":467},"status":"keep","description":"Enable conservative autocorrect for Style/TrailingCommaInArrayLiteral: remove offense-matched trailing commas and insert missing trailing commas for multiline comma/consistent/diff styles; add corrected fixture and autocorrect tests.","timestamp":1774974759007,"segment":0,"confidence":null,"iterationTokens":null,"asi":{"hypothesis":"TrailingCommaInArrayLiteral can become safely autocorrectable via token-local comma insertion/removal at the detected trailing-comma boundary without changing detection behavior.","cop":"Style/TrailingCommaInArrayLiteral","test_scope":"cargo test --lib -- cop::style::trailing_comma_in_array_literal","learning":"Using existing comma-offset logic (including heredoc no-newline guard) made corrections deterministic; directives in offense fixtures are not preserved in corrected output and must be omitted in corrected.rb.","safety":"Autocorrect only edits comma tokens (delete at detected comma offset or insert at last element end) on already-reported offenses; no AST reshaping.","next_action_hint":"Prune stale idea entries and continue with whole-node Style candidates still in missing set (e.g., TrailingBodyOnClass/Module/MethodDefinition)."}}
{"run":2,"commit":"415a878","metric":181,"metrics":{"nitrocop_autocorrectable_cops":278,"implemented_core_rubocop_autocorrectable":458,"core_overlap_autocorrectable":277,"core_rubocop_autocorrect_total":467},"status":"keep","description":"Enable autocorrect for Style/TrailingBodyOnClass by moving offense-matched inline class/singleton-class body starts onto their own indented line via semicolon-to-newline replacement; add corrected fixture and autocorrect tests.","timestamp":1774974970641,"segment":0,"confidence":null,"iterationTokens":9068,"asi":{"hypothesis":"TrailingBodyOnClass should be a safe whole-node-style rewrite candidate: replace the body-separating semicolon span with newline+indent to make class bodies start on their own line.","cop":"Style/TrailingBodyOnClass","test_scope":"cargo test --lib -- cop::style::trailing_body_on_class","learning":"A conservative correction that only rewrites the semicolon-to-body span (from class keyword header region to first body statement start) preserves body text while matching offense intent.","safety":"Autocorrect applies only to already-flagged trailing-body class/sclass nodes and only when a separator semicolon is found before body start; single-line class/sclass definitions remain excluded.","next_action_hint":"Next in same family: Style/TrailingBodyOnModule and Style/TrailingBodyOnMethodDefinition using the same semicolon-to-newline strategy."}}
{"run":3,"commit":"a510d64","metric":180,"metrics":{"nitrocop_autocorrectable_cops":279,"implemented_core_rubocop_autocorrectable":458,"core_overlap_autocorrectable":278,"core_rubocop_autocorrect_total":467},"status":"keep","description":"Enable autocorrect for Style/TrailingBodyOnModule by moving offense-matched inline module body starts to their own indented line via semicolon-to-newline replacement; add corrected fixture and autocorrect tests.","timestamp":1774975114707,"segment":0,"confidence":2,"iterationTokens":4405,"asi":{"hypothesis":"TrailingBodyOnModule should be another safe whole-node separator rewrite using the same strategy as TrailingBodyOnClass.","cop":"Style/TrailingBodyOnModule","test_scope":"cargo test --lib -- cop::style::trailing_body_on_module","learning":"Module-body autocorrect works by rewriting only the separator span (`;` + spaces) between `module` header and first body statement; this preserves body content and indentation semantics.","safety":"Autocorrect is gated to existing offenses (multiline modules with body start on header line) and only applies when a semicolon separator is found.","next_action_hint":"Proceed to Style/TrailingBodyOnMethodDefinition with the same localized separator rewrite pattern."}}
{"run":182,"commit":"006f8a5","metric":178,"metrics":{"nitrocop_autocorrectable_cops":281,"implemented_core_rubocop_autocorrectable":458,"core_overlap_autocorrectable":280,"core_rubocop_autocorrect_total":467},"status":"keep","description":"Enable autocorrect for Lint/RedundantCopDisableDirective by adding conservative directive deletion in post-processing (single-cop disable/todo directives only), mark cop autocorrectable, and add integration autocorrect coverage.","timestamp":1774986070533,"segment":0,"confidence":4.359550561797753,"iterationTokens":4405,"asi":{"hypothesis":"RedundantCopDisableDirective can safely become autocorrectable by deleting only standalone or inline single-cop redundant disable/todo directives in linter post-processing, while leaving mixed multi-cop directives offense-only.","cop":"Lint/RedundantCopDisableDirective","test_scope":"cargo test --test integration redundant_disable -- --nocapture && cargo test --lib -- cop::lint::redundant_cop_disable_directive","learning":"Computing correction ranges from directive line/column and gating on single-cop directives avoids unsafe removal when only part of a multi-cop directive is redundant.","safety":"Autocorrect is constrained to already-flagged redundant directives and only when the comment targets exactly one cop token; mixed directives remain diagnostics-only.","next_action_hint":"Continue Remaining Lint/Security/Naming lane by targeting a low-risk Lint or Naming cop with bounded token/line rewrites (e.g., Naming/BinaryOperatorParameterName or Lint/OrderedMagicComments)."}}
{"run":183,"commit":"7e16154","metric":177,"metrics":{"nitrocop_autocorrectable_cops":282,"implemented_core_rubocop_autocorrectable":458,"core_overlap_autocorrectable":281,"core_rubocop_autocorrect_total":467},"status":"keep","description":"Enable autocorrect for Naming/BinaryOperatorParameterName by renaming offense-matched single required operator params to `other` and updating same-scope local reads; add corrected fixture and autocorrect tests.","timestamp":1774986337833,"segment":0,"confidence":4.333333333333333,"iterationTokens":10733,"asi":{"hypothesis":"BinaryOperatorParameterName can safely become autocorrectable via parameter-token replacement to `other` plus conservative same-scope local-read renames, skipping nested scopes.","cop":"Naming/BinaryOperatorParameterName","test_scope":"cargo test --lib -- cop::naming::binary_operator_parameter_name","learning":"A focused local-variable read finder that does not recurse into nested block/lambda/def/class/module scopes preserves safety while fixing in-method references.","safety":"Autocorrect only applies to already-flagged operator defs with exactly one required parameter; accepted names (`other`, `_other`) remain unchanged.","next_action_hint":"Continue Remaining Lint/Security/Naming lane by targeting another low-risk missing cop (likely Lint/OrderedMagicComments or Naming/MemoizedInstanceVariableName)."}}
{"run":184,"commit":"4aaac87","metric":176,"metrics":{"nitrocop_autocorrectable_cops":283,"implemented_core_rubocop_autocorrectable":458,"core_overlap_autocorrectable":282,"core_rubocop_autocorrect_total":467},"status":"keep","description":"Enable autocorrect for Lint/ParenthesesAsGroupedExpression by deleting the offense-matched whitespace between method selector and grouped paren argument; add corrected fixture and autocorrect tests.","timestamp":1774986589505,"segment":0,"confidence":4.355555555555555,"iterationTokens":31731,"asi":{"hypothesis":"ParenthesesAsGroupedExpression can become safely autocorrectable with a bounded token deletion of the method-to-paren whitespace on already-detected offenses.","cop":"Lint/ParenthesesAsGroupedExpression","test_scope":"cargo test --lib -- cop::lint::parentheses_as_grouped_expression","learning":"A single correction range (`message_loc.end..paren_start`) reliably normalizes `foo (x)` to `foo(x)` across receiver/safe-nav/hash/range variants already in fixture scope.","safety":"Autocorrect only applies when existing offense guards pass (one ParenthesesNode arg, whitespace-only gap, non-operator/setter exclusions).","next_action_hint":"Continue Remaining Lint/Security/Naming lane; next low-risk target candidates include Lint/OrderedMagicComments or Naming/MemoizedInstanceVariableName."}}
