{"run":117,"commit":"1f68cc7","metric":228,"metrics":{"nitrocop_autocorrectable_cops":231,"implemented_core_rubocop_autocorrectable":458,"core_overlap_autocorrectable":230,"core_rubocop_autocorrect_total":467},"status":"keep","description":"Enable autocorrect for Style/EmptyStringInsideInterpolation (trailing_conditional style) by rewriting ternary interpolation branches with empty-string/nil outcomes into `if`/`unless` trailing-condition expressions.","timestamp":1774916774640,"segment":0,"confidence":4.9655172413793105,"iterationTokens":4866,"asi":{"hypothesis":"Ternary-in-interpolation offenses with one empty branch can be safely normalized to trailing conditional form without changing string output semantics.","cop":"Style/EmptyStringInsideInterpolation","test_scope":"cargo test --lib -- cop::style::empty_string_inside_interpolation","learning":"Replacing only the inner if/ternary expression span inside `#{...}` with `<non_empty_expr> if|unless <condition>` produced fixture-stable output for empty-string and nil branch cases.","safety":"Correction remains bounded to offense-matched ternary branches in interpolation; no broad string restructuring."}}
{"run":118,"commit":"da6b3bb","metric":227,"metrics":{"nitrocop_autocorrectable_cops":232,"implemented_core_rubocop_autocorrectable":458,"core_overlap_autocorrectable":231,"core_rubocop_autocorrect_total":467},"status":"keep","description":"Enable autocorrect for Style/TernaryParentheses across styles by adding/removing predicate parentheses with bounded delimiter insert/remove edits and corrected fixture coverage.","timestamp":1774917015855,"segment":0,"confidence":4.915254237288136,"iterationTokens":7844,"asi":{"hypothesis":"TernaryParentheses offenses are delimiter-local transformations, so autocorrect can be safely implemented without altering ternary branch expressions.","cop":"Style/TernaryParentheses","test_scope":"cargo test --lib -- cop::style::ternary_parentheses","learning":"For parenthesized predicates, removing opening/closing paren tokens at `ParenthesesNode` locs is stable; for missing-paren modes, zero-width insertion at predicate bounds works cleanly.","safety":"Corrections are strictly token-level around predicate boundaries and respect existing AllowSafeAssignment gating."}}
{"run":119,"commit":"8213d8e","metric":226,"metrics":{"nitrocop_autocorrectable_cops":233,"implemented_core_rubocop_autocorrectable":458,"core_overlap_autocorrectable":232,"core_rubocop_autocorrect_total":467},"status":"keep","description":"Enable autocorrect for Style/OneLineConditional by rewriting single-line `if/unless ... then ... else ... end` forms to ternary expressions with preserved branch order.","timestamp":1774917356787,"segment":0,"confidence":4.866666666666666,"iterationTokens":10801,"asi":{"hypothesis":"OneLineConditional offenses can be safely corrected as full-expression rewrites to ternary syntax when single-line and single-expression branch constraints are met.","cop":"Style/OneLineConditional","test_scope":"cargo test --lib -- cop::style::one_line_conditional","learning":"Using predicate + single statement sources from then/else branches allows deterministic rewrites (`if` -> `cond ? then : else`, `unless` -> `cond ? else : then`) while preserving branch semantics.","safety":"Autocorrect gated by existing single-line if/unless checks and only applies when branch extraction yields exactly one statement per branch."}}
{"run":120,"commit":"d2bc831","metric":225,"metrics":{"nitrocop_autocorrectable_cops":234,"implemented_core_rubocop_autocorrectable":458,"core_overlap_autocorrectable":233,"core_rubocop_autocorrect_total":467},"status":"keep","description":"Enable autocorrect for Style/NonNilCheck by rewriting offense-matched `x != nil` forms to `!x.nil?` with corrected fixture coverage.","timestamp":1774917491402,"segment":0,"confidence":4.819672131147541,"iterationTokens":4170,"asi":{"hypothesis":"NonNilCheck’s non-semantic offense path (`!= nil`) supports a deterministic expression rewrite to `!receiver.nil?` without detection expansion.","cop":"Style/NonNilCheck","test_scope":"cargo test --lib -- cop::style::non_nil_check","learning":"Using the existing offense location range for `!= nil` and the already-derived receiver source allows a single replacement correction that matches fixture output.","safety":"Autocorrect is applied only on the non-semantic `!= nil` offense branch and respects predicate-method return-position exclusions."}}
{"run":121,"commit":"a5b38b3","metric":224,"metrics":{"nitrocop_autocorrectable_cops":235,"implemented_core_rubocop_autocorrectable":458,"core_overlap_autocorrectable":234,"core_rubocop_autocorrect_total":467},"status":"keep","description":"Enable autocorrect for Style/RedundantInterpolation by rewriting single-expression interpolation strings (`\"#{expr}\"`) to direct `expr.to_s` expressions.","timestamp":1774917666272,"segment":0,"confidence":4.774193548387097,"iterationTokens":6927,"asi":{"hypothesis":"RedundantInterpolation offenses are direct string-wrapper removals around a single embedded expression, allowing safe full-expression replacement to `<expr>.to_s`.","cop":"Style/RedundantInterpolation","test_scope":"cargo test --lib -- cop::style::redundant_interpolation","learning":"Replacing the full interpolated string node with the inner expression plus `.to_s` works for fixture-covered lvar and call receivers while preserving existing skips for implicit concat and percent-array contexts.","safety":"Autocorrect only applies to the already-restricted single embedded-expression interpolation form; complex interpolations remain offense-only."}}
{"run":122,"commit":"7a2a5bc","metric":223,"metrics":{"nitrocop_autocorrectable_cops":236,"implemented_core_rubocop_autocorrectable":458,"core_overlap_autocorrectable":235,"core_rubocop_autocorrect_total":467},"status":"keep","description":"Enable autocorrect for Style/NestedParenthesizedCalls by adding explicit parentheses around nested inner method-call arguments inside parenthesized outer calls.","timestamp":1774917856092,"segment":0,"confidence":4.806451612903226,"iterationTokens":5682,"asi":{"hypothesis":"NestedParenthesizedCalls offenses are syntax-local: replacing the gap between inner method name and first arg with `(` and appending `)` at inner call end should preserve semantics.","cop":"Style/NestedParenthesizedCalls","test_scope":"cargo test --lib -- cop::style::nested_parenthesized_calls","learning":"Using `message_loc.end..first_arg.start` replacement avoids spacing artifacts (`bar( baz)`), yielding stable `bar(baz)` style corrections.","safety":"Autocorrect runs only on existing offense-matched inner calls (non-operator, arg-bearing, no existing parens) and does not alter argument content/order."}}
{"run":123,"commit":"d37691a","metric":222,"metrics":{"nitrocop_autocorrectable_cops":237,"implemented_core_rubocop_autocorrectable":458,"core_overlap_autocorrectable":236,"core_rubocop_autocorrect_total":467},"status":"keep","description":"Enable autocorrect for Lint/UselessDefaultValueArgument by removing redundant default-value arguments when a literal block already supersedes them in `fetch` and `Array.new` calls.","timestamp":1774918028449,"segment":0,"confidence":4.6875,"iterationTokens":5856,"asi":{"hypothesis":"UselessDefaultValueArgument offenses are argument-list local deletions, so removing the second argument span should safely preserve block semantics.","cop":"Lint/UselessDefaultValueArgument","test_scope":"cargo test --lib -- cop::lint::useless_default_value_argument","learning":"Deleting from first-arg end to default-arg end cleanly removes comma+default for both `fetch` and `Array.new` offense shapes while leaving block and first arg intact.","safety":"Autocorrect only triggers on existing offense-gated calls (literal block present, exact 2-arg shape, receiver checks preserved)."}}
{"run":124,"commit":"5c99bde","metric":221,"metrics":{"nitrocop_autocorrectable_cops":238,"implemented_core_rubocop_autocorrectable":458,"core_overlap_autocorrectable":237,"core_rubocop_autocorrect_total":467},"status":"keep","description":"Enable autocorrect for Lint/NumericOperationWithConstantResult: replace constant-result expressions with literal constants and operator-assignment forms with direct assignment (`x *= 0`→`x = 0`, `x **= 0`→`x = 1`).","timestamp":1774918273899,"segment":0,"confidence":4.71875,"iterationTokens":6705,"asi":{"hypothesis":"NumericOperationWithConstantResult offenses are deterministic constant folds, so full-expression replacement should be safe and RuboCop-aligned.","cop":"Lint/NumericOperationWithConstantResult","test_scope":"cargo test --lib -- cop::lint::numeric_operation_with_constant_result","learning":"Using node-local replacements (`call`→`0/1`, `local op-write`→`name = 0/1`) preserves surrounding syntax while adding parity for both plain ops and abbreviated assignments.","safety":"Corrections only apply to already-gated offense shapes (bare-method receiver checks retained; only `* 0`, `** 0`, and `/ same` forms)."}}
{"run":125,"commit":"080ac6d","metric":220,"metrics":{"nitrocop_autocorrectable_cops":239,"implemented_core_rubocop_autocorrectable":458,"core_overlap_autocorrectable":238,"core_rubocop_autocorrect_total":467},"status":"keep","description":"Enable autocorrect for Style/MapIntoArray conservative local-assignment cases by rewriting offense-matched `each` push loops to direct `var = receiver.map { |arg| expr }` forms; prune completed idea entry.","timestamp":1774918535147,"segment":0,"confidence":4.75,"iterationTokens":33456,"asi":{"hypothesis":"For simple `dest = []` + `receiver.each { |x| dest << expr }` patterns, full-call replacement to `dest = receiver.map { |x| expr }` is syntax-local and safe enough for parity while leaving complex tap/multi-step forms unchanged.","cop":"Style/MapIntoArray","test_scope":"cargo test --lib -- cop::style::map_into_array","learning":"Capturing push-arg source offsets and block param name enables stable rewrite generation without broad AST reshaping; keeping tap-pattern offenses uncorrected avoids riskier control-flow edits.","safety":"Autocorrect is limited to existing conservative offense shape in statement-sequence path; safe-navigation, intermediate references, operator writes, and other pre-existing guardrails remain intact."}}
{"run":126,"commit":"bb90bba","metric":219,"metrics":{"nitrocop_autocorrectable_cops":240,"implemented_core_rubocop_autocorrectable":458,"core_overlap_autocorrectable":239,"core_rubocop_autocorrect_total":467},"status":"keep","description":"Enable autocorrect for Style/MapCompactWithConditionalBlock on conservative `map { ... }.compact` offenses by rewriting `map` selector to `filter_map` and dropping trailing `.compact`; prune completed idea entry.","timestamp":1774918677609,"segment":0,"confidence":4.636363636363637,"iterationTokens":11448,"asi":{"hypothesis":"For offense-matched `map`-with-conditional block plus `.compact`, selector-only rewrite (`map`→`filter_map`) and suffix removal are local, semantics-preserving in the flagged pattern, and low-risk.","cop":"Style/MapCompactWithConditionalBlock","test_scope":"cargo test --lib -- cop::style::map_compact_with_conditional_block","learning":"A minimal two-edit strategy (map selector replacement + receiver-tail deletion) works across block and modifier forms while intentionally leaving `filter_map`→`select/reject` offenses uncorrected for now.","safety":"Autocorrect is gated to the existing conditional-pattern checks and only applied when the chained receiver method is exactly `map`; no control-flow/body rewrites are performed."}}
{"run":127,"commit":"a6b5c30","metric":218,"metrics":{"nitrocop_autocorrectable_cops":241,"implemented_core_rubocop_autocorrectable":458,"core_overlap_autocorrectable":240,"core_rubocop_autocorrect_total":467},"status":"keep","description":"Enable conservative autocorrect for Lint/UselessTimes: remove own-line `N.times` calls for `N <= 0`, rewrite `1.times(&:sym)` to `sym`, and rewrite simple own-line single-statement `1.times { ... }` blocks to their body.","timestamp":1774918842641,"segment":0,"confidence":4.666666666666667,"iterationTokens":5619,"asi":{"hypothesis":"Low-risk subset of UselessTimes can be autocorrected with local call replacement/removal while leaving ambiguous cases (e.g., bare `1.times` or non-own-line expressions) offense-only.","cop":"Lint/UselessTimes","test_scope":"cargo test --lib -- cop::lint::useless_times","learning":"Whole-line guards prevent unsafe partial-line removals; symbol block-pass and single-statement block rewrites provide parity gains without broad AST surgery.","safety":"Autocorrect is intentionally constrained to own-line cases and known deterministic replacements."}}
{"run":128,"commit":"6b94bec","metric":217,"metrics":{"nitrocop_autocorrectable_cops":242,"implemented_core_rubocop_autocorrectable":458,"core_overlap_autocorrectable":241,"core_rubocop_autocorrect_total":467},"status":"keep","description":"Enable autocorrect for Style/DataInheritance by rewriting offense-matched `class Name < Data.define(...) ... end` forms into `Name = Data.define(...)` assignments, preserving class body as a `do ... end` block when present.","timestamp":1774919132323,"segment":0,"confidence":4.5588235294117645,"iterationTokens":13806,"asi":{"hypothesis":"DataInheritance offenses can be corrected via full class-node replacement because the superclass `Data.define(...)` call already provides the canonical constructor target.","cop":"Style/DataInheritance","test_scope":"cargo test --lib -- cop::style::data_inheritance","learning":"Class-level replacement with body-preserving block output matches fixture expectations and keeps corrections bounded to offense nodes.","safety":"Autocorrect only runs for existing offense-matched classes inheriting from `Data.define`; non-Data inheritance and already-good assignment forms remain untouched."}}
{"run":129,"commit":"5172a37","metric":216,"metrics":{"nitrocop_autocorrectable_cops":243,"implemented_core_rubocop_autocorrectable":458,"core_overlap_autocorrectable":242,"core_rubocop_autocorrect_total":467},"status":"keep","description":"Enable autocorrect for Lint/ScriptPermission by marking script files executable (`+x`) when a shebang file is flagged as non-executable; add unix test coverage for execute-bit mutation.","timestamp":1774919276196,"segment":0,"confidence":4.588235294117647,"iterationTokens":10089,"asi":{"hypothesis":"ScriptPermission can mirror RuboCop autocorrect semantics safely by applying file-permission correction (execute bits) during autocorrect requests rather than source rewrite.","cop":"Lint/ScriptPermission","test_scope":"cargo test --lib -- cop::lint::script_permission","learning":"Executing chmod-style correction through `check_lines` with `corrections.is_some()` allows parity without textual edits; diagnostic can still report corrected status.","safety":"Autocorrect only runs for shebang files already flagged by the cop and only ORs execute bits on unix platforms."}}
{"run":130,"commit":"a58cef5","metric":215,"metrics":{"nitrocop_autocorrectable_cops":244,"implemented_core_rubocop_autocorrectable":458,"core_overlap_autocorrectable":243,"core_rubocop_autocorrect_total":467},"status":"keep","description":"Enable autocorrect for Style/BitwisePredicate by rewriting flagged bitwise comparisons/predicate checks to `anybits?`, `nobits?`, or `allbits?` call forms based on offense pattern.","timestamp":1774919462339,"segment":0,"confidence":4.485714285714286,"iterationTokens":13235,"asi":{"hypothesis":"BitwisePredicate already computes deterministic preferred replacements for offense patterns, so full-node replacement should safely add RuboCop autocorrect parity.","cop":"Style/BitwisePredicate","test_scope":"cargo test --lib -- cop::style::bitwise_predicate","learning":"Using existing pattern helpers (`preferred_allbits`, receiver/arg extraction) keeps corrections localized and consistent with offense messaging.","safety":"Autocorrect only applies to already-matched parenthesized bitwise-comparison patterns and uses explicit receiver/argument source slices for replacement."}}
{"run":131,"commit":"cc6c0d1","metric":214,"metrics":{"nitrocop_autocorrectable_cops":245,"implemented_core_rubocop_autocorrectable":458,"core_overlap_autocorrectable":244,"core_rubocop_autocorrect_total":467},"status":"keep","description":"Enable Security/YAMLLoad autocorrect with Ruby-version guard: flag `YAML.load`/`::YAML.load` only for TargetRubyVersion <= 3.0 and autocorrect selector to `safe_load`.","timestamp":1774919664760,"segment":0,"confidence":4.514285714285714,"iterationTokens":6177,"asi":{"hypothesis":"Security/YAMLLoad can be safely re-enabled for pre-3.1 Ruby targets with straightforward selector rewrite to `safe_load`, matching RuboCop behavior while avoiding metric-only toggles.","cop":"Security/YAMLLoad","test_scope":"cargo test --lib -- cop::security::yaml_load","learning":"TargetRubyVersion gate (default 2.7, skip >3.0) plus constant receiver checks keeps behavior aligned and constrained; autocorrect is a local selector replacement.","safety":"Autocorrect only applies to offense-matched YAML constant load calls under Ruby <= 3.0 semantics."}}
{"run":132,"commit":"6d8e889","metric":213,"metrics":{"nitrocop_autocorrectable_cops":246,"implemented_core_rubocop_autocorrectable":458,"core_overlap_autocorrectable":245,"core_rubocop_autocorrect_total":467},"status":"keep","description":"Enable conservative autocorrect for Style/ClassMethodsDefinitions: for simple `class << self` blocks containing only plain public `def` nodes, rewrite methods to `def self.name` and collapse the singleton-class wrapper.","timestamp":1774919894366,"segment":0,"confidence":4.47887323943662,"iterationTokens":7004,"asi":{"hypothesis":"A narrow subset of ClassMethodsDefinitions offenses can be safely autocorrected by structural wrapper removal when the singleton class body is defs-only and public.","cop":"Style/ClassMethodsDefinitions","test_scope":"cargo test --lib -- cop::style::class_methods_definitions","learning":"Full-wrapper replacement is stable for defs-only cases; mixed visibility/attr/include forms remain offense-only to avoid unsafe reshaping.","safety":"Autocorrect only applies when `rewrite_simple_sclass_to_def_self` confirms an all-defs singleton class with no receiver-qualified defs."}}
{"run":133,"commit":"6d8e889","metric":213,"metrics":{"nitrocop_autocorrectable_cops":246,"implemented_core_rubocop_autocorrectable":458,"core_overlap_autocorrectable":245,"core_rubocop_autocorrect_total":467},"status":"discard","description":"Attempted to extend Lint/NumberConversion autocorrect to symbol/block-pass forms (`map(&:to_i)`, `try(:to_f)`, `send(:to_c)`) with parenthesis-safe rewrites; parity metric unchanged.","timestamp":1774920130893,"segment":0,"confidence":4.416666666666667,"iterationTokens":12456,"asi":{"hypothesis":"Adding conservative symbol-form autocorrect in NumberConversion would reduce missing core autocorrect cops by 1 while preserving syntax via call-paren rewrites.","cop":"Lint/NumberConversion","test_scope":"cargo test --lib -- cop::lint::number_conversion","result":"No primary metric change (still 213), indicating this cop was already counted as autocorrectable for overlap metric purposes.","rollback_reason":"Primary metric unchanged; per autoresearch policy discard unchanged experiments.","next_action_hint":"Target a cop still in missing set (e.g., Style/DigChain one-pass full collapse, Lint/AmbiguousRegexpLiteral conservative, or Layout backlog entry) rather than deepening already-counted autocorrectable cops.","learning":"Symbol-form rewrites are now syntax-safe for parenthesized/non-parenthesized block-pass and symbol-arg calls without existing explicit block; can be reintroduced later if broader quality goals need it."}}
{"run":134,"commit":"70ea34a","metric":212,"metrics":{"nitrocop_autocorrectable_cops":247,"implemented_core_rubocop_autocorrectable":458,"core_overlap_autocorrectable":246,"core_rubocop_autocorrect_total":467},"status":"keep","description":"Enable autocorrect for Migration/DepartmentName by qualifying unqualified directive cop tokens to unique registry matches (e.g., `Alias`→`Style/Alias`, `LineLength`→`Layout/LineLength`).","timestamp":1774920326647,"segment":0,"confidence":4.383561643835616,"iterationTokens":19253,"asi":{"hypothesis":"DepartmentName can safely autocorrect missing-department tokens by resolving unique short cop names from the local registry and replacing only offending token spans.","cop":"Migration/DepartmentName","test_scope":"cargo test --lib -- cop::migration::department_name","learning":"Building a lazy short-name→qualified-name map from `CopRegistry::default_registry()` enables deterministic corrections while skipping ambiguous short names.","safety":"Autocorrect is conservative: only applies when short name resolves uniquely; ambiguous or invalid tokens remain offense-only."}}
