{"run":1,"commit":"2f03164","metric":123,"metrics":{"nitrocop_autocorrectable_cops":336,"implemented_core_rubocop_autocorrectable":458,"core_overlap_autocorrectable":335,"core_rubocop_autocorrect_total":467},"status":"keep","description":"Enable autocorrect for Layout/FirstMethodArgumentLineBreak by inserting a line break before offense-matched first arguments in multiline parenthesized call/super forms (including block-argument cases), with corrected fixture and autocorrect tests.","timestamp":1775004505465,"segment":0,"confidence":null,"iterationTokens":null,"asi":{"hypothesis":"Layout/FirstMethodArgumentLineBreak can be made autocorrectable with bounded opening-paren-to-first-argument separator rewrites on already-detected offenses.","cop":"Layout/FirstMethodArgumentLineBreak","focus_area":"Layout cops with delimiter/whitespace edits","test_scope":"cargo test --lib -- cop::layout::first_method_argument_line_break","learning":"Using insert range from opening `(` end to first argument start yields deterministic newline insertion; block-argument-only cases require preserving first-arg column instead of borrowing next-line indent.","safety":"Autocorrect is constrained to existing offense paths (parenthesized call/super forms, AllowedMethods and final-element checks unchanged) and only rewrites separator whitespace/newline."}}
{"run":2,"commit":"b578e26","metric":122,"metrics":{"nitrocop_autocorrectable_cops":337,"implemented_core_rubocop_autocorrectable":458,"core_overlap_autocorrectable":336,"core_rubocop_autocorrect_total":467},"status":"keep","description":"Enable autocorrect for Layout/FirstMethodParameterLineBreak by inserting a line break before offense-matched first parameters in multiline parenthesized method definitions; add corrected fixture and autocorrect tests.","timestamp":1775004650595,"segment":0,"confidence":null,"iterationTokens":5991,"asi":{"hypothesis":"Layout/FirstMethodParameterLineBreak can be made autocorrectable with bounded `(`-to-first-parameter separator rewrites on already-detected multiline signatures.","cop":"Layout/FirstMethodParameterLineBreak","focus_area":"Layout cops with delimiter/whitespace edits","test_scope":"cargo test --lib -- cop::layout::first_method_parameter_line_break","learning":"Using the def lparen end to first-parameter start replacement yields deterministic newline insertion and works with keyword/mixed parameter lists while preserving existing multiline-final-element behavior.","safety":"Autocorrect remains constrained to current offense checks (parenthesized defs only, AllowMultilineFinalElement unchanged) and edits only the separator before the first parameter."}}
{"run":231,"commit":"48ae5fd","metric":121,"metrics":{"nitrocop_autocorrectable_cops":338,"implemented_core_rubocop_autocorrectable":458,"core_overlap_autocorrectable":337,"core_rubocop_autocorrect_total":467},"status":"keep","description":"Enable autocorrect for Layout/FirstParameterIndentation by normalizing misindented first-parameter line leading whitespace to expected column (consistent/align_parentheses), with corrected fixture and autocorrect tests.","timestamp":1775004845084,"segment":0,"confidence":4.482142857142857,"iterationTokens":5991,"asi":{"hypothesis":"Layout/FirstParameterIndentation should be a bounded whitespace-only autocorrect win by replacing leading indentation on the first parameter line for already-detected multiline def signatures.","cop":"Layout/FirstParameterIndentation","focus_area":"Layout cops with delimiter/whitespace edits","test_scope":"cargo test --lib -- cop::layout::first_parameter_indentation","learning":"Replacing line-leading whitespace range `line_start..line_start+first_col` with expected indentation cleanly autocorrects all existing offense cases without touching parameter text.","safety":"Autocorrect remains constrained to existing offenses (parenthesized multiline defs with first param on later line) and edits only leading whitespace.","next_action_hint":"Prune completed FirstMethodParameterLineBreak idea and target another remaining Layout whitespace/alignment cop from the current missing set."}}
{"run":232,"commit":"f515b85","metric":120,"metrics":{"nitrocop_autocorrectable_cops":339,"implemented_core_rubocop_autocorrectable":458,"core_overlap_autocorrectable":338,"core_rubocop_autocorrect_total":467},"status":"keep","description":"Enable autocorrect for Layout/FirstArgumentIndentation by normalizing offense-matched first-argument leading whitespace (including tab-indented lines) and add corrected fixture autocorrect coverage.","timestamp":1775005088341,"segment":0,"confidence":4.460176991150442,"iterationTokens":32319,"asi":{"hypothesis":"Layout/FirstArgumentIndentation can become autocorrectable with bounded line-leading whitespace replacement from line start to first-arg start on existing offenses.","cop":"Layout/FirstArgumentIndentation","focus_area":"Layout cops with delimiter/whitespace edits","test_scope":"cargo test --lib -- cop::layout::first_argument_indentation","learning":"Visitor-level correction buffering works for this check_source cop; correction ranges should use byte offsets `line_start..first_arg_start` to avoid column/UTF-8 mismatches.","safety":"Autocorrect only adjusts leading indentation for already-flagged first-argument offenses and leaves detection logic untouched.","next_action_hint":"Prune completed FirstParameterIndentation idea and continue layout whitespace/alignment lane (e.g., FirstArrayElementIndentation or FirstHashElementIndentation)."}}
{"run":1,"commit":"5cf5dbd","metric":119,"metrics":{"nitrocop_autocorrectable_cops":340,"implemented_core_rubocop_autocorrectable":458,"core_overlap_autocorrectable":339,"core_rubocop_autocorrect_total":467},"status":"keep","description":"Enable autocorrect for Layout/FirstHashElementIndentation by normalizing line-leading indentation for offense-matched first hash elements and right braces, with corrected fixture/autocorrect coverage.","timestamp":1775005336245,"segment":0,"confidence":null,"iterationTokens":null,"asi":{"hypothesis":"Layout/FirstHashElementIndentation can be made autocorrectable via bounded line-leading whitespace replacements at existing offense locations (first pair and closing brace).","cop":"Layout/FirstHashElementIndentation","focus_area":"Layout cops with delimiter/whitespace edits","test_scope":"cargo test --lib -- cop::layout::first_hash_element_indentation","learning":"For this check_source visitor, buffering corrections and applying line_start..token_start replacements is enough to autocorrect both first-element and right-brace offenses without changing matching logic.","safety":"Autocorrect edits only indentation prefixes for already-reported offenses; hash traversal/indent-base computation remains unchanged.","next_action_hint":"Prune completed FirstArrayElementIndentation idea and continue with another bounded Layout whitespace/alignment cop from the remaining missing set."}}
{"run":2,"commit":"6bc5fdb","metric":118,"metrics":{"nitrocop_autocorrectable_cops":341,"implemented_core_rubocop_autocorrectable":458,"core_overlap_autocorrectable":340,"core_rubocop_autocorrect_total":467},"status":"keep","description":"Enable autocorrect for Layout/FirstArrayElementIndentation by applying bounded line-leading indentation fixes for offense-matched first elements and closing brackets; add corrected fixture/autocorrect coverage.","timestamp":1775005533534,"segment":0,"confidence":null,"iterationTokens":9635,"asi":{"hypothesis":"Layout/FirstArrayElementIndentation can become autocorrectable with local indentation-prefix rewrites at existing offense sites (first element + right bracket).","cop":"Layout/FirstArrayElementIndentation","focus_area":"Layout cops with delimiter/whitespace edits","test_scope":"cargo test --lib -- cop::layout::first_array_element_indentation","learning":"For mixed indent-base styles, reusing existing expected columns and rewriting `line_start..token_start` ranges is sufficient; no AST/detection changes needed.","safety":"Autocorrect only rewrites leading whitespace before already-flagged array elements/brackets and preserves current style/base selection logic.","next_action_hint":"Prune completed FirstArrayElementIndentation idea; continue with another low-risk Layout whitespace/alignment cop from remaining list (e.g., FirstHashElementIndentation already done, next candidate in remaining Layout set)."}}
{"run":235,"commit":"d98ef3e","metric":117,"metrics":{"nitrocop_autocorrectable_cops":342,"implemented_core_rubocop_autocorrectable":458,"core_overlap_autocorrectable":341,"core_rubocop_autocorrect_total":467},"status":"keep","description":"Enable autocorrect for Layout/ParameterAlignment by normalizing offense-matched parameter line-leading indentation to the expected column (with_first_parameter/with_fixed_indentation) and add corrected fixture coverage.","timestamp":1775005756961,"segment":0,"confidence":4.473684210526316,"iterationTokens":9635,"asi":{"hypothesis":"Layout/ParameterAlignment is a bounded whitespace-alignment candidate: replace only leading indentation before misaligned first parameter on each continuation line.","cop":"Layout/ParameterAlignment","focus_area":"Layout cops with delimiter/whitespace edits","test_scope":"cargo test --lib -- cop::layout::parameter_alignment","learning":"Reusing existing alignment-column logic and adding `line_start..param_col` whitespace replacement gives deterministic corrections, including misaligned `&block` parameters, without changing detection.","safety":"Autocorrect only applies to existing offenses that begin their line and only edits line-leading whitespace.","next_action_hint":"Continue layout delimiter/whitespace lane with another bounded remaining Layout cop from the missing set (likely another alignment/spacing cop with line-leading replacements)."}}
