{"type":"config","name":"Close RuboCop core autocorrect gap","metricName":"missing_core_autocorrect_cops","metricUnit":"","bestDirection":"lower"}
{"run":1,"commit":"9fec7d5","metric":372,"metrics":{"nitrocop_autocorrectable_cops":87,"implemented_core_rubocop_autocorrectable":458,"core_overlap_autocorrectable":86,"core_rubocop_autocorrect_total":467},"status":"keep","description":"Baseline: measured current core RuboCop autocorrect gap after autoresearch scaffolding.","timestamp":1774887396813,"segment":0,"confidence":null,"iterationTokens":141,"asi":{"hypothesis":"Establish a deterministic baseline metric before implementing any new cop autocorrections.","baseline_missing_core_autocorrect_cops":372,"next_action_hint":"Implement autocorrect for a low-risk token replacement cop to reduce missing count by 1."}}
{"run":2,"commit":"8a45aab","metric":371,"metrics":{"nitrocop_autocorrectable_cops":88,"implemented_core_rubocop_autocorrectable":458,"core_overlap_autocorrectable":87,"core_rubocop_autocorrect_total":467},"status":"keep","description":"Add autocorrect for Style/EndBlock by rewriting END keyword to at_exit and add corrected fixture coverage.","timestamp":1774887550162,"segment":0,"confidence":null,"iterationTokens":3428,"asi":{"hypothesis":"Simple keyword replacement cops can provide low-risk +1 improvements quickly.","cop":"Style/EndBlock","learning":"RuboCop parity for this cop is a direct keyword replacement (`END` -> `at_exit`) with no structural rewrite needed.","test_scope":"cargo test --lib -- cop::style::end_block","next_action_hint":"Target another low-complexity token-level cop (e.g., Lint/BigDecimalNew)."}}
{"run":3,"commit":"5ca651b","metric":370,"metrics":{"nitrocop_autocorrectable_cops":89,"implemented_core_rubocop_autocorrectable":458,"core_overlap_autocorrectable":88,"core_rubocop_autocorrect_total":467},"status":"keep","description":"Implement autocorrect for Lint/BigDecimalNew by removing `.new` (and leading `::` for cbase) plus corrected fixture tests.","timestamp":1774887728532,"segment":0,"confidence":2,"iterationTokens":10810,"asi":{"hypothesis":"Small method-token removals are a reliable way to add parity quickly.","cop":"Lint/BigDecimalNew","learning":"Using selector range removal (`.new`) works for standard calls; cbase (`::BigDecimal`) also needs `::` removal to match RuboCop output.","test_scope":"cargo test --lib -- cop::lint::big_decimal_new","next_action_hint":"Continue with single-selector replacement/remove cops in Style/Lint for incremental -1 improvements."}}
{"run":4,"commit":"67377b4","metric":369,"metrics":{"nitrocop_autocorrectable_cops":90,"implemented_core_rubocop_autocorrectable":458,"core_overlap_autocorrectable":89,"core_rubocop_autocorrect_total":467},"status":"keep","description":"Add autocorrect for Style/StderrPuts by rewriting receiver+selector (`$stderr.puts` / `STDERR.puts`) to `warn`, with corrected fixture coverage.","timestamp":1774887903162,"segment":0,"confidence":3,"iterationTokens":5226,"asi":{"hypothesis":"Receiver+selector replacement cops are another low-risk class for fast parity gains.","cop":"Style/StderrPuts","learning":"Replacing range [send start..selector end] with `warn` preserves argument syntax for both parenthesized and non-parenthesized calls.","test_scope":"cargo test --lib -- cop::style::stderr_puts","next_action_hint":"Look for additional one-range replacements (e.g., call-name swaps) before tackling multi-edit layout cops."}}
{"run":5,"commit":"e839437","metric":368,"metrics":{"nitrocop_autocorrectable_cops":91,"implemented_core_rubocop_autocorrectable":458,"core_overlap_autocorrectable":90,"core_rubocop_autocorrect_total":467},"status":"keep","description":"Implement autocorrect for Style/RedundantCurrentDirectoryInPath by removing leading `./+` from require_relative string literals and add corrected fixture tests.","timestamp":1774888085435,"segment":0,"confidence":4,"iterationTokens":6080,"asi":{"hypothesis":"String-prefix removal cops can be added with simple byte-range deletions.","cop":"Style/RedundantCurrentDirectoryInPath","learning":"Removing `./+` from quoted string content via byte offsets matches existing fixtures and preserves surrounding quotes.","test_scope":"cargo test --lib -- cop::style::redundant_current_directory_in_path","next_action_hint":"Keep targeting Style/Lint cops with single-range substitutions before moving to layout/indentation transforms."}}
{"run":6,"commit":"1218a8d","metric":367,"metrics":{"nitrocop_autocorrectable_cops":92,"implemented_core_rubocop_autocorrectable":458,"core_overlap_autocorrectable":91,"core_rubocop_autocorrect_total":467},"status":"keep","description":"Add autocorrect for Style/ArrayJoin by rewriting `array * string` calls to `array.join(string)` and add corrected fixture tests.","timestamp":1774888264684,"segment":0,"confidence":3.3333333333333335,"iterationTokens":4792,"asi":{"hypothesis":"Full-node replacement is effective for simple operator-to-method migrations.","cop":"Style/ArrayJoin","learning":"Replacing the full call with `<receiver_source>.join(<arg_source>)` matches fixture behavior and avoids partial-token edge cases.","test_scope":"cargo test --lib -- cop::style::array_join","next_action_hint":"Prioritize remaining Style cops that can be expressed as whole-call rewrites or simple selector swaps."}}
{"run":7,"commit":"bb26ef3","metric":366,"metrics":{"nitrocop_autocorrectable_cops":93,"implemented_core_rubocop_autocorrectable":458,"core_overlap_autocorrectable":92,"core_rubocop_autocorrect_total":467},"status":"keep","description":"Implement autocorrect for Style/ArrayCoercion by rewriting `[*expr]` to `Array(expr)` and add corrected fixture tests.","timestamp":1774888456791,"segment":0,"confidence":3,"iterationTokens":7188,"asi":{"hypothesis":"Single-splat array coercion cases can be safely converted with whole-node replacement.","cop":"Style/ArrayCoercion","learning":"For bracketed one-element arrays with splat, replacing full node with `Array(<splat_expr_source>)` matches current detection scope and fixture behavior.","test_scope":"cargo test --lib -- cop::style::array_coercion","next_action_hint":"Continue harvesting low-complexity Style cops using source-preserving whole-node replacements."}}
{"run":8,"commit":"32efcc3","metric":365,"metrics":{"nitrocop_autocorrectable_cops":94,"implemented_core_rubocop_autocorrectable":458,"core_overlap_autocorrectable":93,"core_rubocop_autocorrect_total":467},"status":"keep","description":"Add autocorrect for Style/EnvHome by replacing `ENV['HOME']`/`ENV.fetch('HOME', nil)` forms with `Dir.home` (leaving index-or-write cases uncorrected).","timestamp":1774888662875,"segment":0,"confidence":3.5,"iterationTokens":10775,"asi":{"hypothesis":"Direct expression replacement cops can still autocorrect partially even when some matched node shapes are intentionally non-correctable.","cop":"Style/EnvHome","learning":"Safe rewrite is straightforward for call-node forms; keeping `ENV['HOME'] ||= ...` unchanged avoids invalid assignment targets while still enabling autocorrect support.","test_scope":"cargo test --lib -- cop::style::env_home","next_action_hint":"Continue with cops where the offense range is the whole expression and replacement is a stable literal/template."}}
{"run":9,"commit":"7db1b18","metric":364,"metrics":{"nitrocop_autocorrectable_cops":95,"implemented_core_rubocop_autocorrectable":458,"core_overlap_autocorrectable":94,"core_rubocop_autocorrect_total":467},"status":"keep","description":"Implement autocorrect for Lint/IdentityComparison by rewriting `lhs.object_id ==/!= rhs.object_id` to `lhs.equal?(rhs)` / `!lhs.equal?(rhs)`, with corrected fixture coverage and research log update.","timestamp":1774888856653,"segment":0,"confidence":4,"iterationTokens":6766,"asi":{"hypothesis":"Object-id comparison cops can be converted with receiver extraction and whole-expression replacement.","cop":"Lint/IdentityComparison","learning":"Using inner `.object_id` receiver source for both sides preserves ivar/lvar forms and yields clean `equal?` rewrites for both `==` and `!=`.","test_scope":"cargo test --lib -- cop::lint::identity_comparison","next_action_hint":"Continue targeting call-rewrite cops in Lint/Style before addressing layout-family autocorrections."}}
{"run":10,"commit":"2acce33","metric":361,"metrics":{"nitrocop_autocorrectable_cops":98,"implemented_core_rubocop_autocorrectable":458,"core_overlap_autocorrectable":97,"core_rubocop_autocorrect_total":467},"status":"keep","description":"Add autocorrect for Style/Dir (`File.expand_path(File.dirname(__FILE__))`/`File.dirname(File.realpath(__FILE__))` -> `__dir__`), Style/SymbolLiteral (`:\"foo\"` -> `:foo`), and Style/FileNull (null-device string -> `File::NULL`) with corrected fixtures.","timestamp":1774889344633,"segment":0,"confidence":4.4,"iterationTokens":13553,"asi":{"hypothesis":"Batching several low-complexity whole-node rewrites should produce a larger real metric drop per iteration without risky parser changes.","cops":"Style/Dir,Style/SymbolLiteral,Style/FileNull","learning":"The dominant fast-path remains single replacement edits over offense node ranges; visitor-based cops like FileNull can autocorrect by collecting offense ranges then emitting replacements post-traversal.","test_scope":"cargo test --lib -- cop::style::dir && cargo test --lib -- cop::style::symbol_literal && cargo test --lib -- cop::style::file_null","next_action_hint":"Continue mining short Style/Lint cops with one replace/remove operation before tackling Layout indentation-family corrections."}}
{"run":11,"commit":"e658743","metric":359,"metrics":{"nitrocop_autocorrectable_cops":100,"implemented_core_rubocop_autocorrectable":458,"core_overlap_autocorrectable":99,"core_rubocop_autocorrect_total":467},"status":"keep","description":"Enable autocorrect for Style/ColonMethodCall (`::` method call operator -> `.`) and Style/ClassCheck (selector rewrite between `kind_of?`/`is_a?`) with corrected fixture tests.","timestamp":1774889655153,"segment":0,"confidence":4.333333333333333,"iterationTokens":16707,"asi":{"hypothesis":"Selector-level rewrites in method-call cops are high-confidence, low-risk additions that scale quickly.","cops":"Style/ColonMethodCall,Style/ClassCheck","learning":"Using exact selector/operator locations (`call_operator_loc`, `message_loc`) yields stable autocorrects without disturbing arguments/receiver formatting.","test_scope":"cargo test --lib -- cop::style::colon_method_call && cargo test --lib -- cop::style::class_check","next_action_hint":"Keep harvesting selector/operator rewrite cops in Style and simple whole-node rewrite cops in Lint."}}
{"run":12,"commit":"9751349","metric":357,"metrics":{"nitrocop_autocorrectable_cops":102,"implemented_core_rubocop_autocorrectable":458,"core_overlap_autocorrectable":101,"core_rubocop_autocorrect_total":467},"status":"keep","description":"Add autocorrect for Security/JSONLoad (selector rewrite `load`/`restore` -> `parse`) and Lint/RegexpAsCondition (append ` =~ $_` to implicit regexp conditions) with corrected fixture tests.","timestamp":1774889976794,"segment":0,"confidence":5,"iterationTokens":15798,"asi":{"hypothesis":"Simple selector and expression-template rewrites across Security/Lint can continue reducing the parity gap steadily.","cops":"Security/JSONLoad,Lint/RegexpAsCondition","learning":"For selector-focused cops, replacing only `message_loc` gives stable corrections; for match-current-line nodes, full-node replacement template (`<regexp> =~ $_`) matches RuboCop intent.","test_scope":"cargo test --lib -- cop::security::json_load && cargo test --lib -- cop::lint::regexp_as_condition","next_action_hint":"Prioritize remaining Style/Lint cops with either selector swaps or one-shot full-expression templates before moving to structural/layout autocorrects."}}
{"run":13,"commit":"3b6bd72","metric":355,"metrics":{"nitrocop_autocorrectable_cops":104,"implemented_core_rubocop_autocorrectable":458,"core_overlap_autocorrectable":103,"core_rubocop_autocorrect_total":467},"status":"keep","description":"Enable autocorrect for Security/IoMethods (replace `IO` receiver with `File`) and Lint/TopLevelReturnWithArgument (rewrite `return <arg>` to `return`) with corrected fixture coverage.","timestamp":1774890239884,"segment":0,"confidence":4.25,"iterationTokens":8483,"asi":{"hypothesis":"Remaining security/lint gaps with direct receiver or full-node rewrites can be closed quickly without touching detection logic.","cops":"Security/IoMethods,Lint/TopLevelReturnWithArgument","learning":"Receiver-only replacement (`IO` -> `File`) preserves method args cleanly; visitor-based source cops can autocorrect by storing offense ranges and applying deterministic replacements post-traversal.","test_scope":"cargo test --lib -- cop::security::io_methods && cargo test --lib -- cop::lint::top_level_return_with_argument","next_action_hint":"Continue with Style/Lint cops that expose selector/operator locations for minimal-risk edits."}}
{"run":14,"commit":"457615a","metric":353,"metrics":{"nitrocop_autocorrectable_cops":106,"implemented_core_rubocop_autocorrectable":458,"core_overlap_autocorrectable":105,"core_rubocop_autocorrect_total":467},"status":"keep","description":"Add autocorrect for Lint/OrAssignmentToConstant (`||=` -> `=`) and Style/PercentQLiterals (`%Q` <-> `%q` opener rewrite per configured style) with corrected fixture coverage.","timestamp":1774890466378,"segment":0,"confidence":4.222222222222222,"iterationTokens":8554,"asi":{"hypothesis":"Operator-token and percent-literal opener rewrites are low-friction additions that retain source shape while closing parity gaps.","cops":"Lint/OrAssignmentToConstant,Style/PercentQLiterals","learning":"Direct `operator_loc` replacement works for Prism *OrWrite nodes; for percent literals, replacing just the two-byte `%Q/%q` opener is sufficient and robust for current fixture scope.","test_scope":"cargo test --lib -- cop::lint::or_assignment_to_constant && cargo test --lib -- cop::style::percent_q_literals","next_action_hint":"Target more selector/operator rewrite cops and avoid deep AST restructuring until low-hanging fruit is exhausted."}}
{"run":15,"commit":"bf8292a","metric":351,"metrics":{"nitrocop_autocorrectable_cops":108,"implemented_core_rubocop_autocorrectable":458,"core_overlap_autocorrectable":107,"core_rubocop_autocorrect_total":467},"status":"keep","description":"Implement autocorrect for Style/StringMethods (selector rewrite to preferred method, default `intern` -> `to_sym`) and Style/ObjectThen (selector rewrite `yield_self` <-> `then` per enforced style), with corrected fixtures.","timestamp":1774890754948,"segment":0,"confidence":4.2,"iterationTokens":10100,"asi":{"hypothesis":"Config-driven selector replacement cops can be converted rapidly using `message_loc` edits while preserving call structure.","cops":"Style/StringMethods,Style/ObjectThen","learning":"For style cops that only differ by method name preference, replacing selector bytes is enough and avoids complex AST rewrites.","test_scope":"cargo test --lib -- cop::style::string_methods && cargo test --lib -- cop::style::object_then","next_action_hint":"Continue on style cops with message-level replacements (`intern`-like, alias method preference, keyword style toggles)."}}
{"run":16,"commit":"7ca7483","metric":349,"metrics":{"nitrocop_autocorrectable_cops":110,"implemented_core_rubocop_autocorrectable":458,"core_overlap_autocorrectable":109,"core_rubocop_autocorrect_total":467},"status":"keep","description":"Add autocorrect for Lint/ToJSON (insert `(*_args)` on zero-arity `to_json` defs) and Style/BarePercentLiterals (rewrite `%Q` opener to bare `%` / `%` to `%Q` per style) with corrected fixtures.","timestamp":1774891034074,"segment":0,"confidence":4.181818181818182,"iterationTokens":10797,"asi":{"hypothesis":"Method-signature insertion and percent-literal opener rewrites are robust, low-risk transformations for remaining Lint/Style gaps.","cops":"Lint/ToJSON,Style/BarePercentLiterals","learning":"`name_loc` insertion works cleanly for def autocorrect (`to_json`); for percent literals, editing only the opener token preserves delimiters/content and matches fixture expectations.","test_scope":"cargo test --lib -- cop::lint::to_json && cargo test --lib -- cop::style::bare_percent_literals","next_action_hint":"Continue with style cops where corrections are pure selector/opener edits and avoid multiline structural rewrites until necessary."}}
{"run":17,"commit":"c49783a","metric":347,"metrics":{"nitrocop_autocorrectable_cops":112,"implemented_core_rubocop_autocorrectable":458,"core_overlap_autocorrectable":111,"core_rubocop_autocorrect_total":467},"status":"keep","description":"Implement autocorrect for Style/PreferredHashMethods (selector rewrite between short/verbose hash predicates) and Style/ArrayIntersectWithSingleElement (`intersect?([x])` -> `include?(x)`) with corrected fixtures.","timestamp":1774891340585,"segment":0,"confidence":4.166666666666667,"iterationTokens":11803,"asi":{"hypothesis":"Config-aware selector rewrites and small paired edits (selector + argument simplification) remain high-yield targets.","cops":"Style/PreferredHashMethods,Style/ArrayIntersectWithSingleElement","learning":"For `intersect?([elem])`, two non-overlapping edits (method selector and array-arg node) are enough for faithful correction without full-call reconstruction.","test_scope":"cargo test --lib -- cop::style::preferred_hash_methods && cargo test --lib -- cop::style::array_intersect_with_single_element","next_action_hint":"Keep targeting style cops where correction can be expressed as one or two localized range edits."}}
{"run":18,"commit":"b9d9747","metric":345,"metrics":{"nitrocop_autocorrectable_cops":114,"implemented_core_rubocop_autocorrectable":458,"core_overlap_autocorrectable":113,"core_rubocop_autocorrect_total":467},"status":"keep","description":"Add autocorrect for Style/DefWithParentheses (remove empty def parens) and Style/MethodDefParentheses (add/remove method parameter parens per style) with corrected fixture coverage.","timestamp":1774891711951,"segment":0,"confidence":3.857142857142857,"iterationTokens":11581,"asi":{"hypothesis":"Definition-signature cops can be corrected with localized delimiter edits on `def` nodes.","cops":"Style/DefWithParentheses,Style/MethodDefParentheses","learning":"For adding method parens, replacing the whitespace between method name and first param with `(` avoids `def foo (x)` spacing artifacts; delimiter-only edits remain stable.","test_scope":"cargo test --lib -- cop::style::def_with_parentheses && cargo test --lib -- cop::style::method_def_parentheses","next_action_hint":"Continue with syntax-style cops where corrections are insertion/removal of small delimiter tokens around existing source ranges."}}
{"run":19,"commit":"56b7963","metric":343,"metrics":{"nitrocop_autocorrectable_cops":116,"implemented_core_rubocop_autocorrectable":458,"core_overlap_autocorrectable":115,"core_rubocop_autocorrect_total":467},"status":"keep","description":"Enable autocorrect for Style/SingleArgumentDig (`obj.dig(x)` -> `obj[x]`) and Style/RedundantArrayConstructor (`Array.new([...])`/`Array[...]`/`Array([...])` simplification) with corrected fixtures.","timestamp":1774892131353,"segment":0,"confidence":3.625,"iterationTokens":18541,"asi":{"hypothesis":"Whole-call replacement cops with clear canonical output are still strong low-risk opportunities.","cops":"Style/SingleArgumentDig,Style/RedundantArrayConstructor","learning":"For redundant constructor patterns, replacing the full call with source-derived argument forms (`[...]` or literal array arg) is deterministic and fixture-stable.","test_scope":"cargo test --lib -- cop::style::single_argument_dig && cargo test --lib -- cop::style::redundant_array_constructor","next_action_hint":"Proceed with other expression-level simplification cops before entering heavy layout indentation work."}}
{"run":20,"commit":"3af34cc","metric":341,"metrics":{"nitrocop_autocorrectable_cops":118,"implemented_core_rubocop_autocorrectable":458,"core_overlap_autocorrectable":117,"core_rubocop_autocorrect_total":467},"status":"keep","description":"Enable autocorrect for Style/EmptyLambdaParameter (remove empty lambda parens) and Style/EmptyBlockParameter (remove empty block pipes) with corrected fixtures.","timestamp":1774892489068,"segment":0,"confidence":3.6470588235294117,"iterationTokens":9118,"asi":{"hypothesis":"Parameter-delimiter removal cops are low-risk full-range deletions that should safely increase autocorrectable overlap.","cops":"Style/EmptyLambdaParameter,Style/EmptyBlockParameter","learning":"Using BlockParametersNode location with optional preceding-space trim produced stable corrections for both `-> () {}` and `do || ... end`/`{ || ... }` forms.","test_scope":"cargo test --lib -- cop::style::empty_lambda_parameter && cargo test --lib -- cop::style::empty_block_parameter","next_action_hint":"Continue with small Style/Lint cops that are operator/selector replacements before attempting complex Layout alignment cops."}}
