{"run":42,"commit":"6411497","metric":317,"metrics":{"nitrocop_autocorrectable_cops":142,"implemented_core_rubocop_autocorrectable":458,"core_overlap_autocorrectable":141,"core_rubocop_autocorrect_total":467},"status":"keep","description":"Enable autocorrect for Style/BlockComments by rewriting `=begin...=end` blocks into `#` line comments while preserving inner content lines.","timestamp":1774897266658,"segment":0,"confidence":3.9285714285714284,"iterationTokens":4984,"asi":{"hypothesis":"Block comment offenses can be safely autocorrected with whole-block replacement from `=begin` through matching `=end` into commented inner lines.","cops":"Style/BlockComments","learning":"Line-offset based block replacement handled nested `=begin` text and preserved existing heredoc/__END__ skip behavior while producing stable fixture output.","test_scope":"cargo test --lib -- cop::style::block_comments","next_action_hint":"Continue with source-level literal/keyword cops that can be corrected via bounded range replacements before layout-heavy work."}}
{"run":43,"commit":"7fa9155","metric":316,"metrics":{"nitrocop_autocorrectable_cops":143,"implemented_core_rubocop_autocorrectable":458,"core_overlap_autocorrectable":142,"core_rubocop_autocorrect_total":467},"status":"keep","description":"Enable autocorrect for Style/EmptyHeredoc by replacing empty heredoc literals with empty string literals.","timestamp":1774897588138,"segment":0,"confidence":4,"iterationTokens":11876,"asi":{"hypothesis":"Empty heredoc offenses are safely fixable by replacing the full heredoc range (opening through closing delimiter) with `''`.","cops":"Style/EmptyHeredoc","learning":"Using opening_loc start and closing_loc end gave deterministic whole-node replacements; fixture output normalizes adjacent blank lines accordingly.","test_scope":"cargo test --lib -- cop::style::empty_heredoc","next_action_hint":"Keep selecting cops with bounded range replacements and strong fixture determinism; avoid ambiguous parser-warning edits for now."}}
{"run":44,"commit":"2bd79eb","metric":315,"metrics":{"nitrocop_autocorrectable_cops":144,"implemented_core_rubocop_autocorrectable":458,"core_overlap_autocorrectable":143,"core_rubocop_autocorrect_total":467},"status":"keep","description":"Enable autocorrect for Style/RedundantInterpolationUnfreeze by replacing redundant `+@`/`dup` wrappers around interpolated strings with the interpolated string expression itself.","timestamp":1774897836373,"segment":0,"confidence":3.9310344827586206,"iterationTokens":7700,"asi":{"hypothesis":"Redundant unfreeze wrappers on interpolated strings can be safely autocorrected by replacing the full call node with its interpolated-string receiver.","cops":"Style/RedundantInterpolationUnfreeze","learning":"Whole-call replacement using receiver source handled both regular and heredoc interpolation forms in fixtures while respecting Ruby >= 3.0 guardrails.","test_scope":"cargo test --lib -- cop::style::redundant_interpolation_unfreeze","next_action_hint":"Continue with localized string/regexp style rewrites and avoid large structural transforms unless fixture coverage is strengthened."}}
{"run":45,"commit":"8f8ecdc","metric":314,"metrics":{"nitrocop_autocorrectable_cops":145,"implemented_core_rubocop_autocorrectable":458,"core_overlap_autocorrectable":144,"core_rubocop_autocorrect_total":467},"status":"keep","description":"Enable autocorrect for Style/VariableInterpolation by converting `#$var`/`#@ivar`/`#@@cvar` interpolation forms to braced expressions (`#{$var}`, etc.).","timestamp":1774898016883,"segment":0,"confidence":3.8666666666666667,"iterationTokens":4824,"asi":{"hypothesis":"Embedded-variable interpolation offenses are safe to fix with node-local replacement of variable token to `{var}` inside interpolation.","cops":"Style/VariableInterpolation","learning":"Visitor-based source cop can emit deterministic corrections by replacing variable-node ranges with braced forms; this covered globals/ivars/cvars and `$0` cases.","test_scope":"cargo test --lib -- cop::style::variable_interpolation","next_action_hint":"Keep focusing on localized interpolation/selector rewrites and defer complex layout or parser-warning-based transformations."}}
{"run":46,"commit":"3022b28","metric":313,"metrics":{"nitrocop_autocorrectable_cops":146,"implemented_core_rubocop_autocorrectable":458,"core_overlap_autocorrectable":145,"core_rubocop_autocorrect_total":467},"status":"keep","description":"Enable autocorrect for Lint/RescueType by removing invalid rescue exception types from rescue clauses (falling back to bare `rescue` when none remain valid).","timestamp":1774898210108,"segment":0,"confidence":3.933333333333333,"iterationTokens":5334,"asi":{"hypothesis":"Invalid exception types in rescue clauses can be safely corrected by rewriting only the exception-list segment after `rescue`.","cops":"Lint/RescueType","learning":"Visitor-based check_source correction replacing `keyword_loc.end..last_exception.end` handled single-invalid-type fixtures cleanly and keeps valid exception handling behavior for mixed lists.","test_scope":"cargo test --lib -- cop::lint::rescue_type","next_action_hint":"Continue with similarly bounded clause/token rewrites; defer complex layout and ambiguous parser-diagnostic cops."}}
{"run":47,"commit":"ab62fc7","metric":312,"metrics":{"nitrocop_autocorrectable_cops":147,"implemented_core_rubocop_autocorrectable":458,"core_overlap_autocorrectable":146,"core_rubocop_autocorrect_total":467},"status":"keep","description":"Enable autocorrect for Style/PerlBackrefs by replacing Perl-style backrefs and English aliases with `Regexp.last_match` expressions (including namespace-aware `::` prefix).","timestamp":1774898425002,"segment":0,"confidence":4,"iterationTokens":7001,"asi":{"hypothesis":"Perl backreference offenses are safe to autocorrect with node-local replacement to `Regexp.last_match` forms and class/module namespace prefixing.","cops":"Style/PerlBackrefs","learning":"Visitor-based replacement of backref/global/numbered reference node ranges produced stable corrections, including namespace-prefixed replacements inside module scope.","test_scope":"cargo test --lib -- cop::style::perl_backrefs","next_action_hint":"Continue mining Style/Lint cops with direct token-expression substitutions; keep layout and ambiguous-parser rewrites deprioritized."}}
{"run":48,"commit":"47264dc","metric":311,"metrics":{"nitrocop_autocorrectable_cops":148,"implemented_core_rubocop_autocorrectable":458,"core_overlap_autocorrectable":147,"core_rubocop_autocorrect_total":467},"status":"keep","description":"Enable autocorrect for Style/CaseEquality by rewriting common `===` patterns to explicit forms (`include?` for ranges, `is_a?` for constant/self.class receivers).","timestamp":1774898650933,"segment":0,"confidence":4.066666666666666,"iterationTokens":7530,"asi":{"hypothesis":"A bounded subset of `===` offenses can be safely autocorrected with full-expression rewrites to clearer `include?`/`is_a?` calls.","cops":"Style/CaseEquality","learning":"Combining receiver-shape checks (range-like parenthesized receiver, constants, and `self.class`) with whole-call replacement passed fixture autocorrects while leaving unsupported shapes unchanged.","test_scope":"cargo test --lib -- cop::style::case_equality","next_action_hint":"Continue targeting cops with explicit receiver-shape rewrite rules and avoid broad transformations lacking deterministic replacement patterns."}}
{"run":49,"commit":"26b42d2","metric":310,"metrics":{"nitrocop_autocorrectable_cops":149,"implemented_core_rubocop_autocorrectable":458,"core_overlap_autocorrectable":148,"core_rubocop_autocorrect_total":467},"status":"keep","description":"Enable autocorrect for Style/CollectionMethods by rewriting deprecated enumerable selectors (e.g., collect/inject/detect/member?) to configured preferred methods.","timestamp":1774898894348,"segment":0,"confidence":4.133333333333334,"iterationTokens":7845,"asi":{"hypothesis":"Collection method preference offenses can be safely autocorrected as selector-only replacements when existing block/implicit-block guardrails already match RuboCop.","cops":"Style/CollectionMethods","learning":"Replacing only `message_loc` with the configured preferred selector produced stable fixes for explicit blocks, block-pass forms, and symbol-arg implicit blocks.","test_scope":"cargo test --lib -- cop::style::collection_methods","next_action_hint":"Continue pursuing selector-level Style rewrites in remaining non-layout departments; keep layout batch for later."}}
{"run":50,"commit":"8e54958","metric":309,"metrics":{"nitrocop_autocorrectable_cops":150,"implemented_core_rubocop_autocorrectable":458,"core_overlap_autocorrectable":149,"core_rubocop_autocorrect_total":467},"status":"keep","description":"Enable autocorrect for Style/RedundantStringEscape by removing only redundant escape backslashes inside double-quoted string/interpolated-string segments.","timestamp":1774899201299,"segment":0,"confidence":4.064516129032258,"iterationTokens":7845,"asi":{"hypothesis":"Redundant string escapes can be corrected safely by deleting just the backslash character at each flagged escape location while preserving string content.","cops":"Style/RedundantStringEscape","learning":"Existing scanner already isolates redundant escapes with interpolation guards (`\\#{`, `\\#$`, `\\#@`); adding one-char removals yielded stable fixture autocorrect output.","test_scope":"cargo test --lib -- cop::style::redundant_string_escape","next_action_hint":"Apply the same one-char escape-removal strategy to regexp escapes where redundancy logic is already in place."}}
{"run":51,"commit":"8bb2685","metric":308,"metrics":{"nitrocop_autocorrectable_cops":151,"implemented_core_rubocop_autocorrectable":458,"core_overlap_autocorrectable":150,"core_rubocop_autocorrect_total":467},"status":"keep","description":"Enable autocorrect for Style/RedundantRegexpEscape by removing redundant regexp escape backslashes while preserving meaningful escapes (char-class context and delimiter cases).","timestamp":1774899336900,"segment":0,"confidence":4,"iterationTokens":3070,"asi":{"hypothesis":"Redundant regexp escapes can be safely autocorrected via one-character backslash deletion at already-detected offense positions.","cops":"Style/RedundantRegexpEscape","learning":"Existing escape classifier already handled char-class and %r delimiter exceptions; adding targeted backslash removals produced stable corrected fixtures.","test_scope":"cargo test --lib -- cop::style::redundant_regexp_escape","next_action_hint":"Look for additional selector/token-only Style/Lint autocorrections before tackling high-risk Layout transformations."}}
{"run":52,"commit":"f8c0494","metric":307,"metrics":{"nitrocop_autocorrectable_cops":152,"implemented_core_rubocop_autocorrectable":458,"core_overlap_autocorrectable":151,"core_rubocop_autocorrect_total":467},"status":"keep","description":"Enable autocorrect for Style/ArrayIntersect by rewriting supported intersection checks (`(a & b).any?/empty?/none?` and `a.intersection(b).any?/empty?/none?`) to `intersect?` equivalents.","timestamp":1774899522575,"segment":0,"confidence":4.0625,"iterationTokens":8588,"asi":{"hypothesis":"Current Style/ArrayIntersect offense shapes can be safely corrected with whole-expression replacement to `intersect?`/negated `intersect?` forms.","cops":"Style/ArrayIntersect","learning":"Deriving replacements from parsed receiver/argument nodes enabled deterministic rewrites for the already-detected pattern subset without broadening detection logic.","test_scope":"cargo test --lib -- cop::style::array_intersect","next_action_hint":"Continue with low-branching Style/Lint cops that already identify narrow AST shapes suitable for direct replacement."}}
{"run":53,"commit":"97f66bb","metric":306,"metrics":{"nitrocop_autocorrectable_cops":153,"implemented_core_rubocop_autocorrectable":458,"core_overlap_autocorrectable":152,"core_rubocop_autocorrect_total":467},"status":"keep","description":"Enable autocorrect for Style/CollectionQuerying by rewriting `count`-predicate/comparison patterns to enumerable predicates (`any?`, `none?`, `one?`, `many?`) while preserving block forms.","timestamp":1774899736949,"segment":0,"confidence":4.125,"iterationTokens":19510,"asi":{"hypothesis":"Existing CollectionQuerying matches can be autocorrected safely by replacing the `count` selector and removing the trailing predicate/comparison segment.","cops":"Style/CollectionQuerying","learning":"Two-range correction (selector replacement + tail removal from count-call end to outer-call end) produced stable rewrites for supported forms and kept safe-nav exclusions intact.","test_scope":"cargo test --lib -- cop::style::collection_querying","next_action_hint":"Continue targeting expression-local rewrites in Style before entering Layout-heavy transformations."}}
{"run":54,"commit":"4dde276","metric":305,"metrics":{"nitrocop_autocorrectable_cops":154,"implemented_core_rubocop_autocorrectable":458,"core_overlap_autocorrectable":153,"core_rubocop_autocorrect_total":467},"status":"keep","description":"Enable autocorrect for Style/CollectionCompact by rewriting supported `reject/select/filter` nil-pruning forms to `compact`/`compact!` with block-range replacement.","timestamp":1774900084677,"segment":0,"confidence":4.1875,"iterationTokens":14205,"asi":{"hypothesis":"CollectionCompact offenses can be corrected safely by replacing from method selector through block/block-pass segment with `compact`/`compact!`.","cops":"Style/CollectionCompact","learning":"Using block-aware correction end offsets (block node end for `{...}` forms; call end for block-pass forms) avoided dangling-token artifacts and matched fixture expectations.","test_scope":"cargo test --lib -- cop::style::collection_compact","next_action_hint":"Continue with similarly scoped selector+tail rewrites and avoid broad layout/formatting cops until easy Style/Lint wins diminish."}}
{"run":55,"commit":"f35f411","metric":304,"metrics":{"nitrocop_autocorrectable_cops":155,"implemented_core_rubocop_autocorrectable":458,"core_overlap_autocorrectable":154,"core_rubocop_autocorrect_total":467},"status":"keep","description":"Enable autocorrect for Style/FileRead by rewriting `File.open(...).read`, `File.open(..., &:read)`, and simple read block forms to `File.read(...)`/`File.binread(...)`.","timestamp":1774900369354,"segment":0,"confidence":4.25,"iterationTokens":14359,"asi":{"hypothesis":"Current FileRead detection spans are sufficient for whole-expression replacement to File convenience readers without broadening pattern scope.","cops":"Style/FileRead","learning":"Returning explicit replacement text from existing pattern analyzers (including mode-aware `binread`) allowed deterministic full-span rewrites across chain, block-pass, and simple block forms.","test_scope":"cargo test --lib -- cop::style::file_read","next_action_hint":"Keep mining mode/selector-local Style cops (e.g., HashEachMethods limited selector swaps) before high-risk layout/autofix work."}}
{"run":56,"commit":"4ccbb64","metric":303,"metrics":{"nitrocop_autocorrectable_cops":156,"implemented_core_rubocop_autocorrectable":458,"core_overlap_autocorrectable":155,"core_rubocop_autocorrect_total":467},"status":"keep","description":"Enable autocorrect for Style/HashEachMethods by rewriting `keys.each`/`values.each` chains and unused-key/value `each` block forms to `each_key`/`each_value` with block-arg cleanup.","timestamp":1774900652050,"segment":0,"confidence":4.181818181818182,"iterationTokens":10609,"asi":{"hypothesis":"HashEachMethods offense shapes can be corrected with localized selector rewrites plus targeted block-parameter segment removal for unused arg cases.","cops":"Style/HashEachMethods","learning":"Dual correction strategy (keys/values chain span rewrite and each-block selector+arg-range edits) matched fixture expectations and kept existing safety guards unchanged.","test_scope":"cargo test --lib -- cop::style::hash_each_methods","next_action_hint":"Continue with similarly constrained style cops (e.g., FileWrite/HashConversion subset) before considering complex layout/autofix work."}}
{"run":57,"commit":"7b37686","metric":302,"metrics":{"nitrocop_autocorrectable_cops":157,"implemented_core_rubocop_autocorrectable":458,"core_overlap_autocorrectable":156,"core_rubocop_autocorrect_total":467},"status":"keep","description":"Enable autocorrect for Style/FileWrite by rewriting supported `File.open(...).write(...)` and simple block-write forms to `File.write(...)`/`File.binwrite(...)`.","timestamp":1774900913711,"segment":0,"confidence":4.117647058823529,"iterationTokens":12309,"asi":{"hypothesis":"FileWrite offense spans can be safely replaced with convenience class methods when open-mode and write-argument shape checks already pass.","cops":"Style/FileWrite","learning":"Mode-aware whole-span replacement using extracted filename/content sources worked for chain and block forms while respecting existing strict mode/arg guards.","test_scope":"cargo test --lib -- cop::style::file_write","next_action_hint":"Next promising path is guarded HashConversion autocorrect (to_h/literal forms) or conservative Lint candidate exploration before layout-heavy work."}}
{"run":58,"commit":"da182e9","metric":301,"metrics":{"nitrocop_autocorrectable_cops":158,"implemented_core_rubocop_autocorrectable":458,"core_overlap_autocorrectable":157,"core_rubocop_autocorrect_total":467},"status":"keep","description":"Enable autocorrect for Style/HashConversion by rewriting supported `Hash[...]` forms to `.to_h` or literal hash expressions while preserving nested-Hash suppression behavior.","timestamp":1774901205386,"segment":0,"confidence":4.176470588235294,"iterationTokens":11228,"asi":{"hypothesis":"HashConversion offenses can be corrected from existing argument-shape checks with full-expression replacements (`to_h` / `{...}`) without expanding detection scope.","cops":"Style/HashConversion","learning":"Visitor-level correction generation worked for single-arg, keyword-hash, empty, and even-arity multi-arg forms; odd-arity and splat-allowed cases remain offense-only/ignored as intended.","test_scope":"cargo test --lib -- cop::style::hash_conversion","next_action_hint":"Continue with conservative Style/Lint replacements (potentially ArrayFirstLast plain-read subset) and defer layout/autofmt-heavy cops."}}
{"run":59,"commit":"6e5c89d","metric":300,"metrics":{"nitrocop_autocorrectable_cops":159,"implemented_core_rubocop_autocorrectable":458,"core_overlap_autocorrectable":158,"core_rubocop_autocorrect_total":467},"status":"keep","description":"Enable autocorrect for Style/FileTouch by replacing `File.open(..., 'a') {}` empty-block append-touch forms with `FileUtils.touch(...)`.","timestamp":1774901368002,"segment":0,"confidence":4.235294117647059,"iterationTokens":4897,"asi":{"hypothesis":"FileTouch offenses are safe whole-expression rewrites because the cop already constrains to empty append-mode blocks.","cops":"Style/FileTouch","learning":"Using call-start to block-end replacement preserves argument expressions and yields deterministic touch rewrites on existing offense shapes.","test_scope":"cargo test --lib -- cop::style::file_touch","next_action_hint":"Next low-risk path remains targeted Style rewrites; keep Lint/AmbiguousRegexpLiteral conservative and postpone layout-heavy fixes."}}
{"run":60,"commit":"4af213c","metric":299,"metrics":{"nitrocop_autocorrectable_cops":160,"implemented_core_rubocop_autocorrectable":458,"core_overlap_autocorrectable":159,"core_rubocop_autocorrect_total":467},"status":"keep","description":"Enable autocorrect for Style/FileEmpty by rewriting supported `zero?/size==0/read==''/read.empty?` file-emptiness checks to `File.empty?`/`FileTest.empty?` calls.","timestamp":1774901610016,"segment":0,"confidence":4.294117647058823,"iterationTokens":10610,"asi":{"hypothesis":"Existing FileEmpty offense patterns can be corrected via full-expression replacement to class `.empty?(arg)` calls without widening detection scope.","cops":"Style/FileEmpty","learning":"Centralized offense reporter with replacement generation made all currently detected patterns autocorrectable while preserving receiver class (`File` vs `FileTest`).","test_scope":"cargo test --lib -- cop::style::file_empty","next_action_hint":"Continue with conservative Style cop rewrites and keep parser-ambiguity/layout cops deferred unless a tightly bounded transform is proven."}}
{"run":61,"commit":"3d5870c","metric":298,"metrics":{"nitrocop_autocorrectable_cops":161,"implemented_core_rubocop_autocorrectable":458,"core_overlap_autocorrectable":160,"core_rubocop_autocorrect_total":467},"status":"keep","description":"Enable autocorrect for Style/GlobalStdStream by replacing STDIN/STDOUT/STDERR constant references with corresponding `$stdin/$stdout/$stderr` globals in flagged contexts.","timestamp":1774901775410,"segment":0,"confidence":4.352941176470588,"iterationTokens":7246,"asi":{"hypothesis":"GlobalStdStream offenses are direct token replacements, so correction can be safely applied at the constant location once assignment-context guards pass.","cops":"Style/GlobalStdStream","learning":"Visitor-level replacement at constant locations preserved existing write-target and assignment-context exclusions while making all offense fixtures autocorrect cleanly.","test_scope":"cargo test --lib -- cop::style::global_std_stream","next_action_hint":"Continue harvesting direct token/selector Style fixes; postpone Layout and ambiguity-sensitive Lint rewrites."}}
