{"run":21,"commit":"6606a0c","metric":338,"metrics":{"nitrocop_autocorrectable_cops":121,"implemented_core_rubocop_autocorrectable":458,"core_overlap_autocorrectable":120,"core_rubocop_autocorrect_total":467},"status":"keep","description":"Add autocorrect for Style/SuperWithArgsParentheses (insert missing parens), Lint/EmptyEnsure (remove empty ensure keyword), and Style/HashLookupMethod (fetch<->[] rewrites) with corrected fixtures.","timestamp":1774892991739,"segment":0,"confidence":3.7777777777777777,"iterationTokens":30423,"asi":{"hypothesis":"Simple token/range edits on existing parsers can safely unlock another small batch of RuboCop-core autocorrectable cops without changing detection scope.","cops":"Style/SuperWithArgsParentheses,Lint/EmptyEnsure,Style/HashLookupMethod","learning":"Super paren insertion works reliably by replacing keyword->first-arg gap with '(' and inserting ')' after last arg/block pass; empty ensure aligns with RuboCop by removing only `ensure` keyword; hash lookup conversion is stable via full-call replacement.","test_scope":"cargo test --lib -- cop::style::super_with_args_parentheses && cargo test --lib -- cop::lint::empty_ensure && cargo test --lib -- cop::style::hash_lookup_method","next_action_hint":"Continue targeting low-branching Style/Lint cops around symbol/string/operator rewrites before moving into high-risk Layout alignment autocorrects."}}
{"run":22,"commit":"6b69708","metric":337,"metrics":{"nitrocop_autocorrectable_cops":122,"implemented_core_rubocop_autocorrectable":458,"core_overlap_autocorrectable":121,"core_rubocop_autocorrect_total":467},"status":"keep","description":"Enable autocorrect for Lint/BooleanSymbol, including standalone `:true`/`:false` and keyword-hash `true:`/`false:` conversion to rocket form.","timestamp":1774893211958,"segment":0,"confidence":3.6842105263157894,"iterationTokens":8908,"asi":{"hypothesis":"Boolean-symbol replacements are deterministic and safe to implement as direct key/symbol range rewrites.","cops":"Lint/BooleanSymbol","learning":"Using two correction modes matches RuboCop semantics: standalone symbols become boolean literals, while keyword hash labels become `:true =>` / `:false =>` to preserve symbol-key behavior.","test_scope":"cargo test --lib -- cop::lint::boolean_symbol","next_action_hint":"Continue with low-risk style cops requiring quote/operator swaps (e.g., QuotedSymbols or RedundantPercentQ with strict guardrails)."}}
{"run":23,"commit":"37dd61b","metric":336,"metrics":{"nitrocop_autocorrectable_cops":123,"implemented_core_rubocop_autocorrectable":458,"core_overlap_autocorrectable":122,"core_rubocop_autocorrect_total":467},"status":"keep","description":"Enable autocorrect for Style/RedundantPercentQ by replacing redundant `%q/%Q` string literals with quoted string literals under strict safety guards.","timestamp":1774893380971,"segment":0,"confidence":3.6,"iterationTokens":4646,"asi":{"hypothesis":"Redundant percent-literal offenses can be autocorrected safely when interpolation/escape-sensitive content is excluded.","cops":"Style/RedundantPercentQ","learning":"Whole-node replacement to `'...'` or `\"...\"` works for current offense patterns; keeping backslash/interpolation guards avoids semantic drift.","test_scope":"cargo test --lib -- cop::style::redundant_percent_q","next_action_hint":"Pursue another low-complexity Style cop (likely quote/operator rewrite) while maintaining strict correction guards to avoid overfitting."}}
{"run":24,"commit":"273e51c","metric":335,"metrics":{"nitrocop_autocorrectable_cops":124,"implemented_core_rubocop_autocorrectable":458,"core_overlap_autocorrectable":123,"core_rubocop_autocorrect_total":467},"status":"keep","description":"Add autocorrect for Style/QuotedSymbols by normalizing quoted symbol delimiters for standalone symbols and hash-key symbols when conversion is safe.","timestamp":1774893546798,"segment":0,"confidence":3.3636363636363638,"iterationTokens":4809,"asi":{"hypothesis":"Quoted symbol offenses can be fixed via direct delimiter swaps while preserving content and key-vs-standalone form.","cops":"Style/QuotedSymbols","learning":"Replacing full symbol ranges with reconstructed quoted forms (`:'x'`, `'x':`, and double-quoted inverses) passes fixtures when interpolation/escape guards remain strict.","test_scope":"cargo test --lib -- cop::style::quoted_symbols","next_action_hint":"Continue with similarly localized literal/operator cops; postpone layout-indent transformations until simple style/lint options are exhausted."}}
{"run":25,"commit":"828ca28","metric":334,"metrics":{"nitrocop_autocorrectable_cops":125,"implemented_core_rubocop_autocorrectable":458,"core_overlap_autocorrectable":124,"core_rubocop_autocorrect_total":467},"status":"keep","description":"Enable autocorrect for Lint/UriRegexp by rewriting `URI.regexp` calls to `URI::DEFAULT_PARSER.make_regexp` (including qualified `::URI`).","timestamp":1774893787319,"segment":0,"confidence":3.1666666666666665,"iterationTokens":10168,"asi":{"hypothesis":"`URI.regexp` replacements are straightforward full-call rewrites and should be low-risk parity wins.","cops":"Lint/UriRegexp","learning":"Receiver-preserving full replacement (`URI` or `::URI`) with optional first argument preserved matches existing fixture expectations.","test_scope":"cargo test --lib -- cop::lint::uri_regexp","next_action_hint":"Continue with low-branching lint/style literal/operator rewrites; avoid structural transformation cops until easy wins flatten out."}}
{"run":26,"commit":"3369c2a","metric":333,"metrics":{"nitrocop_autocorrectable_cops":126,"implemented_core_rubocop_autocorrectable":458,"core_overlap_autocorrectable":125,"core_rubocop_autocorrect_total":467},"status":"keep","description":"Enable autocorrect for Style/ConcatArrayLiterals by rewriting `receiver.concat([..], [..])` to `receiver.push(..)` with flattened array elements.","timestamp":1774893980663,"segment":0,"confidence":3.12,"iterationTokens":9031,"asi":{"hypothesis":"`concat` calls whose arguments are all array literals can be safely canonicalized to `push` with element arguments.","cops":"Style/ConcatArrayLiterals","learning":"Full-call replacement with flattened array element sources produced stable fixture-correct output for single and multiple array arguments.","test_scope":"cargo test --lib -- cop::style::concat_array_literals","next_action_hint":"Target additional simple literal/argument-shape cops in Style/Lint before starting Layout alignment corrections."}}
{"run":27,"commit":"3f5c3ba","metric":332,"metrics":{"nitrocop_autocorrectable_cops":127,"implemented_core_rubocop_autocorrectable":458,"core_overlap_autocorrectable":126,"core_rubocop_autocorrect_total":467},"status":"keep","description":"Enable autocorrect for Style/MinMax by replacing `[receiver.min, receiver.max]` array literals with `receiver.minmax`.","timestamp":1774894158342,"segment":0,"confidence":3.076923076923077,"iterationTokens":5425,"asi":{"hypothesis":"Min/max pair arrays are canonicalizable via a direct whole-range replacement to `.minmax`.","cops":"Style/MinMax","learning":"Replacing the full offending array node with `{receiver}.minmax` is stable for current fixture patterns and keeps diagnostics unchanged.","test_scope":"cargo test --lib -- cop::style::min_max","next_action_hint":"Continue harvesting low-risk style/lint canonicalization cops; keep layout cops deferred until simple wins are exhausted."}}
{"run":28,"commit":"590c947","metric":331,"metrics":{"nitrocop_autocorrectable_cops":128,"implemented_core_rubocop_autocorrectable":458,"core_overlap_autocorrectable":127,"core_rubocop_autocorrect_total":467},"status":"keep","description":"Enable autocorrect for Lint/PercentSymbolArray by removing unnecessary leading `:` and trailing `,` inside `%i/%I` elements.","timestamp":1774894377426,"segment":0,"confidence":2.9285714285714284,"iterationTokens":5819,"asi":{"hypothesis":"Element-local deletions on `%i/%I` literals should safely match RuboCop behavior for colon/comma cleanup.","cops":"Lint/PercentSymbolArray","learning":"Applying per-element leading/trailing token removals yields expected normalization; corrected fixture needed `%i[name role status]` (not colon-prefixed elements) for `%i[]` form.","test_scope":"cargo test --lib -- cop::lint::percent_symbol_array","next_action_hint":"Continue with conservative Lint canonicalization cops; avoid ambiguous-expression rewrites unless correction boundaries are unambiguous."}}
{"run":29,"commit":"d943cc7","metric":330,"metrics":{"nitrocop_autocorrectable_cops":129,"implemented_core_rubocop_autocorrectable":458,"core_overlap_autocorrectable":128,"core_rubocop_autocorrect_total":467},"status":"keep","description":"Enable autocorrect for Style/RedundantDoubleSplatHashBraces by replacing `**{...}` keyword-hash splats with direct keyword arguments.","timestamp":1774894546744,"segment":0,"confidence":3,"iterationTokens":6045,"asi":{"hypothesis":"For non-empty symbol-key hash literals inside keyword splats, removing `**{}` wrapper is a safe canonicalization.","cops":"Style/RedundantDoubleSplatHashBraces","learning":"Using first/last hash element ranges to rebuild replacement preserves argument ordering and commas while avoiding hash-rocket and empty-hash edge cases.","test_scope":"cargo test --lib -- cop::style::redundant_double_splat_hash_braces","next_action_hint":"Keep targeting simple keyword/argument literal cops before moving to high-complexity layout or parser-warning-driven rewrites."}}
{"run":30,"commit":"82c1c25","metric":329,"metrics":{"nitrocop_autocorrectable_cops":130,"implemented_core_rubocop_autocorrectable":458,"core_overlap_autocorrectable":129,"core_rubocop_autocorrect_total":467},"status":"keep","description":"Enable autocorrect for Style/RedundantEach by removing chained redundant `.each` before `each`/`each_with_index`/`each_with_object` calls.","timestamp":1774894753162,"segment":0,"confidence":2.9655172413793105,"iterationTokens":7211,"asi":{"hypothesis":"Redundant chained enumerator `.each` calls can be corrected by removing the inner `.each` selector/operator span only.","cops":"Style/RedundantEach","learning":"Deleting the inner call-operator + selector range preserved surrounding chain behavior and matched fixture expectations for `each`, `each_with_index`, and `each_with_object`.","test_scope":"cargo test --lib -- cop::style::redundant_each","next_action_hint":"Keep harvesting small chain/literal canonicalization cops; defer high-risk layout alignment autocorrect work."}}
{"run":31,"commit":"ea87ebe","metric":328,"metrics":{"nitrocop_autocorrectable_cops":131,"implemented_core_rubocop_autocorrectable":458,"core_overlap_autocorrectable":130,"core_rubocop_autocorrect_total":467},"status":"keep","description":"Enable autocorrect for Style/UnpackFirst by converting `.unpack(...).first`/`[0]`/`at(0)`/`slice(0)` into `.unpack1(...)` and removing first-element access.","timestamp":1774894972253,"segment":0,"confidence":2.933333333333333,"iterationTokens":7211,"asi":{"hypothesis":"Unpack-first chains can be safely corrected via selector swap (`unpack`->`unpack1`) plus tail-range removal.","cops":"Style/UnpackFirst","learning":"Two precise edits (selector replacement + remove range from unpack-call end to outer-call end) handled both single-line and multiline chain fixtures.","test_scope":"cargo test --lib -- cop::style::unpack_first","next_action_hint":"Continue with similarly localized chain canonicalizations; keep ambiguous parser-warning cops gated behind stricter safety checks."}}
{"run":32,"commit":"460d04f","metric":327,"metrics":{"nitrocop_autocorrectable_cops":132,"implemented_core_rubocop_autocorrectable":458,"core_overlap_autocorrectable":131,"core_rubocop_autocorrect_total":467},"status":"keep","description":"Enable autocorrect for Style/LambdaCall by rewriting implicit `lambda.(...)` calls to explicit `lambda.call(...)` in default call style.","timestamp":1774895161262,"segment":0,"confidence":3.103448275862069,"iterationTokens":6351,"asi":{"hypothesis":"Lambda call-style offenses are safe full-call rewrites when receiver/operator/argument text is preserved.","cops":"Style/LambdaCall","learning":"Reconstructing full call text from receiver + operator + args allows deterministic conversion from implicit call syntax to explicit `call` without touching detection logic.","test_scope":"cargo test --lib -- cop::style::lambda_call","next_action_hint":"Continue with style chain canonicalization cops that can be fixed via selector/range rewrites; keep ambiguous parser-warning cops conservative."}}
{"run":33,"commit":"296e824","metric":326,"metrics":{"nitrocop_autocorrectable_cops":133,"implemented_core_rubocop_autocorrectable":458,"core_overlap_autocorrectable":132,"core_rubocop_autocorrect_total":467},"status":"keep","description":"Enable autocorrect for Style/RedundantArrayFlatten by removing redundant `.flatten` (and optional depth arg) before `.join`/`.join(nil)`.","timestamp":1774895325289,"segment":0,"confidence":3.2857142857142856,"iterationTokens":5237,"asi":{"hypothesis":"Redundant flatten-before-join patterns are safe to autocorrect via direct removal of the `.flatten(...)` span.","cops":"Style/RedundantArrayFlatten","learning":"Deleting from flatten call-operator start through flatten call end correctly normalized `x.flatten.join`, `x.flatten.join(nil)`, and `x.flatten(1).join` fixture cases.","test_scope":"cargo test --lib -- cop::style::redundant_array_flatten","next_action_hint":"Continue with one-range chain simplification cops (e.g., map/set or collection canonicalizations) before layout-focused work."}}
{"run":34,"commit":"bd3f1a4","metric":325,"metrics":{"nitrocop_autocorrectable_cops":134,"implemented_core_rubocop_autocorrectable":458,"core_overlap_autocorrectable":133,"core_rubocop_autocorrect_total":467},"status":"keep","description":"Enable autocorrect for Style/MapToSet by rewriting `map/collect { ... }.to_set` to `to_set { ... }` and removing trailing `.to_set`.","timestamp":1774895515933,"segment":0,"confidence":3.2413793103448274,"iterationTokens":6042,"asi":{"hypothesis":"Map-to-set chains can be corrected with two localized edits: selector swap on inner call and removal of outer `.to_set`.","cops":"Style/MapToSet","learning":"Using a paired correction (inner method name -> `to_set`, then deleting outer call operator+selector) preserves both block and symbol block-pass forms.","test_scope":"cargo test --lib -- cop::style::map_to_set","next_action_hint":"Continue with collection canonicalization cops that can be expressed as selector/range edits before entering layout-heavy territory."}}
{"run":35,"commit":"8eef32a","metric":324,"metrics":{"nitrocop_autocorrectable_cops":135,"implemented_core_rubocop_autocorrectable":458,"core_overlap_autocorrectable":134,"core_rubocop_autocorrect_total":467},"status":"keep","description":"Enable autocorrect for Style/InPatternThen by replacing semicolon separator in single-line `in pattern; body` clauses with ` then`.","timestamp":1774895758398,"segment":0,"confidence":3.4285714285714284,"iterationTokens":16551,"asi":{"hypothesis":"In-pattern semicolon offenses can be fixed with a one-character range replacement (`;` -> ` then`) under existing multiline/then guards.","cops":"Style/InPatternThen","learning":"Using detected semicolon byte offset for targeted replacement produced stable autocorrect across literal, tuple, and match-alt pattern fixtures.","test_scope":"cargo test --lib -- cop::style::in_pattern_then","next_action_hint":"Continue with localized token/selector rewrites in Style; defer structural multiline/layout transformations."}}
{"run":36,"commit":"e7ca159","metric":323,"metrics":{"nitrocop_autocorrectable_cops":136,"implemented_core_rubocop_autocorrectable":458,"core_overlap_autocorrectable":135,"core_rubocop_autocorrect_total":467},"status":"keep","description":"Enable autocorrect for Style/RedundantConstantBase by removing leading top-level `::` from constant paths where the cop already reports redundancy.","timestamp":1774895993728,"segment":0,"confidence":3.3793103448275863,"iterationTokens":6818,"asi":{"hypothesis":"Top-level redundant constant-base offenses are safe to fix by deleting the initial `::` token.","cops":"Style/RedundantConstantBase","learning":"Visitor-based check_source can emit deterministic corrections by removing first two bytes of offending constant path when source starts with `::`.","test_scope":"cargo test --lib -- cop::style::redundant_constant_base","next_action_hint":"Continue with similarly local token rewrites in remaining Style/Lint cops; postpone layout and no-op Ruby-version cops."}}
{"run":37,"commit":"0b2b0ea","metric":322,"metrics":{"nitrocop_autocorrectable_cops":137,"implemented_core_rubocop_autocorrectable":458,"core_overlap_autocorrectable":136,"core_rubocop_autocorrect_total":467},"status":"keep","description":"Enable autocorrect for Style/RedundantRegexpConstructor by replacing `Regexp.new(/.../)` and `Regexp.compile(/.../)` with direct regexp literals.","timestamp":1774896249768,"segment":0,"confidence":3.5714285714285716,"iterationTokens":3006,"asi":{"hypothesis":"Constructor-to-literal regexp rewrites are safe when exactly one regexp-literal argument is present.","cops":"Style/RedundantRegexpConstructor","learning":"Whole-call replacement with the original regexp argument source produced correct output for plain and optioned literals (e.g., `/baz/i`) while preserving guarded exclusions (extra args).","test_scope":"cargo test --lib -- cop::style::redundant_regexp_constructor","next_action_hint":"Keep targeting Style canonicalization cops with whole-expression or token-level rewrites; defer risky multiline/layout transforms."}}
{"run":38,"commit":"572a0f9","metric":321,"metrics":{"nitrocop_autocorrectable_cops":138,"implemented_core_rubocop_autocorrectable":458,"core_overlap_autocorrectable":137,"core_rubocop_autocorrect_total":467},"status":"keep","description":"Enable autocorrect for Style/CommandLiteral by converting `%x(...)` command literals to backtick form when inner-backtick-safe.","timestamp":1774896477690,"segment":0,"confidence":3.5172413793103448,"iterationTokens":12729,"asi":{"hypothesis":"Delimiter-only rewrites on command literals are safe for default backticks style when inner content has no backticks.","cops":"Style/CommandLiteral","learning":"Replacing opening and closing delimiter ranges (`%x`-form -> backticks) yielded stable corrections for current offense fixtures while preserving conservative inner-backtick guards.","test_scope":"cargo test --lib -- cop::style::command_literal","next_action_hint":"Continue with token/selector-style cops that avoid multiline structural rewrites; keep ambiguous expression transformations conservative."}}
{"run":39,"commit":"1922334","metric":320,"metrics":{"nitrocop_autocorrectable_cops":139,"implemented_core_rubocop_autocorrectable":458,"core_overlap_autocorrectable":138,"core_rubocop_autocorrect_total":467},"status":"keep","description":"Enable autocorrect for Style/DoubleCopDisableDirective by merging multiple same-line `rubocop:disable`/`rubocop:todo` directives into a single comma-separated directive.","timestamp":1774896656342,"segment":0,"confidence":3.7142857142857144,"iterationTokens":5487,"asi":{"hypothesis":"Line-local disable-directive cleanup is safe as a pure comment-text rewrite starting at the first directive token.","cops":"Style/DoubleCopDisableDirective","learning":"Replacing the comment segment from first directive to line end with merged comma-separated directives matched fixtures for both disable and todo forms.","test_scope":"cargo test --lib -- cop::style::double_cop_disable_directive","next_action_hint":"Keep prioritizing style cops with deterministic token-level rewrites; avoid uncertain parser-warning autocorrections unless bounded."}}
{"run":40,"commit":"3897c8b","metric":319,"metrics":{"nitrocop_autocorrectable_cops":140,"implemented_core_rubocop_autocorrectable":458,"core_overlap_autocorrectable":139,"core_rubocop_autocorrect_total":467},"status":"keep","description":"Enable autocorrect for Lint/TrailingCommaInAttributeDeclaration by removing the trailing comma token in attr_* declarations that swallow following method defs.","timestamp":1774896840553,"segment":0,"confidence":3.7857142857142856,"iterationTokens":5906,"asi":{"hypothesis":"Trailing-comma attr declaration offenses can be corrected with a single-token removal at the detected comma offset.","cops":"Lint/TrailingCommaInAttributeDeclaration","learning":"Using the scanned comma position after the last real attr arg produced precise comma-only removals and preserved surrounding formatting/body lines.","test_scope":"cargo test --lib -- cop::lint::trailing_comma_in_attribute_declaration","next_action_hint":"Continue with similarly local Style/Lint rewrites; avoid broad structural rewrites unless fixture coverage is expanded first."}}
{"run":41,"commit":"1a41b11","metric":318,"metrics":{"nitrocop_autocorrectable_cops":141,"implemented_core_rubocop_autocorrectable":458,"core_overlap_autocorrectable":140,"core_rubocop_autocorrect_total":467},"status":"keep","description":"Enable autocorrect for Style/WhileUntilDo by deleting the `do` segment between multiline loop conditions and loop bodies.","timestamp":1774897060200,"segment":0,"confidence":3.857142857142857,"iterationTokens":9174,"asi":{"hypothesis":"Multiline `while/until ... do` offenses can be corrected by removing the range from condition end to `do` keyword end.","cops":"Style/WhileUntilDo","learning":"Using predicate end + `do_keyword_loc` produced stable corrections across wrapped predicates, inline comments, and one-line body forms while preserving guardrails.","test_scope":"cargo test --lib -- cop::style::while_until_do","next_action_hint":"Continue with similar keyword-token removal cops before attempting larger structural rewrites."}}
