{"run":200,"commit":"4fc5e8d","metric":153,"metrics":{"nitrocop_autocorrectable_cops":306,"implemented_core_rubocop_autocorrectable":458,"core_overlap_autocorrectable":305,"core_rubocop_autocorrect_total":467},"status":"keep","description":"Enable conservative autocorrect for Style/IfWithSemicolon by replacing offense semicolon then-separators with newline/deletion based on line context; add corrected fixture and autocorrect tests.","timestamp":1774994958845,"segment":0,"confidence":4.515463917525773,"iterationTokens":10591,"asi":{"hypothesis":"Style/IfWithSemicolon in the selector/operator rewrite lane should reduce missing core autocorrect cops by 1 using a bounded semicolon-token rewrite on already-flagged offenses.","cop":"Style/IfWithSemicolon","focus_area":"Style cops with selector/operator rewrites","test_scope":"cargo test --lib -- cop::style::if_with_semicolon","learning":"Autocorrect can stay conservative by editing only the semicolon token: replace with newline for single-line `if/unless ...; ...` and delete when already followed by newline; this keeps nested-suppression and detection behavior unchanged.","safety":"Corrections are emitted only for existing semicolon offenses; no changes to parent-if suppression, ignored-node behavior, or comment-aware semicolon detection.","next_action_hint":"Continue Style selector/operator lane with another bounded token rewrite candidate still in missing set (e.g., Style/LineEndConcatenation or Style/KeywordArgumentsMerging if correction can be localized)."}}
{"run":201,"commit":"8dd42cd","metric":152,"metrics":{"nitrocop_autocorrectable_cops":307,"implemented_core_rubocop_autocorrectable":458,"core_overlap_autocorrectable":306,"core_rubocop_autocorrect_total":467},"status":"keep","description":"Enable autocorrect for Style/LineEndConcatenation by rewriting offense-matched `+`/`<<` line-end operators to `\\`; add corrected fixture and autocorrect tests.","timestamp":1774995094437,"segment":0,"confidence":4.489795918367347,"iterationTokens":5322,"asi":{"hypothesis":"Style/LineEndConcatenation should be a low-risk operator rewrite win: replace offense operators at end-of-line string concatenations with backslash continuations.","cop":"Style/LineEndConcatenation","focus_area":"Style cops with selector/operator rewrites","test_scope":"cargo test --lib -- cop::style::line_end_concatenation","learning":"Existing detection already isolates safe multiline string concat shapes, so autocorrect only needs operator-token replacement at computed line offsets.","safety":"Autocorrect is bounded to existing offense lines and rewrites only the operator token (`+` or `<<`) to `\\`; no surrounding text or line structure changes.","next_action_hint":"Continue style operator/token rewrite lane with another bounded candidate from the missing set (e.g., Style/KeywordArgumentsMerging or Style/StringConcatenation conservative subset)."}}
{"run":202,"commit":"cc25c54","metric":151,"metrics":{"nitrocop_autocorrectable_cops":308,"implemented_core_rubocop_autocorrectable":458,"core_overlap_autocorrectable":307,"core_rubocop_autocorrect_total":467},"status":"keep","description":"Enable autocorrect for Style/KeywordArgumentsMerging by rewriting offense `**receiver.merge(...)` kw-splats to direct merged keyword args (`**receiver, ...`); add corrected fixture and autocorrect tests.","timestamp":1774995349370,"segment":0,"confidence":4.510204081632653,"iterationTokens":7496,"asi":{"hypothesis":"Style/KeywordArgumentsMerging should be a bounded style operator rewrite candidate where replacing merge-call kw-splats with direct keyword args yields a safe -1 metric gain.","cop":"Style/KeywordArgumentsMerging","focus_area":"Style cops with selector/operator rewrites","test_scope":"cargo test --lib -- cop::style::keyword_arguments_merging","learning":"Replacing the full assoc-splat range with `**receiver` plus normalized merge arguments (preserving keyword pairs and `**` splats, adding `**` for bare hash-variable args) matches fixture behavior.","safety":"Autocorrect only runs on existing offense paths (keyword hash first element assoc-splat whose value is receiver.merge(...), block-pass exclusions retained); detection semantics unchanged.","next_action_hint":"Continue style selector/operator lane with another bounded candidate from missing set, then revisit Lint/Naming once style low-hanging fruit thins."}}
{"run":203,"commit":"c64f313","metric":150,"metrics":{"nitrocop_autocorrectable_cops":309,"implemented_core_rubocop_autocorrectable":458,"core_overlap_autocorrectable":308,"core_rubocop_autocorrect_total":467},"status":"keep","description":"Enable autocorrect for Lint/ImplicitStringConcatenation by replacing offense adjacency gaps between same-line string literals with ` + `; add corrected fixture and autocorrect tests.","timestamp":1774995534592,"segment":0,"confidence":4.530612244897959,"iterationTokens":17503,"asi":{"hypothesis":"ImplicitStringConcatenation can gain conservative autocorrect parity with a token-gap rewrite that converts implicit adjacent literals into explicit `+` concatenation.","cop":"Lint/ImplicitStringConcatenation","focus_area":"Style cops with selector/operator rewrites","test_scope":"cargo test --lib -- cop::lint::implicit_string_concatenation","learning":"The cop already identifies consecutive same-line string parts; autocorrect can be deterministic via range replacement from previous part end to current part start.","safety":"Corrections are limited to detected same-line implicit string concatenation pairs and only rewrite the separator gap; string content and quote styles remain unchanged.","next_action_hint":"Continue with bounded token/operator rewrite targets in remaining Style/Lint set; keep Layout deferred."}}
{"run":1,"commit":"c60e987","metric":149,"metrics":{"nitrocop_autocorrectable_cops":310,"implemented_core_rubocop_autocorrectable":458,"core_overlap_autocorrectable":309,"core_rubocop_autocorrect_total":467},"status":"keep","description":"Enable autocorrect for Lint/ElseLayout by moving offense same-line else-body code to a new indented line via bounded separator rewrite; add corrected fixture and autocorrect tests.","timestamp":1774995698840,"segment":0,"confidence":null,"iterationTokens":null,"asi":{"hypothesis":"Lint/ElseLayout can gain safe autocorrect parity through a localized rewrite of the `else`-to-first-statement gap (`else foo` -> `else\\n  foo`) on already-detected offenses.","cop":"Lint/ElseLayout","focus_area":"Style cops with selector/operator rewrites","test_scope":"cargo test --lib -- cop::lint::else_layout","learning":"Using `else_keyword_loc.end..first_stmt.start` replacement with indentation derived from else column gives deterministic corrections while preserving statement source.","safety":"Autocorrect only applies to existing offenses where first else statement shares else line; then-style single-statement exemptions remain unchanged.","next_action_hint":"Continue with non-layout bounded rewrites in remaining Style/Lint/Naming set; keep layout-heavy transformations deferred."}}
{"run":2,"commit":"c60e987","metric":148,"metrics":{"nitrocop_autocorrectable_cops":311,"implemented_core_rubocop_autocorrectable":458,"core_overlap_autocorrectable":310,"core_rubocop_autocorrect_total":467},"status":"checks_failed","description":"Attempted autocorrect for Lint/HeredocMethodCallPosition by moving method-call suffix to heredoc opening line, but autocorrect fixture output is incorrect despite metric improvement.","timestamp":1774995963619,"segment":0,"confidence":null,"iterationTokens":8600,"asi":{"hypothesis":"HeredocMethodCallPosition looked like a bounded token relocation opportunity (`<<~ID\\n...\\nID\\n.strip` -> `<<~ID.strip\\n...\\nID`).","cop":"Lint/HeredocMethodCallPosition","focus_area":"Style cops with selector/operator rewrites","test_scope":"cargo test --lib -- cop::lint::heredoc_method_call_position","rollback_reason":"Targeted autocorrect fixture failed; rewrite corrupted heredoc structure (`<<~SQLSELECT ...`). Cannot keep a semantically incorrect autocorrect just for metric gain.","next_action_hint":"Revert and pivot to a safer bounded cop (e.g., Naming/MemoizedInstanceVariableName conservative subset or another Lint token-local rewrite with straightforward range edits).","learning":"Prism location slices for heredoc receiver/call boundaries do not map trivially to full opening+body spans; safe autocorrect likely needs line-oriented parsing of opener/body/terminator, not naive location concatenation."}}
{"run":3,"commit":"eaee782","metric":148,"metrics":{"nitrocop_autocorrectable_cops":311,"implemented_core_rubocop_autocorrectable":458,"core_overlap_autocorrectable":310,"core_rubocop_autocorrect_total":467},"status":"keep","description":"Enable conservative autocorrect for Naming/MemoizedInstanceVariableName by renaming offense ivar tokens in memoization sites (`@x ||=`, defined?/return/assignment pattern) to method-name-derived targets; add autocorrect unit coverage.","timestamp":1774996463155,"segment":0,"confidence":null,"iterationTokens":25508,"asi":{"hypothesis":"MemoizedInstanceVariableName can be made autocorrectable with bounded token-local ivar replacements at existing offense locations, avoiding broad AST rewrites.","cop":"Naming/MemoizedInstanceVariableName","focus_area":"Style cops with selector/operator rewrites","test_scope":"cargo test --lib -- cop::naming::memoized_instance_variable_name","learning":"Threading corrections through existing check_or_write/check_defined_memoized paths enables deterministic replacements while preserving all detection gates and style config handling.","safety":"Autocorrect is restricted to currently flagged ivar name locations (`name_loc` / ivar reads in defined pattern); no detection broadening or structural rewrites.","next_action_hint":"Prune completed Naming idea and continue with remaining low-risk non-layout targets (Style/RedundantCondition conservative subset or Lint token-local candidates)."}}
{"run":207,"commit":"906ad0f","metric":147,"metrics":{"nitrocop_autocorrectable_cops":312,"implemented_core_rubocop_autocorrectable":458,"core_overlap_autocorrectable":311,"core_rubocop_autocorrect_total":467},"status":"keep","description":"Enable conservative autocorrect for Style/RedundantCondition by rewriting offense-matched `if cond ... else ... end` / ternary forms where condition equals true-branch to `cond || else_expr`, plus no-else `if cond; cond; end` to `cond`; add corrected fixture and autocorrect tests.","timestamp":1774996768306,"segment":0,"confidence":4.5,"iterationTokens":25508,"asi":{"hypothesis":"Style/RedundantCondition can be made autocorrectable with bounded full-node rewrites for the simplest redundant-condition shapes without touching assignment/method/unless branches.","cop":"Style/RedundantCondition","focus_area":"Style cops with selector/operator rewrites","test_scope":"cargo test --lib -- cop::style::redundant_condition","learning":"Using full-if-node replacement for the condition-equals-true-branch pattern and no-else identity pattern provides deterministic corrections and avoids fragile branch-local edits.","safety":"Autocorrect remains conservative: only pattern-1 (`condition == true branch`) and no-else identity are corrected; other offense patterns remain diagnostics-only.","result_metric":147,"next_action_hint":"Continue style selector/operator lane with another bounded non-layout target, likely Style/StringConcatenation conservative subset."}}
{"run":208,"commit":"94863f2","metric":146,"metrics":{"nitrocop_autocorrectable_cops":313,"implemented_core_rubocop_autocorrectable":458,"core_overlap_autocorrectable":312,"core_rubocop_autocorrect_total":467},"status":"keep","description":"Enable conservative autocorrect for Style/YodaExpression by swapping offense-matched binary operands (`const OP expr` -> `expr OP const`) for simple one-argument operator calls, with corrected fixture and autocorrect tests.","timestamp":1774996984714,"segment":0,"confidence":4.475247524752476,"iterationTokens":13710,"asi":{"hypothesis":"Style/YodaExpression can gain core autocorrect parity with bounded whole-node rewrites for simple operator-call offenses while leaving multi-arg and splat/block-arg cases unchanged.","cop":"Style/YodaExpression","focus_area":"Style cops with selector/operator rewrites","test_scope":"cargo test --lib -- cop::style::yoda_expression","learning":"A safe subset is achieved by replacing only offense call spans when the operator call has exactly one normal argument and no block, using source-preserving operand swap.","safety":"Autocorrect remains conservative: multi-argument operator calls and splat/block-arg forms are still offense-only; nested-offense suppression logic remains intact.","result_metric":146,"next_action_hint":"Continue style selector/operator lane with another bounded non-layout target (e.g., Style/SafeNavigation or Style/StringConcatenation conservative subset)."}}
{"run":209,"commit":"53f85c3","metric":145,"metrics":{"nitrocop_autocorrectable_cops":314,"implemented_core_rubocop_autocorrectable":458,"core_overlap_autocorrectable":313,"core_rubocop_autocorrect_total":467},"status":"keep","description":"Enable conservative autocorrect for Lint/LambdaWithoutLiteralBlock by replacing offense-matched no-receiver `lambda(<arg>)`/`lambda(&<expr>)` calls with the underlying argument expression, while leaving receiver and complex forms offense-only; add corrected fixture and autocorrect tests.","timestamp":1774997216634,"segment":0,"confidence":4.450980392156863,"iterationTokens":9689,"asi":{"hypothesis":"A bounded whole-call replacement for simple `lambda` calls without literal blocks (`lambda(x)` -> `x`, `lambda(&pr)` -> `pr`) can safely make Lint/LambdaWithoutLiteralBlock autocorrectable.","cop":"Lint/LambdaWithoutLiteralBlock","focus_area":"Style cops with selector/operator rewrites","test_scope":"cargo test --lib -- cop::lint::lambda_without_literal_block","learning":"Post-processing at check_source visitor level works well: emit full-call replacements only for no-receiver, single-argument/block-argument offenses and keep receiver calls unchanged.","safety":"Autocorrect is intentionally conservative: receiver calls (e.g., `@obj.lambda(...)`), zero-arg forms, and non-offense symbol-proc forms remain untouched.","result_metric":145,"next_action_hint":"Return to Style selector/operator rewrite lane for next iteration (e.g., Style/StringConcatenation conservative subset)."}}
{"run":1,"commit":"4a732e3","metric":144,"metrics":{"nitrocop_autocorrectable_cops":315,"implemented_core_rubocop_autocorrectable":458,"core_overlap_autocorrectable":314,"core_rubocop_autocorrect_total":467},"status":"keep","description":"Enable conservative autocorrect for Style/StringConcatenation by rewriting offense-matched simple literal-plus-expression forms to interpolation (`'prefix_' + expr` / `\"prefix\" + expr` -> `\"prefix#{expr}\"`) while leaving complex chain/heredoc/percent-literal cases offense-only; add corrected fixture and autocorrect tests.","timestamp":1774997467212,"segment":0,"confidence":null,"iterationTokens":null,"asi":{"hypothesis":"Style/StringConcatenation can become counted as autocorrectable via bounded full-node interpolation rewrites for simple two-part string concatenations without broadening risky chain behavior.","cop":"Style/StringConcatenation","focus_area":"Style cops with selector/operator rewrites","test_scope":"cargo test --lib -- cop::style::string_concatenation","learning":"A minimal safe subset (receiver is plain quoted StringNode, exactly one non-string argument) yields deterministic corrections and avoids chain/heredoc ambiguity.","safety":"Autocorrect intentionally excludes complex forms (multi-arg, receiver-call chains, percent literals, heredoc/multiline-sensitive cases) by only emitting on strict simple-string receiver patterns.","ideas_pruned":"Removed completed Style/StringConcatenation idea and replaced it with next conservative Style/SafeNavigation candidate.","result_metric":144,"next_action_hint":"Continue style selector/operator lane by evaluating Style/SafeNavigation conservative local rewrite subset."}}
{"run":211,"commit":"dad932a","metric":142,"metrics":{"nitrocop_autocorrectable_cops":317,"implemented_core_rubocop_autocorrectable":458,"core_overlap_autocorrectable":316,"core_rubocop_autocorrect_total":467},"status":"keep","description":"Enable autocorrect for Layout/SpaceBeforeBrackets by deleting offense-matched whitespace gaps between receiver and `[` across `[]` calls and index write-node variants; add corrected fixture and autocorrect tests.","timestamp":1774998999863,"segment":0,"confidence":4.509803921568627,"iterationTokens":9689,"asi":{"hypothesis":"Layout/SpaceBeforeBrackets should be a low-risk delimiter/whitespace win: remove only the receiver-to-bracket whitespace span on already-flagged offenses.","cop":"Layout/SpaceBeforeBrackets","focus_area":"Layout cops with delimiter/whitespace edits","test_scope":"cargo test --lib -- cop::layout::space_before_brackets","learning":"Threading a mutable correction sink through shared gap-check helpers allows deterministic correction emission for both CallNode and Call*Write/Index*Write variants without changing detection logic.","safety":"Autocorrect is bounded to whitespace-only receiver-to-bracket gaps and skips dotted `.[]` calls exactly as before.","next_action_hint":"Continue layout delimiter/whitespace lane with another bounded token-gap cop from missing set (likely Layout/SpaceAroundMethodCallOperator or Layout/SpaceInLambdaLiteral)."}}
{"run":212,"commit":"0bf71f9","metric":141,"metrics":{"nitrocop_autocorrectable_cops":318,"implemented_core_rubocop_autocorrectable":458,"core_overlap_autocorrectable":317,"core_rubocop_autocorrect_total":467},"status":"keep","description":"Enable autocorrect for Layout/SpaceAroundMethodCallOperator by deleting offense-matched whitespace gaps around `.`, `&.`, and `::` operators on same-line forms; add corrected fixture and autocorrect tests.","timestamp":1774999297343,"segment":0,"confidence":4.485436893203883,"iterationTokens":7247,"asi":{"hypothesis":"Layout/SpaceAroundMethodCallOperator should be another safe delimiter/whitespace win by removing only whitespace spans adjacent to already-flagged call/path operators.","cop":"Layout/SpaceAroundMethodCallOperator","focus_area":"Layout cops with delimiter/whitespace edits","test_scope":"cargo test --lib -- cop::layout::space_around_method_call_operator","learning":"A shared helper that emits diagnostics and optional correction deletions for gap ranges works cleanly for both call operators and constant-path delimiter spacing.","safety":"Autocorrect is limited to same-line whitespace-only gaps validated by existing checks; multiline dot-position forms remain untouched.","next_action_hint":"Continue layout delimiter/whitespace lane with another bounded gap-token cop, likely Layout/SpaceInLambdaLiteral or Layout/SpaceBeforeFirstArg."}}
{"run":213,"commit":"596839e","metric":140,"metrics":{"nitrocop_autocorrectable_cops":319,"implemented_core_rubocop_autocorrectable":458,"core_overlap_autocorrectable":318,"core_rubocop_autocorrect_total":467},"status":"keep","description":"Enable autocorrect for Layout/SpaceInLambdaLiteral by normalizing `->` parameter-gap spacing per style (`require_no_space` removes gaps, `require_space` inserts one space) on offense-matched lambdas with real params; add corrected fixture and autocorrect tests.","timestamp":1774999475558,"segment":0,"confidence":4.461538461538462,"iterationTokens":5878,"asi":{"hypothesis":"Layout/SpaceInLambdaLiteral should be a bounded delimiter-spacing win by editing only the `->`-to-params gap on already-flagged lambdas.","cop":"Layout/SpaceInLambdaLiteral","focus_area":"Layout cops with delimiter/whitespace edits","test_scope":"cargo test --lib -- cop::layout::space_in_lambda_literal","learning":"One shared offense helper can emit either empty-string deletion or single-space insertion over the same arrow-gap range, covering both enforced styles while preserving existing parameter-shape guards.","safety":"Autocorrect applies only to lambdas already flagged by current checks (real params required, empty-params skipped) and only rewrites the arrow-gap range.","next_action_hint":"Continue layout delimiter/whitespace lane with another low-risk gap-normalization cop, likely Layout/SpaceBeforeFirstArg or Layout/SpaceBeforeBrackets/MethodCallOperator adjacent family."}}
