{"run":103,"commit":"a03df1e","metric":247,"metrics":{"nitrocop_autocorrectable_cops":212,"implemented_core_rubocop_autocorrectable":458,"core_overlap_autocorrectable":211,"core_rubocop_autocorrect_total":467},"status":"keep","description":"Enable autocorrect for Lint/DisjunctiveAssignmentInConstructor by replacing flagged leading `@ivar ||= ...` operators in `initialize` with plain `=` assignments while preserving existing stop-at-first-non-`||=` behavior.","timestamp":1774911746125,"segment":0,"confidence":4.8076923076923075,"iterationTokens":2371,"asi":{"hypothesis":"DisjunctiveAssignmentInConstructor offenses are safe operator-local rewrites because the cop already restricts to leading ivar `||=` lines in constructors where plain assignment is equivalent.","cops":"Lint/DisjunctiveAssignmentInConstructor","learning":"Swapping only the `||=` operator token to `=` gives deterministic corrections without touching RHS expressions or constructor control-flow.","test_scope":"cargo test --lib -- cop::lint::disjunctive_assignment_in_constructor","next_action_hint":"Continue harvesting lint cops with token-local rewrites (`operator`/`selector` replacement) before tackling layout-heavy fixes."}}
{"run":101,"commit":"e47b0a7","metric":247,"metrics":{"nitrocop_autocorrectable_cops":212,"implemented_core_rubocop_autocorrectable":458,"core_overlap_autocorrectable":211,"core_rubocop_autocorrect_total":467},"status":"keep","description":"Resume coordinated Lint lane by enabling autocorrect for Lint/LiteralInInterpolation (replace `#{literal}` with equivalent in-string literal text for safe literal types), while including concurrent in-tree Lint/DisjunctiveAssignmentInConstructor autocorrect updates.","timestamp":1774911749899,"segment":0,"confidence":5,"iterationTokens":10160,"asi":{"hypothesis":"Literal-in-interpolation offenses can be safely autocorrected by replacing each embedded-literal span with an escaped literal string fragment, preserving final string content.","coordination":"Stayed on Lint to avoid overlap with other researcher’s Style/Layout path; included concurrent disjunctive-assignment lint work already in tree.","cops":"Lint/LiteralInInterpolation,Lint/DisjunctiveAssignmentInConstructor","test_scope":"cargo test --lib -- cop::lint::literal_in_interpolation && cargo test --lib -- cop::lint::disjunctive_assignment_in_constructor","learning":"Embedding-span replacement (`embedded.location`) plus lightweight double-quoted escaping is sufficient for primitive literal interpolation cases covered by fixture offenses.","next_action_hint":"Continue with remaining low-risk Lint cops where replacements are line-local or direct token substitutions; keep ambiguous regex/operator precedence cops conservative."}}
{"run":104,"commit":"2936d55","metric":245,"metrics":{"nitrocop_autocorrectable_cops":214,"implemented_core_rubocop_autocorrectable":458,"core_overlap_autocorrectable":213,"core_rubocop_autocorrect_total":467},"status":"keep","description":"Enable autocorrect for Lint/RaiseException by replacing offending `Exception`/`::Exception` constants (including `Exception.new`) with `StandardError`/`::StandardError` in `raise`/`fail` calls.","timestamp":1774911987026,"segment":0,"confidence":4.884615384615385,"iterationTokens":22614,"asi":{"hypothesis":"RaiseException can be corrected safely with constant-token replacement because detection already narrows to bare `Exception` references in supported `raise`/`fail` forms.","cops":"Lint/RaiseException","learning":"Replacing only the exception constant span preserves call structure and arguments while aligning with RuboCop’s `StandardError` autocorrect strategy, including root-scoped forms.","test_scope":"cargo test --lib -- cop::lint::raise_exception","next_action_hint":"Keep targeting lint cops where offense matching identifies a precise constant/operator token to rewrite."}}
{"run":102,"commit":"ce7528f","metric":245,"metrics":{"nitrocop_autocorrectable_cops":214,"implemented_core_rubocop_autocorrectable":458,"core_overlap_autocorrectable":213,"core_rubocop_autocorrect_total":467},"status":"keep","description":"Resume coordinated Lint lane by enabling autocorrect for Lint/IncompatibleIoSelectWithFiberScheduler (rewrite simple `IO.select` read/write single-IO patterns to `wait_readable`/`wait_writable`), while including concurrent in-tree Lint/RaiseException autocorrect updates.","timestamp":1774911991858,"segment":0,"confidence":4.980392156862745,"iterationTokens":15858,"asi":{"hypothesis":"Single-IO `IO.select` compatibility offenses have deterministic replacement templates and are safe to autocorrect as full-call rewrites.","coordination":"Stayed on Lint lane to avoid overlap with other autoresearcher’s Style/Layout work; included concurrent RaiseException changes already present in tree.","cops":"Lint/IncompatibleIoSelectWithFiberScheduler,Lint/RaiseException","test_scope":"cargo test --lib -- cop::lint::incompatible_io_select_with_fiber_scheduler && cargo test --lib -- cop::lint::raise_exception","learning":"Full-call replacement is robust here because preferred replacement string is already computed from parsed argument shape and optional timeout.","next_action_hint":"Continue low-risk Lint cops with explicit template rewrites or line-local deletions; defer ambiguity-heavy precedence/regexp cops."}}
{"run":105,"commit":"085905b","metric":243,"metrics":{"nitrocop_autocorrectable_cops":216,"implemented_core_rubocop_autocorrectable":458,"core_overlap_autocorrectable":215,"core_rubocop_autocorrect_total":467},"status":"keep","description":"Enable autocorrect for Lint/UselessOr by replacing flagged `||` expressions with their left-hand side when the left side is guaranteed truthy under the cop’s detection rules.","timestamp":1774912240175,"segment":0,"confidence":4.961538461538462,"iterationTokens":8314,"asi":{"hypothesis":"UselessOr offenses have a deterministic behavior-preserving rewrite per RuboCop: replace the offending `or` expression with its lhs source span.","cops":"Lint/UselessOr","learning":"Whole-expression replacement using `or_node.location()` and `lhs` source works for direct truthy lhs and nested-parenthesized patterns already recognized by the cop.","test_scope":"cargo test --lib -- cop::lint::useless_or","next_action_hint":"Continue with cops where offense spans and canonical replacements are already explicit (token/range substitution), then revisit more structural style/layout rewrites."}}
{"run":106,"commit":"333234c","metric":242,"metrics":{"nitrocop_autocorrectable_cops":217,"implemented_core_rubocop_autocorrectable":458,"core_overlap_autocorrectable":216,"core_rubocop_autocorrect_total":467},"status":"keep","description":"Enable autocorrect for Lint/AmbiguousOperatorPrecedence by wrapping flagged higher-precedence subexpressions with parentheses in mixed-precedence logical/arithmetic expressions.","timestamp":1774912740172,"segment":0,"confidence":4.90566037735849,"iterationTokens":45762,"asi":{"hypothesis":"AmbiguousOperatorPrecedence offenses can be corrected via bounded parenthesizing of the offending child expression span, matching RuboCop’s wrap strategy.","cops":"Lint/AmbiguousOperatorPrecedence","learning":"Two zero-width insertions at offending child start/end offsets are enough to stabilize mixed precedence parsing across `&&/||`, keyword `and/or`, and arithmetic parent/child operator combinations.","test_scope":"cargo test --lib -- cop::lint::ambiguous_operator_precedence","next_action_hint":"Continue with ambiguity cops where parser-selected offense nodes can be safely wrapped without altering inner tokens."}}
{"run":103,"commit":"606c335","metric":242,"metrics":{"nitrocop_autocorrectable_cops":217,"implemented_core_rubocop_autocorrectable":458,"core_overlap_autocorrectable":216,"core_rubocop_autocorrect_total":467},"status":"keep","description":"Enable autocorrect for Lint/Loop by rewriting begin/end while|until loops to `loop do ... break unless|if condition ... end`, with corrected fixture coverage.","timestamp":1774912970215,"segment":0,"confidence":5,"iterationTokens":29617,"asi":{"hypothesis":"Begin/end modifier while/until offenses can be safely autocorrected via deterministic whole-node rewrite to Kernel#loop with trailing conditional break.","coordination":"Stayed on Lint lane to avoid overlap with concurrent Style/Layout-focused autoresearch work.","cops":"Lint/Loop","test_scope":"cargo test --lib -- cop::lint::loop_cop","learning":"Prism begin-modifier loop bodies include a nested BeginNode in statements; autocorrect must unwrap inner statements and re-indent body lines when building loop replacement.","next_action_hint":"Continue with low-risk remaining Lint cops (line-local/token-local rewrites), then reassess conservative Style backlog if Lint easy wins taper."}}
{"run":104,"commit":"81ddaef","metric":241,"metrics":{"nitrocop_autocorrectable_cops":218,"implemented_core_rubocop_autocorrectable":458,"core_overlap_autocorrectable":217,"core_rubocop_autocorrect_total":467},"status":"keep","description":"Enable conservative autocorrect for Lint/AssignmentInCondition (AllowSafeAssignment mode) by wrapping offending assignment expressions in parentheses, with corrected fixture coverage.","timestamp":1774913394698,"segment":0,"confidence":5.038461538461538,"iterationTokens":22776,"asi":{"hypothesis":"AssignmentInCondition can safely autocorrect by parenthesizing flagged assignment expressions only when AllowSafeAssignment semantics apply.","coordination":"Stayed on Lint lane to avoid Style/Layout overlap and kept detection semantics unchanged.","cops":"Lint/AssignmentInCondition","test_scope":"cargo test --lib -- cop::lint::assignment_in_condition","learning":"Parenthesizing assignment node ranges matches RuboCop-safe behavior; some writes (e.g., constant path with `||`) require wrapping the full assignment expression as parsed, not only lhs/rhs fragment.","ideas_pruned":"Removed tried AssignmentInCondition idea from autoresearch.ideas.md.","next_action_hint":"Continue with low-risk remaining Lint cops (token/line-local rewrites) and avoid ambiguous regex/operator transforms without tight safety bounds."}}
{"run":107,"commit":"59f3af4","metric":239,"metrics":{"nitrocop_autocorrectable_cops":220,"implemented_core_rubocop_autocorrectable":458,"core_overlap_autocorrectable":219,"core_rubocop_autocorrect_total":467},"status":"keep","description":"Enable autocorrect for Lint/AmbiguousOperatorPrecedence (parenthesize flagged subexpressions) and Lint/SymbolConversion (replace redundant .to_sym/.intern and quoted-symbol forms with canonical symbol syntax), with corrected fixture coverage.","timestamp":1774913942246,"segment":0,"confidence":4.925925925925926,"iterationTokens":45762,"asi":{"hypothesis":"Two bounded autocorrect implementations in remaining Lint cops should yield a real -2 on missing_core_autocorrect_cops without semantic overreach.","cops":"Lint/AmbiguousOperatorPrecedence,Lint/SymbolConversion","test_scope":"cargo test --lib -- cop::lint::ambiguous_operator_precedence && cargo test --lib -- cop::lint::symbol_conversion && cargo test --lib -- cop::lint::assignment_in_condition","learning":"AmbiguousOperatorPrecedence can safely autocorrect via zero-width wrapping edits around offending child expression ranges; SymbolConversion supports deterministic full-node replacements for redundant conversion and quoted-symbol/hash-key forms.","safety":"Kept rewrites localized to offense node/message spans; no detection broadening."}}
{"run":108,"commit":"710ccf6","metric":237,"metrics":{"nitrocop_autocorrectable_cops":222,"implemented_core_rubocop_autocorrectable":458,"core_overlap_autocorrectable":221,"core_rubocop_autocorrect_total":467},"status":"keep","description":"Enable autocorrect for Lint/AmbiguousOperator (parenthesize first-argument ambiguous prefix operators) and Style/CommentedKeyword (remove inline keyword comments; move retained comments above keyword lines when safe), with corrected fixture coverage.","timestamp":1774914429369,"segment":0,"confidence":5,"iterationTokens":42999,"asi":{"hypothesis":"Two bounded rewrites—argument parenthesizing for parser-flagged ambiguous prefixes and line-local comment extraction for commented keywords—should safely reduce missing_core_autocorrect_cops by 2.","cops":"Lint/AmbiguousOperator,Style/CommentedKeyword","test_scope":"cargo test --lib -- cop::lint::ambiguous_operator && cargo test --lib -- cop::style::commented_keyword","learning":"AmbiguousOperator autocorrect is stable by replacing the method-to-first-arg gap with `(` and inserting `)` at the final argument end; CommentedKeyword can preserve comment text for begin/class/module/def by moving the trailing comment to the previous line while deleting it for `end`.","safety":"Kept edits to explicit offense spans; no broad AST restructuring."}}
{"run":109,"commit":"b739994","metric":236,"metrics":{"nitrocop_autocorrectable_cops":223,"implemented_core_rubocop_autocorrectable":458,"core_overlap_autocorrectable":222,"core_rubocop_autocorrect_total":467},"status":"keep","description":"Enable autocorrect for Style/PercentLiteralDelimiters by rewriting only the opening/closing %-literal delimiter bytes to configured preferred delimiters when the cop already deems replacement safe.","timestamp":1774914759353,"segment":0,"confidence":5.037037037037037,"iterationTokens":23980,"asi":{"hypothesis":"Delimiter-only rewrites in PercentLiteralDelimiters are bounded and should reduce missing_core_autocorrect_cops by 1 without semantic drift.","cop":"Style/PercentLiteralDelimiters","test_scope":"cargo test --lib -- cop::style::percent_literal_delimiters","learning":"Replacing just the opener delimiter byte (`%w{` -> `%w[`) and final closer byte keeps literal contents intact and matches fixture parity when content-contains-delimiter guards pass.","safety":"No content rewrites; correction is limited to delimiter tokens already validated by existing guard checks."}}
{"run":110,"commit":"75a22a4","metric":235,"metrics":{"nitrocop_autocorrectable_cops":224,"implemented_core_rubocop_autocorrectable":458,"core_overlap_autocorrectable":223,"core_rubocop_autocorrect_total":467},"status":"keep","description":"Enable autocorrect for Style/FloatDivision across enforced styles by removing redundant `.to_f`, adding missing side coercion where required, and rewriting to `fdiv(...)` in fdiv mode.","timestamp":1774915046798,"segment":0,"confidence":4.9818181818181815,"iterationTokens":19176,"asi":{"hypothesis":"FloatDivision already computes style-specific offense conditions; adding matching localized corrections should produce a safe -1 parity gain.","cop":"Style/FloatDivision","test_scope":"cargo test --lib -- cop::style::float_division","learning":"Single/left/right coerce styles are handled by adding/removing `.to_f` selector spans, while `fdiv` mode is most robust as a full-call replacement using operands with `.to_f` stripped.","safety":"Corrections are constrained to call-level `.to_f` tokens or whole offending division call in fdiv mode, reusing existing offense gating."}}
{"run":111,"commit":"dbb58fe","metric":234,"metrics":{"nitrocop_autocorrectable_cops":225,"implemented_core_rubocop_autocorrectable":458,"core_overlap_autocorrectable":224,"core_rubocop_autocorrect_total":467},"status":"keep","description":"Enable autocorrect for Style/DigChain by collapsing one chained `dig` layer into a single `dig` call with combined arguments (one-pass fixture behavior).","timestamp":1774915317589,"segment":0,"confidence":4.928571428571429,"iterationTokens":6997,"asi":{"hypothesis":"DigChain offenses can be corrected with deterministic full-call replacement that merges inner and outer `dig` argument lists.","cop":"Style/DigChain","test_scope":"cargo test --lib -- cop::style::dig_chain","learning":"Replacing the offending outer call with `<base>.dig(<inner_args>, <outer_args>)` is stable and matches current one-pass autocorrect fixture expectations for pairwise chain collapse.","safety":"Autocorrect is gated by existing offense checks (no hash/keyword-hash args, chain shape validation) and edits only the offending call span."}}
{"run":112,"commit":"71421ea","metric":233,"metrics":{"nitrocop_autocorrectable_cops":226,"implemented_core_rubocop_autocorrectable":458,"core_overlap_autocorrectable":225,"core_rubocop_autocorrect_total":467},"status":"keep","description":"Enable autocorrect for Style/RandomWithOffset by rewriting `rand`+offset arithmetic and `rand(...).succ/next/pred` forms to equivalent range-based `rand(left..right)` calls.","timestamp":1774915613775,"segment":0,"confidence":4.964285714285714,"iterationTokens":14559,"asi":{"hypothesis":"RandomWithOffset patterns are deterministic integer/range transforms, so full-expression replacement to explicit `rand(range)` should safely close another Style gap.","cop":"Style/RandomWithOffset","test_scope":"cargo test --lib -- cop::style::random_with_offset","learning":"Using normalized rand-call bounds (int argument -> 0..n-1, range with exclusive-end adjustment) allows consistent offset math across `+`, `-`, and succ/next/pred rewrites.","safety":"Autocorrect only applies when existing detection confirms rand-call + integer/range operands; replacement is a single call-range expression."}}
{"run":113,"commit":"93b6304","metric":232,"metrics":{"nitrocop_autocorrectable_cops":227,"implemented_core_rubocop_autocorrectable":458,"core_overlap_autocorrectable":226,"core_rubocop_autocorrect_total":467},"status":"keep","description":"Enable autocorrect for Style/OperatorMethodCall by replacing the redundant dot before binary operator method names with a space in offense-matched forms.","timestamp":1774915809696,"segment":0,"confidence":5,"iterationTokens":6930,"asi":{"hypothesis":"OperatorMethodCall offenses can be corrected with a minimal token rewrite (`.` -> space) at the operator-call separator.","cop":"Style/OperatorMethodCall","test_scope":"cargo test --lib -- cop::style::operator_method_call","learning":"For offense-matched non-parenthesized operator-method calls, replacing only `call_operator_loc` preserves surrounding operands and yields canonical infix form without broader rewrite risk.","safety":"Autocorrect only runs after existing guard checks that already skip constant receivers, nested parenthesized forms, and invalid splat/kwsplat argument shapes."}}
{"run":114,"commit":"7879d35","metric":231,"metrics":{"nitrocop_autocorrectable_cops":228,"implemented_core_rubocop_autocorrectable":458,"core_overlap_autocorrectable":227,"core_rubocop_autocorrect_total":467},"status":"keep","description":"Enable autocorrect for Style/SignalException by swapping bare `fail`/`raise` keyword tokens per EnforcedStyle, and refresh autoresearch snapshot/ideas docs to reflect latest parity state.","timestamp":1774916036322,"segment":0,"confidence":4.947368421052632,"iterationTokens":6920,"asi":{"hypothesis":"SignalException offenses are token-local keyword substitutions, so autocorrect should safely reduce missing_core_autocorrect_cops by 1 while preserving custom-fail guard behavior.","cop":"Style/SignalException","test_scope":"cargo test --lib -- cop::style::signal_exception","learning":"Applying corrections directly at reported message-token offsets works for both styles (`only_raise` and `only_fail`) after diagnostics are finalized, so custom-fail suppression logic remains intact.","safety":"Correction runs only when emitted offense message matches known style swap and source token matches expected keyword."}}
{"run":115,"commit":"c53dd5b","metric":230,"metrics":{"nitrocop_autocorrectable_cops":229,"implemented_core_rubocop_autocorrectable":458,"core_overlap_autocorrectable":228,"core_rubocop_autocorrect_total":467},"status":"keep","description":"Enable autocorrect for Style/EachForSimpleLoop by converting parenthesized fixed integer ranges in `.each {}` loops to equivalent `N.times {}` forms and renaming `.each` to `.times`.","timestamp":1774916294643,"segment":0,"confidence":4.896551724137931,"iterationTokens":6920,"asi":{"hypothesis":"EachForSimpleLoop offenses are deterministic count-based rewrites; replacing the range receiver with computed iteration count and selector `each`->`times` should safely reduce missing core autocorrect cops.","cop":"Style/EachForSimpleLoop","test_scope":"cargo test --lib -- cop::style::each_for_simple_loop","learning":"For empty-parameter blocks over literal integer ranges, iteration count can be derived as `right-left+1` (inclusive) or `right-left` (exclusive), clamped at zero, then rewritten to `N.times` without changing loop body.","safety":"Autocorrect remains gated by existing offense detection (integer literal range + no block params + parenthesized receiver)."}}
{"run":116,"commit":"401b5d7","metric":229,"metrics":{"nitrocop_autocorrectable_cops":230,"implemented_core_rubocop_autocorrectable":458,"core_overlap_autocorrectable":229,"core_rubocop_autocorrect_total":467},"status":"keep","description":"Enable autocorrect for Style/SendWithLiteralMethodName by rewriting literal `public_send`/`send`/`__send__` calls to equivalent direct method calls while preserving receiver/operator and trailing arguments.","timestamp":1774916564588,"segment":0,"confidence":4.931034482758621,"iterationTokens":9834,"asi":{"hypothesis":"SendWithLiteralMethodName offenses are mostly call-syntax normalization, so deterministic full-call replacement should safely reduce missing core autocorrect cops.","cop":"Style/SendWithLiteralMethodName","test_scope":"cargo test --lib -- cop::style::send_with_literal_method_name","learning":"Constructing replacement from receiver source + call operator + literal method name plus remaining args yields stable direct-call output for fixture-covered patterns.","safety":"Autocorrect is limited to already-validated literal method names and skips explicit block-body forms to avoid structural rewrites."}}
