{"run":185,"commit":"a941ec1","metric":175,"metrics":{"nitrocop_autocorrectable_cops":284,"implemented_core_rubocop_autocorrectable":458,"core_overlap_autocorrectable":283,"core_rubocop_autocorrect_total":467},"status":"keep","description":"Enable autocorrect for Lint/AmbiguousBlockAssociation by parenthesizing the offense-matched last argument call-with-block to force unambiguous block binding; add corrected fixture and autocorrect tests.","timestamp":1774986858146,"segment":0,"confidence":4.377777777777778,"iterationTokens":10867,"asi":{"hypothesis":"AmbiguousBlockAssociation can gain safe autocorrect parity by inserting parentheses around the already-identified ambiguous last argument span.","cop":"Lint/AmbiguousBlockAssociation","test_scope":"cargo test --lib -- cop::lint::ambiguous_block_association","learning":"Two zero-width insertions at inner argument start/end are sufficient to preserve original argument source while resolving block association ambiguity.","safety":"Autocorrect is restricted to existing offense shapes (outer call without parens, last arg call with real block and no inner args, plus existing allowlist/pattern guards).","next_action_hint":"Continue Remaining Lint/Security/Naming lane with another bounded rewrite cop (e.g., EmptyConditionalBody or OrderedMagicComments custom test path)."}}
{"run":1,"commit":"3ab636c","metric":174,"metrics":{"nitrocop_autocorrectable_cops":285,"implemented_core_rubocop_autocorrectable":458,"core_overlap_autocorrectable":284,"core_rubocop_autocorrect_total":467},"status":"keep","description":"Enable autocorrect for Lint/UnescapedBracketInRegexp by escaping offense-matched bare `]` tokens to `\\]` in regex content segments; add corrected fixture and autocorrect tests; prune stale ideas backlog entries.","timestamp":1774987055734,"segment":0,"confidence":null,"iterationTokens":null,"asi":{"hypothesis":"UnescapedBracketInRegexp can safely become autocorrectable with a token-local replacement of each offense `]` to `\\]`, preserving regex structure and existing scanner guards.","cop":"Lint/UnescapedBracketInRegexp","test_scope":"cargo test --lib -- cop::lint::unescaped_bracket_in_regexp","learning":"Using scanner-computed byte offsets for offending unescaped brackets allows deterministic one-token rewrites across regular and interpolated regexp literal segments.","safety":"Autocorrect only applies at existing offense locations emitted by current extended-mode/comment-aware scanner; no detection broadening.","ideas_pruned":"Removed stale completed ideas (TrailingBodyOnModule, TrailingBodyOnMethodDefinition) and refreshed backlog toward remaining non-layout Lint/Naming targets.","next_action_hint":"Continue with another low-risk missing Lint/Naming cop, preferring bounded token or delimiter rewrites over structural transformations."}}
{"run":2,"commit":"d227d6d","metric":173,"metrics":{"nitrocop_autocorrectable_cops":286,"implemented_core_rubocop_autocorrectable":458,"core_overlap_autocorrectable":285,"core_rubocop_autocorrect_total":467},"status":"keep","description":"Enable autocorrect for Lint/OrderedMagicComments by swapping encoding and frozen-string magic comment line text when encoding appears later; add targeted autocorrect scenario tests (basic, coding, shebang).","timestamp":1774987244077,"segment":0,"confidence":null,"iterationTokens":5295,"asi":{"hypothesis":"OrderedMagicComments can safely become autocorrectable with a bounded two-line swap for the already-detected misordered magic comments in header comment blocks.","cop":"Lint/OrderedMagicComments","test_scope":"cargo test --lib -- cop::lint::ordered_magic_comments","learning":"Line-range replacements using source line offsets (excluding newline bytes) cleanly swap magic comment order while preserving shebang position and surrounding code.","safety":"Autocorrect applies only when both encoding and frozen-string comments were detected and ordering offense exists; edits are limited to those two comment lines.","next_action_hint":"Continue Lint/Naming lane with another low-risk token-local cop (e.g., EmptyConditionalBody or DuplicateRegexpCharacterClassElement conservative subset)."}}
{"run":188,"commit":"bf5934c","metric":165,"metrics":{"nitrocop_autocorrectable_cops":294,"implemented_core_rubocop_autocorrectable":458,"core_overlap_autocorrectable":293,"core_rubocop_autocorrect_total":467},"status":"keep","description":"Enable autocorrect for Style/InverseMethods via selector/operator rewrites on offense-matched negations (`!foo.any?` -> `foo.none?`, `!(x == y)` -> `x != y`) and block inversion rewrites (`select/reject` with negated last expression); add corrected fixture and autocorrect tests.","timestamp":1774992254376,"segment":0,"confidence":4.5,"iterationTokens":5295,"asi":{"hypothesis":"Style/InverseMethods should be a high-yield style selector/operator rewrite candidate: replacing inverse selectors/operators on already-detected negated calls can safely make the cop autocorrectable and reduce missing_core_autocorrect_cops by 1.","cop":"Style/InverseMethods","focus_area":"Style cops with selector/operator rewrites","test_scope":"cargo test --lib -- cop::style::inverse_methods","learning":"Whole-call replacement for outer negation (`!`/`not`) with inner call selector swap is robust across predicate and operator forms; block inversion can be handled with two localized edits (method selector + last-negated-expression rewrite).","safety":"Autocorrect remains constrained to existing offense paths (double-negation and unsafe-nav guards unchanged; block path still requires negated last expression and no `next`).","result_metric":165}}
{"run":189,"commit":"5855a47","metric":164,"metrics":{"nitrocop_autocorrectable_cops":295,"implemented_core_rubocop_autocorrectable":458,"core_overlap_autocorrectable":294,"core_rubocop_autocorrect_total":467},"status":"keep","description":"Enable autocorrect for Style/SelectByRegexp by rewriting offense-matched regexp-filter blocks to `grep`/`grep_v` call forms (including negated `!~` handling); add corrected fixture and autocorrect tests.","timestamp":1774992516260,"segment":0,"confidence":4.521739130434782,"iterationTokens":8585,"asi":{"hypothesis":"Style/SelectByRegexp should fit the selector/operator rewrite lane by replacing `select`/`filter`/`find_all`/`reject` block forms with equivalent `grep`/`grep_v` calls using the offense regexp argument.","cop":"Style/SelectByRegexp","focus_area":"Style cops with selector/operator rewrites","test_scope":"cargo test --lib -- cop::style::select_by_regexp","learning":"A deterministic whole-call replacement works by extracting the regexp operand from the block body match expression and mapping method+negation polarity to grep/grep_v.","safety":"Autocorrect remains bounded to existing offense constraints: single-parameter block, single-expression body with regexp matcher call, and non-hash receivers.","result_metric":164}}
{"run":190,"commit":"8c8fc0c","metric":163,"metrics":{"nitrocop_autocorrectable_cops":296,"implemented_core_rubocop_autocorrectable":458,"core_overlap_autocorrectable":295,"core_rubocop_autocorrect_total":467},"status":"keep","description":"Enable autocorrect for Style/RedundantSort by rewriting offense-matched `sort/sort_by...first/last/[0]/[-1]/at/slice` chains via selector swap (`sort` -> `min/max`, `sort_by` -> `min_by/max_by`) plus accessor-tail removal; add corrected fixture and autocorrect tests.","timestamp":1774992682109,"segment":0,"confidence":4.494623655913978,"iterationTokens":5975,"asi":{"hypothesis":"Style/RedundantSort should be another strong selector rewrite win: replacing only the sorter selector and deleting the trailing accessor chain should preserve blocks/args while matching RuboCop corrections.","cop":"Style/RedundantSort","focus_area":"Style cops with selector/operator rewrites","test_scope":"cargo test --lib -- cop::style::redundant_sort","learning":"Two disjoint edits (message_loc selector replacement + remove outer accessor suffix from sort-call end to outer-call end) robustly handle single-line and multiline chains.","safety":"Autocorrect remains restricted to existing offense checks (only sort/sort_by receiver chains with first/last/[0]/[-1]/at/slice). Non-offense forms still return early.","result_metric":163}}
{"run":1,"commit":"b70dd13","metric":162,"metrics":{"nitrocop_autocorrectable_cops":297,"implemented_core_rubocop_autocorrectable":458,"core_overlap_autocorrectable":296,"core_rubocop_autocorrect_total":467},"status":"keep","description":"Enable autocorrect for Style/RedundantRegexpArgument by replacing offense-matched deterministic regexp literals (including `%r` slash/bang forms and escaped literal chars) with equivalent double-quoted string arguments; add corrected fixture and autocorrect tests.","timestamp":1774992914688,"segment":0,"confidence":null,"iterationTokens":null,"asi":{"hypothesis":"A conservative literal-preserving rewrite from deterministic regexp argument content to quoted strings should make Style/RedundantRegexpArgument autocorrectable without changing detection behavior.","cop":"Style/RedundantRegexpArgument","focus_area":"Style cops with selector/operator rewrites","test_scope":"cargo test --lib -- cop::style::redundant_regexp_argument","learning":"Decoding only literal escapes from regexp content and re-escaping for double-quoted strings is sufficient for current offense coverage, including `/\\./`, `/\\-/`, `/\\//`, `//`, and `%r!foo!` forms.","safety":"Autocorrect runs only on already-flagged deterministic regexps with no flags and preserves all existing skip guards (single-space regex, non-deterministic whitelist failures).","result_metric":162}}
{"run":2,"commit":"eb3f85f","metric":161,"metrics":{"nitrocop_autocorrectable_cops":298,"implemented_core_rubocop_autocorrectable":458,"core_overlap_autocorrectable":297,"core_rubocop_autocorrect_total":467},"status":"keep","description":"Enable autocorrect for Style/RedundantSelf by deleting offense-matched `self.` receiver/operator spans while preserving existing shadowing/keyword/kernel/setter guards; add corrected fixture and autocorrect tests.","timestamp":1774993081675,"segment":0,"confidence":null,"iterationTokens":9122,"asi":{"hypothesis":"Removing the `self.` token range on already-flagged redundant-self calls should be a safe local rewrite and reduce missing_core_autocorrect_cops by one.","cop":"Style/RedundantSelf","focus_area":"Style cops with selector/operator rewrites","test_scope":"cargo test --lib -- cop::style::redundant_self","learning":"A direct range deletion from self-receiver start through call operator end (`self.`) cleanly autocorrects both bare and chained redundant calls (`self.name.demodulize`).","safety":"Autocorrect uses existing offense gating only; no changes to local-shadow, keyword/kernel allowlists, setter exclusions, or block/lambda scope handling.","result_metric":161}}
{"run":3,"commit":"d7d29f7","metric":160,"metrics":{"nitrocop_autocorrectable_cops":299,"implemented_core_rubocop_autocorrectable":458,"core_overlap_autocorrectable":298,"core_rubocop_autocorrect_total":467},"status":"keep","description":"Enable autocorrect for Style/RedundantLineContinuation by deleting offense-matched trailing continuation backslashes in code regions while preserving existing detection heuristics; add corrected fixture and autocorrect tests.","timestamp":1774993214626,"segment":0,"confidence":2,"iterationTokens":3833,"asi":{"hypothesis":"RedundantLineContinuation should be safely autocorrectable with a token-local deletion of the offending trailing `\\` byte at each reported location.","cop":"Style/RedundantLineContinuation","focus_area":"Style cops with selector/operator rewrites","test_scope":"cargo test --lib -- cop::style::redundant_line_continuation","learning":"Using the already-computed `backslash_offset` makes autocorrect deterministic and keeps behavior constrained to code_map-validated code regions, avoiding strings/comments.","safety":"Autocorrect only removes the exact offending continuation token and does not alter surrounding whitespace or line contents.","result_metric":160}}
{"run":194,"commit":"b354905","metric":159,"metrics":{"nitrocop_autocorrectable_cops":300,"implemented_core_rubocop_autocorrectable":458,"core_overlap_autocorrectable":299,"core_rubocop_autocorrect_total":467},"status":"keep","description":"Enable autocorrect for Style/RedundantArgument by deleting redundant single default argument parens on offense-matched calls (e.g., `join('')`, `sum(0)`, `split(\" \")`) and add corrected fixture + autocorrect tests.","timestamp":1774993479290,"segment":0,"confidence":4.484210526315789,"iterationTokens":3833,"asi":{"hypothesis":"Style/RedundantArgument should be a low-risk style rewrite: remove the single redundant argument list `(arg)` for already-detected redundant-default calls.","cop":"Style/RedundantArgument","focus_area":"Style cops with selector/operator rewrites","test_scope":"cargo test --lib -- cop::style::redundant_argument","learning":"Conservative parenthesized-call correction (`opening_loc..closing_loc` -> empty) reliably preserves receiver and optional block bodies while matching fixture expectations.","safety":"Autocorrect is limited to existing offense shapes (exactly one redundant arg; skip block-pass `&arg`) and only emits corrections when both call paren locs exist.","next_action_hint":"Continue style selector/operator lane with another bounded rewrite cop in the remaining missing set (e.g., MethodCallWithArgsParentheses omit-style subset or StringLiteralsInInterpolation token rewrites)."}}
{"run":195,"commit":"afc67bc","metric":158,"metrics":{"nitrocop_autocorrectable_cops":301,"implemented_core_rubocop_autocorrectable":458,"core_overlap_autocorrectable":300,"core_rubocop_autocorrect_total":467},"status":"keep","description":"Enable autocorrect for Style/RedundantSelfAssignment by replacing offense-matched self-assignment expressions (`x = x.concat(...)`, `other.foo = other.foo.concat(...)`) with the in-place call expression and add corrected fixture + autocorrect tests.","timestamp":1774993649055,"segment":0,"confidence":4.458333333333333,"iterationTokens":14094,"asi":{"hypothesis":"Style/RedundantSelfAssignment should be safely autocorrectable via whole-node replacement to RHS mutating call for already-flagged redundant assignments.","cop":"Style/RedundantSelfAssignment","focus_area":"Style cops with selector/operator rewrites","test_scope":"cargo test --lib -- cop::style::redundant_self_assignment","learning":"Whole-assignment replacement with RHS call source is robust for local/instance/class/global variable assignments and attribute-assignment forms already constrained by existing detection.","safety":"Autocorrect remains bounded to offense-matched nodes only; block-pass and non-returning-self method guards are unchanged.","next_action_hint":"Continue style selector/operator lane on remaining Style missing cops with local rewrites (e.g., MethodCallWithArgsParentheses conservative omit-style subset)."}}
{"run":196,"commit":"eba8979","metric":157,"metrics":{"nitrocop_autocorrectable_cops":302,"implemented_core_rubocop_autocorrectable":458,"core_overlap_autocorrectable":301,"core_rubocop_autocorrect_total":467},"status":"keep","description":"Enable autocorrect for Style/MethodCallWithArgsParentheses in require_parentheses mode by inserting offense-matched call/yield parens around argument lists; add corrected fixture and autocorrect tests.","timestamp":1774993980694,"segment":0,"confidence":4.479166666666667,"iterationTokens":14094,"asi":{"hypothesis":"Style/MethodCallWithArgsParentheses can reduce missing core autocorrect cops via bounded token insertions for require-parentheses offenses (`foo bar` -> `foo(bar)`, `yield x` -> `yield(x)`) while preserving detection logic.","cop":"Style/MethodCallWithArgsParentheses","focus_area":"Style cops with selector/operator rewrites","test_scope":"cargo test --lib -- cop::style::method_call_with_args_parentheses","learning":"Using `message_loc/end` + `arguments` range for calls and `keyword_loc/end` + `arguments` range for yields gives deterministic two-edit corrections (open-paren gap replacement + closing-paren insertion) including multiline chained-call offenses.","safety":"Autocorrect is constrained to already-detected require_parentheses offenses with argument lists; no omit-parentheses behavior or macro-scope detection logic changed.","next_action_hint":"Continue style selector/operator lane on remaining Style cops with localized rewrites (e.g., StringLiteralsInInterpolation token rewrite or other one-range style swaps)."}}
{"run":197,"commit":"097efbb","metric":156,"metrics":{"nitrocop_autocorrectable_cops":303,"implemented_core_rubocop_autocorrectable":458,"core_overlap_autocorrectable":302,"core_rubocop_autocorrect_total":467},"status":"keep","description":"Enable autocorrect for Style/MethodCallWithoutArgsParentheses by deleting offense-matched empty call parens on no-arg calls; add corrected fixture and autocorrect tests.","timestamp":1774994136766,"segment":0,"confidence":4.5,"iterationTokens":9216,"asi":{"hypothesis":"Style/MethodCallWithoutArgsParentheses should reduce missing_core_autocorrect_cops via localized delimiter deletion (`foo()` -> `foo`) on already-flagged no-arg calls.","cop":"Style/MethodCallWithoutArgsParentheses","focus_area":"Style cops with selector/operator rewrites","test_scope":"cargo test --lib -- cop::style::method_call_without_args_parentheses","learning":"Existing offense guards (same-name assignment, default-arg, it()-block exemptions, allowed patterns) keep corrections safe; autocorrect only needs removing `opening_loc` and `closing_loc` tokens.","safety":"Autocorrect is constrained to current offense shapes with empty argument lists and no block; detection logic unchanged.","next_action_hint":"Continue Style lane with another local rewrite cop from the missing set (e.g., Style/AccessModifierDeclarations or Style/StringLiteralsInInterpolation)."}}
{"run":1,"commit":"5b3b7a2","metric":155,"metrics":{"nitrocop_autocorrectable_cops":304,"implemented_core_rubocop_autocorrectable":458,"core_overlap_autocorrectable":303,"core_rubocop_autocorrect_total":467},"status":"keep","description":"Enable autocorrect for Style/StringLiteralsInInterpolation by rewriting offense-matched double-quoted literals inside interpolation to equivalent single-quoted literals under existing safety guards; add corrected fixture + autocorrect tests and prune stale ideas backlog entries.","timestamp":1774994349376,"segment":0,"confidence":null,"iterationTokens":null,"asi":{"hypothesis":"Style/StringLiteralsInInterpolation should be a safe style-token rewrite candidate: for offenses already gated by `needs_double_quotes == false`, replace `\"...\"` with equivalent `'...'` and keep detection unchanged.","cop":"Style/StringLiteralsInInterpolation","focus_area":"Style cops with selector/operator rewrites","test_scope":"cargo test --lib -- cop::style::string_literals_in_interpolation","learning":"A conservative converter that only unescapes `\\\"` and preserves `\\\\` is sufficient for current offense shapes because the cop already excludes content requiring double-quote semantics.","safety":"Autocorrect only applies in single_quotes mode to existing offenses inside interpolation; xstr/regexp and escape-safety guards are unchanged.","ideas_pruned":"Removed stale completed idea for MethodCallWithArgsParentheses and refreshed backlog with remaining non-layout candidates.","next_action_hint":"Continue style lane with another bounded rewrite candidate from backlog (IfWithSemicolon or AccessModifierDeclarations conservative subset)."}}
{"run":2,"commit":"6fbfe98","metric":154,"metrics":{"nitrocop_autocorrectable_cops":305,"implemented_core_rubocop_autocorrectable":458,"core_overlap_autocorrectable":304,"core_rubocop_autocorrect_total":467},"status":"keep","description":"Enable conservative autocorrect for Style/AccessModifierDeclarations by splitting offense-matched inline access-modifier defs (`private/protected/public def ...`) into grouped declarations on their own line; add corrected fixture + autocorrect tests.","timestamp":1774994524522,"segment":0,"confidence":null,"iterationTokens":10591,"asi":{"hypothesis":"Style/AccessModifierDeclarations can become safely autocorrectable with a bounded rewrite that only targets already-flagged inline modifier+def forms in group style.","cop":"Style/AccessModifierDeclarations","focus_area":"Style cops with selector/operator rewrites","test_scope":"cargo test --lib -- cop::style::access_modifier_declarations","learning":"Replacing the offense span from modifier start through `def` start with `modifier + newline + same indent` preserves method body/indent and avoids touching symbol/attr variants.","safety":"Autocorrect is restricted to current group-style inline offenses where first argument is a `DefNode`; non-def inline/symbol/attr cases remain diagnostics-only.","next_action_hint":"Continue style lane with next bounded non-layout target (IfWithSemicolon conservative semicolon span rewrite or another token-local style cop)."}}
