{"run":62,"commit":"9670ced","metric":297,"metrics":{"nitrocop_autocorrectable_cops":162,"implemented_core_rubocop_autocorrectable":458,"core_overlap_autocorrectable":161,"core_rubocop_autocorrect_total":467},"status":"keep","description":"Enable autocorrect for Style/HashSlice by rewriting supported `select/filter` block patterns (`k == value` and `include?(k)`) to `slice(...)`/`slice(*...)`.","timestamp":1774901978991,"segment":0,"confidence":4.285714285714286,"iterationTokens":7201,"asi":{"hypothesis":"Current HashSlice offense patterns can be corrected by replacing the selector-through-block segment with direct `slice` calls.","cops":"Style/HashSlice","learning":"Block-end bounded replacement from `message_loc` handled both equality and include-pattern offenses cleanly while preserving receiver expressions.","test_scope":"cargo test --lib -- cop::style::hash_slice","next_action_hint":"Continue incremental Style rewrites with strict AST-shape guards; avoid broad layout and ambiguous-regex transforms for now."}}
{"run":63,"commit":"a0e6781","metric":296,"metrics":{"nitrocop_autocorrectable_cops":163,"implemented_core_rubocop_autocorrectable":458,"core_overlap_autocorrectable":162,"core_rubocop_autocorrect_total":467},"status":"keep","description":"Enable autocorrect for Style/HashFetchChain by replacing chained `fetch(..., nil/{}/Hash.new)` segments with a single `dig(...)` call over collected keys.","timestamp":1774902149036,"segment":0,"confidence":4.222222222222222,"iterationTokens":6288,"asi":{"hypothesis":"Existing HashFetchChain chain-walk metadata can drive a bounded selector-to-end replacement with equivalent `dig(...)` arguments.","cops":"Style/HashFetchChain","learning":"Using outermost fetch selector offset plus terminal call end offset produced stable rewrites for 2- and 3-level chains, including multiline receivers.","test_scope":"cargo test --lib -- cop::style::hash_fetch_chain","next_action_hint":"Next candidates should remain AST-shape-local and token/selector bounded; keep deferring layout and high-ambiguity lint transforms."}}
{"run":64,"commit":"05d7629","metric":295,"metrics":{"nitrocop_autocorrectable_cops":164,"implemented_core_rubocop_autocorrectable":458,"core_overlap_autocorrectable":163,"core_rubocop_autocorrect_total":467},"status":"keep","description":"Enable autocorrect for Style/HashExcept by rewriting supported `reject/select/filter` key-comparison block patterns to direct `except(...)` calls.","timestamp":1774902323378,"segment":0,"confidence":4.277777777777778,"iterationTokens":6401,"asi":{"hypothesis":"HashExcept offense shapes can use the same bounded selector-to-block replacement pattern as HashSlice with `except(...)` target calls.","cops":"Style/HashExcept","learning":"Block-end replacement from call selector handled reject/select/filter comparison cases deterministically and matched fixture autocorrect output.","test_scope":"cargo test --lib -- cop::style::hash_except","next_action_hint":"Continue similar hash-subset style cops and keep ambiguity/layout-heavy cops deferred."}}
{"run":65,"commit":"644c26b","metric":294,"metrics":{"nitrocop_autocorrectable_cops":165,"implemented_core_rubocop_autocorrectable":458,"core_overlap_autocorrectable":164,"core_rubocop_autocorrect_total":467},"status":"keep","description":"Enable autocorrect for Style/FetchEnvVar by replacing flagged `ENV[...]` accesses with `ENV.fetch(..., nil)` while preserving existing suppression logic for flag/comparison/guarded uses.","timestamp":1774902649400,"segment":0,"confidence":4.333333333333333,"iterationTokens":2736,"asi":{"hypothesis":"FetchEnvVar offenses are safe node-local rewrites: every reported `ENV[...]` can be replaced with `ENV.fetch(...)` using configured nil-default behavior.","cops":"Style/FetchEnvVar","learning":"Adding correction emission in the existing visitor preserved complex suppression behavior (conditions, ||-lhs, predicates, quote-normalized key guards) while enabling deterministic autocorrect on offense fixtures.","test_scope":"cargo test --lib -- cop::style::fetch_env_var","next_action_hint":"Continue with similarly bounded Style cops where offense spans already map directly to replacement expressions; defer ambiguous parser/language semantics."}}
{"run":66,"commit":"468278a","metric":293,"metrics":{"nitrocop_autocorrectable_cops":166,"implemented_core_rubocop_autocorrectable":458,"core_overlap_autocorrectable":165,"core_rubocop_autocorrect_total":467},"status":"keep","description":"Enable autocorrect for Style/ArrayFirstLast on bracket-read offenses by rewriting `[0]`/`[-1]` (including explicit `.[]`/`&.[]` forms) to `first`/`last` while leaving index-write diagnostics offense-only.","timestamp":1774902919556,"segment":0,"confidence":4.388888888888889,"iterationTokens":12676,"asi":{"hypothesis":"ArrayFirstLast read-style `[]` offenses can be corrected with bounded selector-to-call-end replacement, while index-write shapes should remain uncorrected for safety.","cops":"Style/ArrayFirstLast","learning":"Using `message_loc..call.end` with operator-aware replacement (`.first`/`.last` vs `first`/`last` for explicit dot/safe-nav calls) produced stable corrections across chained and explicit bracket syntax.","test_scope":"cargo test --lib -- cop::style::array_first_last","next_action_hint":"Continue with direct selector/block-tail rewrites in remaining Style cops; keep write-assignment and layout-heavy transformations conservative."}}
{"run":67,"commit":"ffae1aa","metric":292,"metrics":{"nitrocop_autocorrectable_cops":167,"implemented_core_rubocop_autocorrectable":458,"core_overlap_autocorrectable":166,"core_rubocop_autocorrect_total":467},"status":"keep","description":"Enable autocorrect for Style/NegativeArrayIndex by rewriting `arr[arr.length/size/count - n]` and supported range-end subtraction forms to negative-index equivalents.","timestamp":1774903133385,"segment":0,"confidence":4.444444444444445,"iterationTokens":10203,"asi":{"hypothesis":"NegativeArrayIndex offense ranges already isolate index/range expressions that can be safely replaced with `-n` and `..-n`/`...-n` forms.","cops":"Style/NegativeArrayIndex","learning":"Applying corrections at argument-range granularity preserved receiver/method chains and produced stable rewrites for both simple and parenthesized range patterns.","test_scope":"cargo test --lib -- cop::style::negative_array_index","next_action_hint":"Keep targeting style cops with explicit expression-span replacements and avoid broad layout or ambiguous parse rewrites."}}
{"run":68,"commit":"09da7da","metric":291,"metrics":{"nitrocop_autocorrectable_cops":168,"implemented_core_rubocop_autocorrectable":458,"core_overlap_autocorrectable":167,"core_rubocop_autocorrect_total":467},"status":"keep","description":"Enable autocorrect for Style/NestedFileDirname by collapsing nested `File.dirname(...)` chains into single `dirname(path, level)` selector-tail rewrites.","timestamp":1774903328055,"segment":0,"confidence":4.378378378378378,"iterationTokens":5317,"asi":{"hypothesis":"NestedFileDirname offenses can be safely corrected by replacing from outer `dirname` selector through call end with computed `dirname(inner, depth)` form.","cops":"Style/NestedFileDirname","learning":"Existing nesting analysis already computes innermost path and level, so adding selector-tail replacement yielded deterministic autocorrect across 2-level and 3-level nests.","test_scope":"cargo test --lib -- cop::style::nested_file_dirname","next_action_hint":"Continue with other selector-tail style rewrites where message already provides exact replacement shape."}}
{"run":69,"commit":"a117056","metric":290,"metrics":{"nitrocop_autocorrectable_cops":169,"implemented_core_rubocop_autocorrectable":458,"core_overlap_autocorrectable":168,"core_rubocop_autocorrect_total":467},"status":"keep","description":"Enable autocorrect for Style/HashAsLastArrayItem by wrapping unbraced trailing hash elements in braces (and unwrapping in no_braces mode when applicable).","timestamp":1774903678555,"segment":0,"confidence":4.315789473684211,"iterationTokens":18261,"asi":{"hypothesis":"HashAsLastArrayItem offenses map to localized last-element rewrites, enabling safe node-span corrections without altering array structure.","cops":"Style/HashAsLastArrayItem","learning":"Direct last-node replacement (`{ ... }` wrapping in braces mode, brace stripping in no_braces mode) passed fixture autocorrect while preserving existing skip guards (kwsplat/all-hash/adjacent-hash).","test_scope":"cargo test --lib -- cop::style::hash_as_last_array_item","next_action_hint":"Continue with expression-local Style rewrites and maintain conservative handling for layout and ambiguous-lint domains."}}
{"run":70,"commit":"e0eb070","metric":289,"metrics":{"nitrocop_autocorrectable_cops":170,"implemented_core_rubocop_autocorrectable":458,"core_overlap_autocorrectable":169,"core_rubocop_autocorrect_total":467},"status":"keep","description":"Enable autocorrect for Style/OrAssignment by rewriting detected `x = x || y` and `x = x ? x : y` patterns to `x ||= y`.","timestamp":1774904000812,"segment":0,"confidence":4.368421052631579,"iterationTokens":13069,"asi":{"hypothesis":"Existing OrAssignment offense patterns provide enough AST context to construct direct `||=` replacements over full assignment spans.","cops":"Style/OrAssignment","learning":"Assignment-span replacement using RHS extraction from `or` and ternary else branches produced stable autocorrect fixture output without broadening match logic.","test_scope":"cargo test --lib -- cop::style::or_assignment","next_action_hint":"Continue with similarly deterministic assignment/selector rewrites in remaining Style cops before touching layout-heavy classes."}}
{"run":71,"commit":"8f0a369","metric":288,"metrics":{"nitrocop_autocorrectable_cops":171,"implemented_core_rubocop_autocorrectable":458,"core_overlap_autocorrectable":170,"core_rubocop_autocorrect_total":467},"status":"keep","description":"Enable autocorrect for Style/NumericLiteralPrefix by rewriting uppercase/bare-prefix integer literals (`0X`,`0B`,`0D/0d`,`0O`, bare octal) to canonical forms while preserving sign handling and complex/rational skips.","timestamp":1774904401969,"segment":0,"confidence":4.421052631578948,"iterationTokens":9098,"asi":{"hypothesis":"NumericLiteralPrefix offenses can be safely autocorrected with full-literal replacement derived from existing prefix classification logic.","cops":"Style/NumericLiteralPrefix","learning":"Using literal-local rewrites that preserve sign prefixes (`+/-`) and apply one canonical prefix transform per offense matched fixture output and respected existing guards for underscore-decimals and trailing i/r literals.","test_scope":"cargo test --lib -- cop::style::numeric_literal_prefix","next_action_hint":"Continue with deterministic selector/literal rewrites in Style before tackling Layout or ambiguity-sensitive Lint cops."}}
{"run":72,"commit":"7497003","metric":287,"metrics":{"nitrocop_autocorrectable_cops":172,"implemented_core_rubocop_autocorrectable":458,"core_overlap_autocorrectable":171,"core_rubocop_autocorrect_total":467},"status":"keep","description":"Enable autocorrect for Style/ClassMethods by replacing class/module-name receivers in `def ClassName.method` with `self`; add corrected fixture coverage and prune stale autoresearch ideas.","timestamp":1774904631349,"segment":0,"confidence":4.473684210526316,"iterationTokens":18869,"asi":{"hypothesis":"ClassMethods offenses are safe receiver-token rewrites because the cop already verifies receiver name equals enclosing class/module.","cops":"Style/ClassMethods","learning":"Receiver-range replacement to `self` in def nodes produced stable fixture autocorrect output while preserving singleton-class suppression logic.","test_scope":"cargo test --lib -- cop::style::class_methods","ideas_pruned":"Removed stale generic file-name/refactor items and refreshed backlog toward concrete safe candidates.","next_action_hint":"Continue with hash transform cops or similarly bounded selector/block-tail rewrites; keep ambiguity/layout transformations conservative."}}
{"run":73,"commit":"6e1e9d2","metric":286,"metrics":{"nitrocop_autocorrectable_cops":173,"implemented_core_rubocop_autocorrectable":458,"core_overlap_autocorrectable":172,"core_rubocop_autocorrect_total":467},"status":"keep","description":"Enable autocorrect for Style/HashTransformKeys by rewriting detected `each_with_object({})` key-transform patterns to `transform_keys { |k| ... }`.","timestamp":1774904780014,"segment":0,"confidence":4.526315789473684,"iterationTokens":4048,"asi":{"hypothesis":"HashTransformKeys offenses are safe whole-call rewrites because current detection already enforces destructured hash params and unchanged value pass-through.","cops":"Style/HashTransformKeys","learning":"Reconstructing replacement from receiver source + extracted key expression yielded stable `transform_keys` autocorrect output for current offense fixtures without broadening detection scope.","test_scope":"cargo test --lib -- cop::style::hash_transform_keys","next_action_hint":"Attempt Style/HashTransformValues next using the same conservative whole-call replacement strategy per matched pattern variant."}}
{"run":74,"commit":"5aef397","metric":285,"metrics":{"nitrocop_autocorrectable_cops":174,"implemented_core_rubocop_autocorrectable":458,"core_overlap_autocorrectable":173,"core_rubocop_autocorrect_total":467},"status":"keep","description":"Enable autocorrect for Style/HashTransformValues by rewriting detected `each_with_object`, `Hash[map]`, `map.to_h`, and `to_h {}` value-transform patterns to `transform_values { |v| ... }`.","timestamp":1774905074703,"segment":0,"confidence":4.461538461538462,"iterationTokens":13824,"asi":{"hypothesis":"HashTransformValues offense shapes can be safely autocorrected as whole-expression rewrites because existing pattern checks already enforce unchanged keys and transformed values.","cops":"Style/HashTransformValues","learning":"Returning block extraction metadata (value arg/value expr) enabled deterministic replacements across all four detected variants, including multiline map/Hash[] forms.","test_scope":"cargo test --lib -- cop::style::hash_transform_values","next_action_hint":"Continue with similarly constrained Style cops (e.g., method/selector preference rewrites) before moving into high-risk layout/autofmt transformations."}}
{"run":75,"commit":"09dbe57","metric":284,"metrics":{"nitrocop_autocorrectable_cops":175,"implemented_core_rubocop_autocorrectable":458,"core_overlap_autocorrectable":174,"core_rubocop_autocorrect_total":467},"status":"keep","description":"Enable autocorrect for Style/ExactRegexpMatch by rewriting exact anchored literal-regexp comparisons (`=~`, `!~`, `===`, `match`, `match?`) to direct string equality/inequality checks.","timestamp":1774905321128,"segment":0,"confidence":4.4,"iterationTokens":21945,"asi":{"hypothesis":"ExactRegexpMatch offenses already guarantee anchored literal patterns, so whole-expression replacement to `==`/`!=` string comparisons is safe and deterministic.","cops":"Style/ExactRegexpMatch","learning":"Extracting the literal from `\\A...\\z` and escaping it for single-quoted Ruby strings produced stable autocorrect output across operator and `match` forms.","test_scope":"cargo test --lib -- cop::style::exact_regexp_match","next_action_hint":"Continue with Style cops that have explicit one-expression canonical forms and existing strict pattern guards."}}
{"run":76,"commit":"d81e754","metric":283,"metrics":{"nitrocop_autocorrectable_cops":176,"implemented_core_rubocop_autocorrectable":458,"core_overlap_autocorrectable":175,"core_rubocop_autocorrect_total":467},"status":"keep","description":"Enable autocorrect for Style/ClassEqualityComparison by rewriting flagged class-equality comparisons to `instance_of?` (including conservative string-class-name conversion for `.class.name` forms), and refresh autoresearch docs/ideas.","timestamp":1774905577073,"segment":0,"confidence":4.45,"iterationTokens":7916,"asi":{"hypothesis":"ClassEqualityComparison offenses can be converted with full-expression replacement when receiver class extraction is explicit and RHS class argument is safely derivable.","cops":"Style/ClassEqualityComparison","learning":"Building replacements from the underlying object receiver plus RHS class argument worked for direct class comparisons and safe `.class.name == 'Const'` cases while leaving ambiguous RHS shapes offense-only.","test_scope":"cargo test --lib -- cop::style::class_equality_comparison","ideas_pruned":"Removed completed hash-transform items and refocused backlog on remaining conservative Style/Lint/Security candidates.","next_action_hint":"Continue with small expression-local Style rewrites; keep Layout backlog staged and ambiguity-sensitive lint transforms conservative."}}
{"run":77,"commit":"42d555e","metric":282,"metrics":{"nitrocop_autocorrectable_cops":177,"implemented_core_rubocop_autocorrectable":458,"core_overlap_autocorrectable":176,"core_rubocop_autocorrect_total":467},"status":"keep","description":"Enable autocorrect for Style/ExpandPathArguments by rewriting flagged `File.expand_path(<literal>, __FILE__)` calls to the cop’s normalized `__dir__`/path form with whole-call replacement.","timestamp":1774905796103,"segment":0,"confidence":4.5,"iterationTokens":7916,"asi":{"hypothesis":"ExpandPathArguments offenses are safe full-call rewrites because the cop already restricts to literal path + `__FILE__` two-arg `File.expand_path` patterns.","cops":"Style/ExpandPathArguments","learning":"Reusing the existing suggestion builder and replacing the full send node (`receiver.suggestion`) produced stable corrected fixtures for current offense scope.","test_scope":"cargo test --lib -- cop::style::expand_path_arguments","next_action_hint":"Continue with conservative expression-local Style rewrites; keep security/lint ambiguity candidates gated behind strict semantic checks."}}
{"run":78,"commit":"18a93c3","metric":281,"metrics":{"nitrocop_autocorrectable_cops":178,"implemented_core_rubocop_autocorrectable":458,"core_overlap_autocorrectable":177,"core_rubocop_autocorrect_total":467},"status":"keep","description":"Enable autocorrect for Style/EmptyClassDefinition (class_definition style) by rewriting `Const = Class.new([Parent])` offenses to two-line `class Const < Parent` / `class Const` forms.","timestamp":1774906030660,"segment":0,"confidence":4.55,"iterationTokens":14806,"asi":{"hypothesis":"EmptyClassDefinition offenses can be safely fixed with whole-assignment replacement because detection already constrains to blockless `Class.new` constant assignments with allowed parent forms.","cops":"Style/EmptyClassDefinition","learning":"Deriving class name from assignment LHS and optional parent from `Class.new` argument produced stable corrections for simple, namespaced, absolute, and indented constant targets.","test_scope":"cargo test --lib -- cop::style::empty_class_definition","next_action_hint":"Continue with similarly explicit assignment/call canonicalizations; keep layout and semantic-risk cops deferred."}}
{"run":79,"commit":"27ac8e4","metric":280,"metrics":{"nitrocop_autocorrectable_cops":179,"implemented_core_rubocop_autocorrectable":458,"core_overlap_autocorrectable":178,"core_rubocop_autocorrect_total":467},"status":"keep","description":"Enable autocorrect for Style/ModuleMemberExistenceCheck by replacing `*_methods/constants/... .include?/member?` chains with direct predicate calls (`method_defined?`, `const_defined?`, etc.), preserving inherit-argument handling.","timestamp":1774906201060,"segment":0,"confidence":4.6,"iterationTokens":6310,"asi":{"hypothesis":"ModuleMemberExistenceCheck offenses are safe selector-to-tail rewrites because current matcher already constrains to simple single-argument include/member checks.","cops":"Style/ModuleMemberExistenceCheck","learning":"Replacing from inner method selector through outer call end with predicate calls (including optional inherit arg passthrough except explicit `true`) matched fixture behavior and RuboCop shape.","test_scope":"cargo test --lib -- cop::style::module_member_existence_check","next_action_hint":"Continue with similar one-expression style canonicalizations; avoid metric-only toggles like no-op YAMLLoad support."}}
{"run":80,"commit":"fd28d0a","metric":279,"metrics":{"nitrocop_autocorrectable_cops":180,"implemented_core_rubocop_autocorrectable":458,"core_overlap_autocorrectable":179,"core_rubocop_autocorrect_total":467},"status":"keep","description":"Enable autocorrect for Style/RedundantFormat by replacing redundant `format/sprintf` calls with direct literal/constant expressions and computed literal strings for supported simple format-specifier cases.","timestamp":1774906481973,"segment":0,"confidence":4.65,"iterationTokens":16664,"asi":{"hypothesis":"RedundantFormat offenses already isolate deterministic literal-only `format/sprintf` calls, so full-call replacement can safely preserve semantics for the supported formatter subset.","cops":"Style/RedundantFormat","learning":"Using the cop’s existing format-spec parser/renderer as the replacement source allowed stable autocorrect for single-arg redundant calls and simple multi-arg `%s/%d/%f` literal patterns.","test_scope":"cargo test --lib -- cop::style::redundant_format","next_action_hint":"Continue with style cops that already compute a canonical preferred expression internally; keep high-ambiguity lint/layout cops deferred."}}
