{"run":214,"commit":"eb9ad2c","metric":139,"metrics":{"nitrocop_autocorrectable_cops":320,"implemented_core_rubocop_autocorrectable":458,"core_overlap_autocorrectable":319,"core_rubocop_autocorrect_total":467},"status":"keep","description":"Enable autocorrect for Layout/SpaceBeforeFirstArg by normalizing offense-matched method-name/first-arg gaps to exactly one space (insert when missing, collapse tabs/multiple spaces) while preserving alignment exemptions; add corrected fixture and autocorrect tests.","timestamp":1774999739748,"segment":0,"confidence":4.480769230769231,"iterationTokens":8991,"asi":{"hypothesis":"Layout/SpaceBeforeFirstArg should become safely autocorrectable with a bounded gap replacement to a single space on already-flagged same-line calls.","cop":"Layout/SpaceBeforeFirstArg","focus_area":"Layout cops with delimiter/whitespace edits","test_scope":"cargo test --lib -- cop::layout::space_before_first_arg","learning":"A shared offense helper replacing `method_end..arg_start` with one space handles both missing-space and extra-whitespace offenses while reusing existing AllowForAlignment checks untouched.","safety":"Autocorrect runs only for existing offenses (non-operator/setter calls, same-line first arg, whitespace-only gap logic) and keeps alignment-pass behavior unchanged.","next_action_hint":"Continue layout delimiter/whitespace lane with another bounded spacing token cop, likely Layout/SpaceBeforeBrackets-adjacent or Layout/LineContinuationSpacing."}}
{"run":215,"commit":"8b028d3","metric":138,"metrics":{"nitrocop_autocorrectable_cops":321,"implemented_core_rubocop_autocorrectable":458,"core_overlap_autocorrectable":320,"core_rubocop_autocorrect_total":467},"status":"keep","description":"Enable autocorrect for Layout/LineContinuationSpacing by normalizing whitespace before continuation backslashes (`space` style inserts/collapses to one space; `no_space` removes runs) at offense-matched offsets; add corrected fixture and autocorrect tests.","timestamp":1775000020490,"segment":0,"confidence":4.5,"iterationTokens":16757,"asi":{"hypothesis":"Layout/LineContinuationSpacing should be a safe delimiter/whitespace improvement by applying token-local whitespace-gap rewrites before offense backslashes.","cop":"Layout/LineContinuationSpacing","focus_area":"Layout cops with delimiter/whitespace edits","test_scope":"cargo test --lib -- cop::layout::line_continuation_spacing","learning":"Reusing precomputed line-start offsets allows precise correction ranges for insertion at missing-space offsets and replacement/removal of contiguous whitespace runs for both styles.","safety":"Autocorrect remains bounded to existing offense branches after all current heredoc/comment/string/symbol/CRLF compatibility guards; only pre-backslash whitespace is edited.","next_action_hint":"Continue layout delimiter/whitespace lane with another bounded spacing cop, likely Layout/LineContinuationLeadingSpace or Layout/SpaceBeforeBrackets-adjacent delimiter variants."}}
{"run":216,"commit":"0ec25de","metric":137,"metrics":{"nitrocop_autocorrectable_cops":322,"implemented_core_rubocop_autocorrectable":458,"core_overlap_autocorrectable":321,"core_rubocop_autocorrect_total":467},"status":"keep","description":"Enable conservative autocorrect for Layout/LineContinuationLeadingSpace (default trailing style) by moving offense-matched leading whitespace after the continuation line’s opening quote to before the previous line’s closing quote; add corrected fixture and autocorrect tests.","timestamp":1775000400812,"segment":0,"confidence":4.476190476190476,"iterationTokens":13265,"asi":{"hypothesis":"Layout/LineContinuationLeadingSpace can gain safe delimiter/whitespace autocorrect parity with paired transfer edits that move leading continuation spaces into the previous string fragment.","cop":"Layout/LineContinuationLeadingSpace","focus_area":"Layout cops with delimiter/whitespace edits","test_scope":"cargo test --lib -- cop::layout::line_continuation_leading_space","learning":"Tracking first/second line quote positions in the dstr pair allows deterministic two-edit corrections (insert before prior closing quote + delete after next opening quote) while preserving RuboCop crash-compat guards for unsupported line shapes.","safety":"Autocorrect is constrained to existing trailing-style offenses in interpolated-string continuation pairs; leading-style behavior remains detection-only and existing skip heuristics are unchanged.","next_action_hint":"Continue layout delimiter/whitespace lane with another bounded spacing/layout token cop from the remaining missing set (e.g., SpaceBeforeBrackets-adjacent or block-end newline delimiter moves)."}}
{"run":217,"commit":"d0c1478","metric":136,"metrics":{"nitrocop_autocorrectable_cops":323,"implemented_core_rubocop_autocorrectable":458,"core_overlap_autocorrectable":322,"core_rubocop_autocorrect_total":467},"status":"keep","description":"Enable autocorrect for Layout/DotPosition by moving offense-matched call operators between receiver and selector lines (`leading` inserts before selector, `trailing` inserts after receiver) and deleting original operator token; add corrected fixture and autocorrect tests.","timestamp":1775000612912,"segment":0,"confidence":4.452830188679245,"iterationTokens":19477,"asi":{"hypothesis":"Layout/DotPosition should be a bounded delimiter-placement win by relocating only the detected call-operator token (`.`/`&.`) between adjacent receiver/selector lines.","cop":"Layout/DotPosition","focus_area":"Layout cops with delimiter/whitespace edits","test_scope":"cargo test --lib -- cop::layout::dot_position","learning":"Two disjoint edits (insert operator at target location + delete original operator span) cleanly handle both styles without touching receiver/selector text or indentation.","safety":"Autocorrect remains constrained to existing offense checks (multiline call only, no `::`, adjacent-line guard retained) and edits only operator tokens.","next_action_hint":"Continue layout delimiter/newline lane with another bounded cop from remaining set, likely Layout/BlockEndNewline or Layout/ConditionPosition."}}
{"run":218,"commit":"1ace557","metric":135,"metrics":{"nitrocop_autocorrectable_cops":324,"implemented_core_rubocop_autocorrectable":458,"core_overlap_autocorrectable":323,"core_rubocop_autocorrect_total":467},"status":"keep","description":"Enable autocorrect for Layout/BlockEndNewline by replacing the offense trailing segment before `end`/`}` with newline + opening-line indentation, moving closing delimiters onto their own line for flagged multiline blocks/lambdas; add corrected fixture and autocorrect tests.","timestamp":1775000836567,"segment":0,"confidence":4.471698113207547,"iterationTokens":7094,"asi":{"hypothesis":"Layout/BlockEndNewline should be a safe delimiter-newline improvement by rewriting only the trailing gap before flagged closing delimiters.","cop":"Layout/BlockEndNewline","focus_area":"Layout cops with delimiter/whitespace edits","test_scope":"cargo test --lib -- cop::layout::block_end_newline","learning":"Using the existing trailing-segment start locator as the correction start yields stable rewrites across body-present and params-only blocks while preserving semicolon-escape exemptions.","safety":"Autocorrect is limited to already-reported offenses (multiline blocks/lambdas where closing delimiter is not line-leading and semicolon escape is absent) and only rewrites the pre-delimiter segment.","next_action_hint":"Continue layout delimiter/newline lane with another bounded candidate from remaining set, e.g., Layout/ConditionPosition or Layout/ElseAlignment."}}
{"run":219,"commit":"fd45c1c","metric":134,"metrics":{"nitrocop_autocorrectable_cops":325,"implemented_core_rubocop_autocorrectable":458,"core_overlap_autocorrectable":324,"core_rubocop_autocorrect_total":467},"status":"keep","description":"Enable autocorrect for Layout/ConditionPosition by collapsing offense keyword-to-predicate gaps to a single space (`if`/`unless`/`elsif`/`while`/`until`) for statement-form conditionals and loops; add corrected fixture and autocorrect tests.","timestamp":1775001029073,"segment":0,"confidence":4.490566037735849,"iterationTokens":5127,"asi":{"hypothesis":"Layout/ConditionPosition should be a bounded newline/whitespace win by replacing the keyword-to-predicate span with one space on already-flagged multiline-condition heads.","cop":"Layout/ConditionPosition","focus_area":"Layout cops with delimiter/whitespace edits","test_scope":"cargo test --lib -- cop::layout::condition_position","learning":"A single correction range (`keyword.end..predicate.start`) cleanly normalizes condition placement across `if`/`while`/`until` without touching body layout or modifier-form exclusions.","safety":"Autocorrect is constrained to existing offenses only (modifier forms still skipped; diagnostics unchanged) and edits only the condition-head separator span.","next_action_hint":"Continue layout delimiter/newline lane with another bounded target from remaining set, likely Layout/ElseAlignment or Layout/RescueEnsureAlignment."}}
{"run":220,"commit":"d41e887","metric":133,"metrics":{"nitrocop_autocorrectable_cops":326,"implemented_core_rubocop_autocorrectable":458,"core_overlap_autocorrectable":325,"core_rubocop_autocorrect_total":467},"status":"keep","description":"Enable autocorrect for Layout/ElseAlignment by normalizing misaligned `else`/`elsif` line indentation to the computed reference column (if/unless/when/in/begin/def contexts) with line-leading whitespace replacement; add corrected fixture and autocorrect tests.","timestamp":1775001337240,"segment":0,"confidence":4.4672897196261685,"iterationTokens":23309,"asi":{"hypothesis":"Layout/ElseAlignment can become safely autocorrectable with bounded indentation rewrites on already-flagged keyword lines.","cop":"Layout/ElseAlignment","focus_area":"Layout cops with delimiter/whitespace edits","test_scope":"cargo test --lib -- cop::layout::else_alignment","learning":"Using keyword-start column offsets lets us replace only line-leading whitespace (`line_start..keyword_start`) to align `else`/`elsif` across multiple context-specific expected columns without touching branch bodies.","safety":"Autocorrect only applies when existing begins-its-line and alignment mismatch checks fire; compressed/minified-line skips and style-dependent expected-column logic remain unchanged.","next_action_hint":"Continue layout delimiter/newline lane with another bounded alignment cop from remaining set, likely Layout/RescueEnsureAlignment."}}
{"run":221,"commit":"598fb38","metric":132,"metrics":{"nitrocop_autocorrectable_cops":327,"implemented_core_rubocop_autocorrectable":458,"core_overlap_autocorrectable":326,"core_rubocop_autocorrect_total":467},"status":"keep","description":"Enable autocorrect for Layout/RescueEnsureAlignment by normalizing misaligned `rescue`/`ensure` keyword indentation to the computed alignment column across begin/def/class/module/sclass/do contexts (including bare def-body rescue chains); add corrected fixture and autocorrect tests.","timestamp":1775001666073,"segment":0,"confidence":4.444444444444445,"iterationTokens":11347,"asi":{"hypothesis":"Layout/RescueEnsureAlignment should be safely autocorrectable via bounded line-leading indentation rewrites on already-flagged rescue/ensure lines.","cop":"Layout/RescueEnsureAlignment","focus_area":"Layout cops with delimiter/whitespace edits","test_scope":"cargo test --lib -- cop::layout::rescue_ensure_alignment","learning":"Reusing existing alignment-column logic and replacing only `line_start..keyword_start` for offense keywords allows broad context coverage without altering rescue/ensure bodies or chain traversal semantics.","safety":"Autocorrect only runs when current misalignment checks fire (same-line skips, line-break-method alignment skip, assignment/modifier alignment heuristics unchanged) and edits only leading whitespace.","next_action_hint":"Continue layout delimiter/newline lane with another bounded alignment/layout token cop from remaining set (e.g., EndAlignment or DefEndAlignment)."}}
{"run":222,"commit":"e4ac762","metric":131,"metrics":{"nitrocop_autocorrectable_cops":328,"implemented_core_rubocop_autocorrectable":458,"core_overlap_autocorrectable":327,"core_rubocop_autocorrect_total":467},"status":"keep","description":"Enable autocorrect for Layout/EndAlignment by normalizing misaligned `end` line indentation to computed expected columns (keyword/variable/start_of_line styles) via line-leading whitespace replacement; add corrected fixture and autocorrect tests.","timestamp":1775001965769,"segment":0,"confidence":4.462962962962963,"iterationTokens":20941,"asi":{"hypothesis":"Layout/EndAlignment should become safely autocorrectable through bounded indentation rewrites on already-flagged `end` lines.","cop":"Layout/EndAlignment","focus_area":"Layout cops with delimiter/whitespace edits","test_scope":"cargo test --lib -- cop::layout::end_alignment","learning":"Refactoring keyword/end alignment checks to emit diagnostics directly with optional correction ranges (`line_start..end_col`) allows style-dependent expected-column logic to be reused unchanged while adding deterministic autocorrect.","safety":"Autocorrect only applies when existing mismatch checks fire (single-line skips, BOM normalization, assignment/operator style logic retained) and edits only leading whitespace before `end`.","next_action_hint":"Continue layout delimiter/newline lane with another bounded alignment cop from remaining set, likely Layout/DefEndAlignment."}}
{"run":223,"commit":"85a2fa3","metric":130,"metrics":{"nitrocop_autocorrectable_cops":329,"implemented_core_rubocop_autocorrectable":458,"core_overlap_autocorrectable":328,"core_rubocop_autocorrect_total":467},"status":"keep","description":"Enable autocorrect for Layout/DefEndAlignment by normalizing misaligned `end` indentation to computed target columns across `def` style and start_of_line continuation/modifier/non-modifier contexts; add corrected fixture and autocorrect tests.","timestamp":1775002232403,"segment":0,"confidence":4.481481481481482,"iterationTokens":8359,"asi":{"hypothesis":"Layout/DefEndAlignment should be safely autocorrectable through bounded line-leading whitespace rewrites on misaligned `end` lines.","cop":"Layout/DefEndAlignment","focus_area":"Layout cops with delimiter/whitespace edits","test_scope":"cargo test --lib -- cop::layout::def_end_alignment","learning":"Computing a single expected end column from existing continuation/modifier heuristics and replacing `line_start..end_col` is enough to autocorrect both keyword-aligned and statement-start-aligned def endings without changing detection logic.","safety":"Autocorrect remains constrained to already-flagged multi-line def offenses (endless/single-line defs still skipped) and only edits leading whitespace before `end`.","next_action_hint":"Continue layout delimiter/newline lane with another bounded alignment candidate from remaining set (e.g., BeginEndAlignment or CaseIndentation if correction can stay line-leading-only)."}}
{"run":224,"commit":"fd8cf2b","metric":129,"metrics":{"nitrocop_autocorrectable_cops":330,"implemented_core_rubocop_autocorrectable":458,"core_overlap_autocorrectable":329,"core_rubocop_autocorrect_total":467},"status":"keep","description":"Enable autocorrect for Layout/BeginEndAlignment by normalizing misaligned `end` indentation to the computed begin-aligned/start-of-line column through line-leading whitespace replacement; add corrected fixture and autocorrect tests.","timestamp":1775002393195,"segment":0,"confidence":4.5,"iterationTokens":4350,"asi":{"hypothesis":"Layout/BeginEndAlignment should be a low-risk alignment win by rewriting only line-leading whitespace before offense `end` keywords.","cop":"Layout/BeginEndAlignment","focus_area":"Layout cops with delimiter/whitespace edits","test_scope":"cargo test --lib -- cop::layout::begin_end_alignment","learning":"The cop’s existing expected-column computation is sufficient for autocorrect; replacing `line_start..end_col` with the expected indentation preserves body text while fixing alignment deterministically.","safety":"Autocorrect remains bounded to existing misalignment offenses (implicit/single-line begins still skipped) and edits only the indentation before `end`.","next_action_hint":"Continue layout delimiter/newline lane with another bounded indentation candidate from remaining set (e.g., CaseIndentation, ParameterAlignment, or First*Indentation family)."}}
{"run":225,"commit":"9e2bfe1","metric":128,"metrics":{"nitrocop_autocorrectable_cops":331,"implemented_core_rubocop_autocorrectable":458,"core_overlap_autocorrectable":330,"core_rubocop_autocorrect_total":467},"status":"keep","description":"Enable autocorrect for Layout/AccessModifierIndentation by normalizing misaligned bare access-modifier line indentation (`private/protected/public/module_function`) to the computed expected column; add corrected fixture and autocorrect tests.","timestamp":1775002643173,"segment":0,"confidence":4.518518518518518,"iterationTokens":5942,"asi":{"hypothesis":"Layout/AccessModifierIndentation should be a safe indentation-only gain by rewriting line-leading whitespace before flagged access-modifier calls.","cop":"Layout/AccessModifierIndentation","focus_area":"Layout cops with delimiter/whitespace edits","test_scope":"cargo test --lib -- cop::layout::access_modifier_indentation","learning":"Reusing existing expected-column logic (including end-keyword-relative alignment and IndentationWidth handling) with a `line_start..modifier_col` replacement gives deterministic corrections across class/module/block containers.","safety":"Autocorrect is limited to existing offenses (bare modifier calls only, same-line container/end skips preserved) and edits only indentation before modifier keywords.","next_action_hint":"Continue layout delimiter/whitespace lane with another bounded indentation cop from remaining set (e.g., CommentIndentation or CaseIndentation)."}}
{"run":226,"commit":"bb7c0e1","metric":126,"metrics":{"nitrocop_autocorrectable_cops":333,"implemented_core_rubocop_autocorrectable":458,"core_overlap_autocorrectable":332,"core_rubocop_autocorrect_total":467},"status":"keep","description":"Enable autocorrect for Layout/CommentIndentation by normalizing misindented comment line leading whitespace to the computed expected column (including EOF/no-next-line and keyword/body alternative rules); add corrected fixture and autocorrect tests.","timestamp":1775003790047,"segment":0,"confidence":4.513761467889908,"iterationTokens":5942,"asi":{"hypothesis":"Layout/CommentIndentation should be a bounded indentation-only autocorrect: replace only line-leading whitespace before flagged comment lines with expected indentation from existing logic.","cop":"Layout/CommentIndentation","focus_area":"Layout cops with delimiter/whitespace edits","test_scope":"cargo test --lib -- cop::layout::comment_indentation","learning":"Using comment line start offset through comment column as correction range provides deterministic fixes without touching comment text/content.","safety":"Autocorrect is constrained to offense-reported comment lines and edits only leading whitespace."}}
{"run":227,"commit":"f84bf5c","metric":125,"metrics":{"nitrocop_autocorrectable_cops":334,"implemented_core_rubocop_autocorrectable":458,"core_overlap_autocorrectable":333,"core_rubocop_autocorrect_total":467},"status":"keep","description":"Enable autocorrect for Layout/FirstArrayElementLineBreak by inserting a line break before offense-matched first elements in multiline arrays (explicit bracket and conservative implicit-assignment forms), with corrected fixture and autocorrect tests.","timestamp":1775004101315,"segment":0,"confidence":4.490909090909091,"iterationTokens":35489,"asi":{"hypothesis":"Layout/FirstArrayElementLineBreak can be made autocorrectable with bounded delimiter/newline insertion before the first element on already-detected offenses.","cop":"Layout/FirstArrayElementLineBreak","focus_area":"Layout cops with delimiter/whitespace edits","test_scope":"cargo test --lib -- cop::layout::first_array_element_line_break","learning":"Replacing the span between opening delimiter (or zero-width at first element for implicit arrays) and first element with newline + existing next-line indentation yields deterministic fixture-stable corrections.","safety":"Autocorrect remains limited to current offense conditions (multiline arrays only, existing implicit-array/assignment guards unchanged) and only rewrites the separator before the first element."}}
{"run":228,"commit":"631a83e","metric":124,"metrics":{"nitrocop_autocorrectable_cops":335,"implemented_core_rubocop_autocorrectable":458,"core_overlap_autocorrectable":334,"core_rubocop_autocorrect_total":467},"status":"keep","description":"Enable autocorrect for Layout/FirstHashElementLineBreak by inserting a line break before offense-matched first hash pairs in multiline brace hashes, with corrected fixture and autocorrect tests.","timestamp":1775004251456,"segment":0,"confidence":4.509090909090909,"iterationTokens":4194,"asi":{"hypothesis":"Layout/FirstHashElementLineBreak can be made autocorrectable with a bounded opener-to-first-element separator rewrite in multiline brace hashes.","cop":"Layout/FirstHashElementLineBreak","focus_area":"Layout cops with delimiter/whitespace edits","test_scope":"cargo test --lib -- cop::layout::first_hash_element_line_break","learning":"Replacing the span from `{` end to first element start with newline + next-line indentation provides deterministic corrections while preserving element/body content.","safety":"Autocorrect remains limited to existing offense paths (brace hashes only, multiline-only checks and AllowMultilineFinalElement behavior unchanged) and edits only the pre-first-element separator."}}
